title,source,event
#13. Aflac (AFL) | Plus | mdjonline.com,MDJOnline.com,AFL 
Fiber Optic Cables for Military and Aerospace Market Global Report ...,Argyle Report,AFL 
What $2.7m boost means to these vital clubs,Sunshine Coast Council,AFL 
"From Far North Queensland to the South East, take a look at the ...",Code,AFL 
AFL North West: Jemma Neuman named Tamworth Kangaroos' joint ...,The Northern Daily Leader,AFL 
Insider Sell: Director William Bowers Sells 23701 Shares of Aflac Inc,GuruFocus.com,AFL 
All-Australian honours for Jankovski,The North Central Review,AFL 
3 Dividend Stocks That Will Provide Income Year-Round,InvestorPlace,AFL 
EXCLUSIVE: Mia Fevola says her relationship with new boyfriend Bass Miller is 'going great' as she hits back a,Daily Mail,AFL 
Residents can donate to provide heaters for those in need,News-Press Now,AFL 
"AFGE President Everett Kelley, National Secretary-Treasurer Bunn ...",AFGE,AFL 
"Visual Fault Identifiers Market Growing Massively by Fluke, AFL ...",Argyle Report,AFL 
Brandon Presley speaks during canvass kick-off event,Clarion Ledger,AFL 
WAFL Talent Pathways | WA Football,WA Football,AFL 
Football clubs rewarded for dedicated road safety message,Lilydale Star Mail,AFL 
Dani Laidley spills on romantic Perth beach life with childhood sweetheart Donna Leckie,PerthNow,AFL 
Five memberships you need to know about in 2024,Sydney Swans,AFL 
White Men Are Saying NASCAR Discriminates Against Them With ...,Essence,AFL 
4 Accident & Health Insurance Stocks to Watch Despite Pricing Pressure,Yahoo Finance,AFL 
How Cats Rising Star has handled intense schedule,Geelong Advertiser,AFL 
America First Legal and Former Acting Director of National ...,America First Legal,AFL 
Insider Transactions and the Importance of Multiple Factors in ...,Best Stocks,AFL 
"Trivia for November 6, 2023",Fantasy Index,AFL 
Bec Judd admits she stays in a hotel every time there's a spider in her home: 'I pack up my bags',Daily Mail,AFL 
Changing of the Ruck Guard,The Mongrel Punt,AFL 
Massive Insider Trade At Aflac By Benzinga,Investing.com UK,AFL 
Aussies Know Best: The Best Betting Sports in AU – Five Reasons ...,Five Reasons Sports Network,AFL 
"First and last tries: Johns, Cronk and more",NRL.COM,NRL 
'No better feeling': Hodkinson inspiring next generation of stars,NRL.COM,NRL 
The impact the talked about NRL bids could have on Indigenous ...,National Indigenous Times,NRL 
"NRL 2023: Phil Gould slams Kangaroos, James Tedesco, pacific ...",Fox Sports,NRL 
"NRL 2023: Josh Jackson, Steve Turner, coach, Canterbury Bulldogs ...",Fox Sports,NRL 
Former NRL ace finds new home,Zero Tackle,NRL 
"NRL 2023: Off-season Central, Jayden Campbell, Des Hasler, AJ ...",Fox Sports,NRL 
"NRL 2023: Michael Maguire, NSW Blues, New Zealand Rugby ...",Fox Sports,NRL 
"NRL 2023: Mal Meninga, Australia Kangaroos, coach, contract, New ...",Fox Sports,NRL 
From Basic Research to Application: NRL Geophysicist Awarded ...,DVIDS,NRL 
Beau worries for Fermor as Campbell eyes Round 1 return,NRL.COM,NRL 
Seven reasons why Morgan Smithies will succeed in the NRL: 'The ...,Love Rugby League,NRL 
Sea Eagles reportedly sign young gun Englishman,Zero Tackle,NRL 
Demetriou opens up on Mitchell’s 2023 season,Zero Tackle,NRL 
"Two NRL coaches, 20 seasons between them - and bugger all to show for it",The Roar,NRL 
NRL star married in stunning wedding,news.com.au,NRL 
FIVE potential landing spots for Tom Dearden,Zero Tackle,NRL 
NRL news: Kalyn Ponga reflects on Dally M Medal-winning season ...,Sporting News,NRL 
Titans to focus on regional pathway development,Zero Tackle,NRL 
Former NRL star Paul Whatuira wins Shark Tank-style grant to ...,New Zealand Herald,NRL 
Nationals leader David Littleproud slams out of touch ARLC and ...,Toowoomba Chronicle,NRL 
Married At First Sight's Susie Bradley posts cringeworthy comedy skit with NRL bad boy beau Todd Carney to pro,Daily Mail,NRL 
Former Rooster returns to Australia looking for coaching job,Zero Tackle,NRL 
Roosters bad boy’s $4m home for sale,news.com.au,NRL 
Roster rater: $1.25m star can end Eels’ premiership drought,Daily Telegraph,NRL 
'What's going on?': Former NRL star's bill problem sparks unexpected career move with wife Kate,9Honey,NRL 
NRL club interested in Warrington Wolves star,Serious About Rugby League,NRL 
Kane Linnett: Hull KR second rower announces retirement from ...,Yahoo Sports,NRL 
Son of a gun Max Plath makes early Dolphins statement,The West Australian,NRL 
"Full Match Replay: Bears v Broncos - Round 4, 1988",NRL.COM,NRL 
Grand final Buzz: Cleary's 20-minute Immortal statement,Courier Mail,NRL 
Statement in response to the rise in antisemitism and other overt ...,NYSUT,AFL 
Help us improve your trip to and from the SCG,Sydney Swans,AFL 
Arizona Fall League Hot Sheet: Alcantara Keeps Mashing For Mesa ...,Baseball America,AFL 
What Can Biden Do?,The New York Times,AFL 
Micron Technology Inc Partners with Taiwan and Japan to ...,Best Stocks,AFL 
"Noosa Springs, RACV resort development plans up for council ...",Sunshine Coast Daily,AFL 
"AFLW finals 2023: Nina Morrison on finals pain, Prespakis sisters ...",Code,AFL 
El campeonato del peso ligero cerrará el 2023 de AFL,Relevo,AFL 
America First Legal Probes Biden's Department of Education Over ...,America First Legal,AFL 
The Mongrel Punt Midfield Championship Belt - 2023 in Review,The Mongrel Punt,AFL 
Bridget Fair: Foreign giants are squeezing Aussie stories off your ...,The West Australian,AFL 
North Launceston leader signs SANFL deal,Code,AFL 
Rebecca Judd and Nadia Bartel skip the Melbourne Cup... as Olivia Molly Rogers leads the stars showing off the,Daily Mail,AFL 
"WATCH: AFLW Lion cops one-game ban, set to miss final for the most ridiculously soft reason",The Roar,AFL 
St. Louis-area unions provided key support to striking UAW Local 2250 members,The Labor Tribune,AFL 
"In Virginia's new 26th Senate District, incumbent Republican McDougle faces Democrat Garner",13newsnow.com WVEC,AFL 
Diamond Sports Series,MiLB.com,AFL 
'Kaizer Chiefs have created a disease called losing! It has infected ...,Goal.com,AFL 
Service & Solidarity Spotlight: Scholastic Union (TNG-CWA) Walks ...,AFL-CIO,AFL 
"Injury Update: Steane to be assessed, positive news for McCarthy",Sydney Swans,AFL 
The NFL's Single-Season and Single-Game Rookie Records,The Analyst,AFL 
Melbourne Cup 2023 coverage on Channel 10 is slammed by racing fans: 'Since when is Eddie McGuire a racing exp,Daily Mail,AFL 
Funding secured for second stage of Macedon Ranges precinct,The North Central Review,AFL 
What AI means for ESG,Financial Times,AFL 
‘Our players deserve better opportunities’,POST-COURIER,NRL 
Wigan Warriors veteran Sam Powell set for Warrington Wolves ...,Leeds Live,NRL 
‘Give us a chance’: Clydesdales hero’s plea to NRL CEO,Toowoomba Chronicle,NRL 
Tyrone May's impressive season review gives Hull KR fans exciting glimpse into future,Hull Live,NRL 
Outgoing Wigan Warriors star Kai Pearce-Paul reveals the two sides ...,Total rugby League,NRL 
Daine Laurie returns home ready to make a point,The Western Weekender,NRL 
Kangaroos 2026: Who will play at the next World Cup for Australia?,Zero Tackle,NRL 
Panthers are milking it,Sydney Morning Herald,NRL 
Leeds Rhinos start 2024 preparation as pre-season gets underway for Rohan Smith,Leeds Live,NRL 
Perry aims to evolve her bowling as she did her batting,Yahoo Sport Australia,NRL 
Melbourne Cup 2023,Fox Sports,NRL 
'If I want to take it seriously…': The foreign threat to Australian rugby,RugbyPass,NRL 
Brad Schneider bids farewell to Hull KR after 'best four months' with special message,Hull Live,NRL 
"Melbourne Cup 2023: Fashion on the field; celebrities, sports stars ...",Fox Sports,NRL 
Bridget Fair: Foreign giants are squeezing Aussie stories off your ...,The West Australian,NRL 
Contract Briefs,Aerotech News,NRL 
Sports news in brief for 7 November,RNZ,NRL 
Saints 150: Wingmen – Tom & Tommy,St.Helens R.F.C.,NRL 
Panthers are milking it,The Age,NRL 
Aussies Know Best: The Best Betting Sports in AU – Five Reasons ...,Five Reasons Sports Network,NRL 
Kristian Woolf throws doubt on England's Samoa series and ...,Total rugby League,NRL 
Richie Myler's unexpected Leeds Rhinos exit as Championship switch confirmed,Leeds Live,NRL 
Huddersfield Giants set for pre-season boost on state-of-the-art ...,Total rugby League,NRL 
England 'camaraderie' key to whitewashing Tonga 'superstars' says ...,Total rugby League,NRL 
Blake Austin makes decision on his future after Leeds Rhinos exit,Serious About Rugby League,NRL 
Cowra Carnival of Cups shapes up as a blockbuster weekend,Harnesslink,NRL 
RivMed Wagga hosts 'best' Yandarra Festival yet,The Daily Advertiser,NRL 
St Helens ace one of four set to be banned with team-mate avoiding ...,Love Rugby League,NRL 
The very important detail you never knew about on your SodaStream,9Honey,NRL 
Nominees Revealed For 2023 Casting Guild Of Australia Awards,B&T,NRL 
Cult fried chicken shop embraces Bondi with insider’s perk,Daily Telegraph,NRL 
The Veronicas' Lisa Origliasso shares sweet wedding anniversary tribute for her actor husband Logan Huffman as,Daily Mail,AFL 
"‘If we don’t have Beshear back in there, we won’t have a firewall any more.’",Forward Kentucky,AFL 
Federal government plans regulations for nursing home staff | Reaction to mandate,11Alive.com WXIA,AFL 
Afl frá Kárahnjúkum nýtist bræðslum ekki sem skyldi og Eskja setur ...,RÚV,AFL 
"Innamorato, Rockey seek remaining votes in last stretch of ...",90.5 WESA,AFL 
Kangaroos confirm Launceston's Mia King is on track to return for final,The Examiner,AFL 
A guide to Blue Jays' pivotal offseason,MLB.com,AFL 
Arizona Fall League: Astros next wave of prospects stand out,Laredo Morning Times,AFL 
"AmaZulu, Sundowns Clash Moved To 2024 | Soccer Laduma",SNL24,AFL 
Elle McFeast’s downfall after live TV disaster,news.com.au,AFL 
Drivers Pressure Lawmakers From Different Directions,iHeart,AFL 
Bendigo's Caleb Logan reflects on National Championships campaign,Bendigo Advertiser,AFL 
Mackay sporting heroes win big at NQ regional awards,Mackay Regional Council,AFL 
2023 review: Cronulla-Sutherland Sharks » League Unlimited,League Unlimited,NRL 
Family tributes to Kaine Bell killed in horror crash,Daily Telegraph,NRL 
Catalans Dragons proud of 'outstanding' Grade A status,Total rugby League,NRL 
Catalans Dragons show surprising interest in ex-Castleford Tigers star Greg Eden,Yorkshire Live,NRL 
Ramsay Health appeals Noosa Council rejection of Tewantin day ...,The Cairns Post,NRL 
'Wake-up call': Is it time for a complete Kangaroos team overhaul after New Zealand 'capitulation'?,The Roar,NRL 
Rory McIlroy shares first look at TGL 'clubhouse' locker rooms,Australian Golf Digest,NRL 
Former Hull FC outside back Connor Wynne tipped to fulfil ‘potential’ after signing for new club,Hull Live,NRL 
Fuel import faces risk for payment default,"Finance News: Latest Financial News, Finance News today in Bangladesh",NRL 
Hull FC and Hull KR to soon learn Super League fixtures for 2024 season as excitement builds,Hull Live,NRL 
Ex-Hull KR halfback Matty Marsh lands new club after York Knights exit,Hull Live,NRL 
nrl sportsbet,comVc,NRL 
sportsbet nrl round 2,comVc,NRL 
sportsbet nrl predictor,comVc,NRL 
aposta anulada bet365 - sportsbet nrl futures - Reclame Aqui,comVc,NRL 
"How periods became a hot topic, and even bigger business",Body+Soul,NRL 
"Route du littoral : EELV appelle à ""mettre fin aux dérives financières""",Clicanoo,NRL 
resultado da quina sao joao,comVc,NRL 
do bicho,comVc,NRL 
Eagles OT Jordan Mailata once paid $200 for each rugby victory ...,Sportszion,NRL 
"Gold Coast Titans, Jayden Campbell, Beau Fermor, Des Hasler, temporada NRL 2024, pretemporada –.",News ES Euro,NRL 
"IPL Founder Lalit Modi All For Saudi Investment In IPL, Says There Can Be 20 Teams In Second-Tier League",Times Now,IPL 
"Saudi Arabia targets US$5bn IPL investment, says report",SportsPro Media,IPL 
Saudi Arabia 'interested' in central IPL investment,SportBusiness,IPL 
Kamal Nath's son seeks suggestions for name of MP IPL team promised by Congress,The Week,IPL 
Worst trade signings in IPL history,DNA India,IPL 
Former IPL cricketer writes: Decoding the greatness of Virat Kohli,The Indian Express,IPL 
Not MS Dhoni! When N Srinivasan Wanted Another Player At Chennai Super Kings In IPL 2008 Auction,Times Now,IPL 
"Virat to CSK, Dhoni to MI: 10 dream trades before IPL 2024",Times Now,IPL 
Rudy Kadlub (100KG) Squats 3 Kilograms Over IPL World Record In ...,BarBend,IPL 
Gravitas: Has India peaked too early in 2023 ICC WC? | Saudi eyes multi-million dollar IPL stake,WION,IPL 
"Flop In IPL, Riyan Parag Set To Earn Maiden India Call-Up For Australia T20I Series?",Times Now,IPL 
3 players Rajasthan Royals might release ahead of IPL 2024 Auction,InsideSport,IPL 
"Meet IIM grad whose company owns IPL team worth Rs 8500 crore, close link with Virat Kohli; salary is...",DNA India,IPL 
IPL wins Gold Award for iEngage,The News International,IPL 
Bob Iger faces India dilemma as Disney weighs options for Star,Financial Times,IPL 
Shepherd traded to Mumbai Indians,Trinidad & Tobago Express Newspapers,IPL 
Thinking of going hairless through laser? Dr. Vicki Belo has 4 reminders,GMA News Online,IPL 
Don’t say ‘upset’: Shahidi on Afghanistan’s thrilling Cricket World Cup run,Al Jazeera English,IPL 
"Out of favour, Sunrisers Hyderabad star smashes century in SMAT ...",InsideSport,IPL 
Jofra Archer highly likely to be released by Mumbai Indians ahead of ...,InsideSport,IPL 
"Meet head of Mukesh Ambani’s Rs 10000 crore business, earns big from Rohit Sharma, Sachin Tendulkar, he",DNA India,IPL 
T Dilip story: From giving maths tuition to being Team India's 'BTS Man' in World Cup,Deccan Herald,IPL 
JioCinema adopts mid-size web shows to add volumes | Mint,Mint,IPL 
"RedBird Capital considering Toulouse sale, says report- SportsPro",SportsPro Media,IPL 
"Not Virat, Rohit, Rahul! Mohammad Kaif names the best spin player ...",Crictoday.com (Cricket News),IPL 
Brian Lara’s inputs on tactical side of batting have helped me grow: Abhishek Sharma,Sportstar,IPL 
"After a dismal Syed Mushtaq Ali campaign, Tamil Nadu’s focus shifts to Vijay Hazare Trophy",The Hindu,IPL 
"Horses Panicked After Noise, Flashes Of Light | - Times of India",Times of India,IPL 
Cricket World Cup: 3 Reasons Why Fans Are Not Happy With Star ...,The Cricket Lounge,IPL 
"‘Aapko kya gussa dilata hai?’: Fan asks ‘Captain Cool’ MS Dhoni, his response leaves everyone in splits",News9 LIVE,IPL 
Virat Kohli has always acknowledged that we selected him at the right time,IndiaTimes,IPL 
"Well bowled innings Sunil, thanks for the memories!",Trinidad & Tobago Express Newspapers,IPL 
"IPL: मुंबई इंडियन्स जोफ्रा आर्चरला बाहेरचा रस्ता दाखवण्याच्या तयारीत, आयपीएल २०२४ साठी ऑक्शन कधी?",Marathi Hindustan Times,IPL 
Schmerzfreie Haarentfernung: IPL-Gerät bei Aldi,CHIP Online Deutschland,IPL 
"Madhya Pradesh polls: Kamal Nath counters Jyotiraditya Scindia's jibe on Cong arrogance, says ‘people made it clear…' | Mint",Mint,IPL 
Dubey attends Punjab Kings trials,The Hitavada,IPL 
IPL ක්‍රීඩක වෙන්දේසිය දෙසැම්බර් 19 දා ඩුබායි හිදී,Adaderana,IPL 
"Ipl, 'clima di fiducia dei lavoratori altoatesini in altalena'",Agenzia ANSA,IPL 
Correcting common misconceptions about laser hair removal,Billings Gazette,IPL 
"IPL की तर्ज पर छपरा में SPL का होगा आयोजन: प्लेयर के जर्सी का लोकार्पण कार्यक्रम, 14 नवंबर से शुरू होगा प्र...",Dainik Bhaskar,IPL 
RCB Trolls Muhammad Rizwan After Angelo Mathews' Timed Out ...,The Cricket Lounge,IPL 
"Jofra Archer: मुंबई इंडियंस टीम में बड़े बदलाव होना तय, आर्चर को दिखाया जायेगा बाहर का रास्ता",ABP न्यूज़,IPL 
Royal Challengers Bangalore launches digital-first campaign 'Life is ...,Indiantelevision.com,IPL 
IPL 2024: 'சிஎஸ்கேவிடம் இருக்கும் பணம் எவ்வளவு?'.. 9 பேரை வாங்கணும்!,சமயம் தமிழ் (Samayam Tamil),IPL 
IPL 2024: ஆர்சிபியிடம் இருக்கும் மீத பணம் எவ்வளவு? 7 பேர வாங்கணும்!,சமயம் தமிழ் (Samayam Tamil),IPL 
IND vs AUS 5th T20 shifted to Bengaluru after Hyderabad police fail ...,InsideSport,IPL 
Jos Buttler’s itinerary reveals what is wrong with England – and cricket,The Guardian,IPL 
The Cricket.com Weekly - 6th November | Newsletter,Cricket.com,IPL 
CWC 23: More to Rohit Sharma than what meets the eye,Hindustan Times,IPL 
IPL 2024: 'மும்பை இந்தியன்ஸுக்கு'.. புது கேப்டன்?,சமயம் தமிழ் (Samayam Tamil),IPL 
"PKL is the biggest sports league after cricket in India, says Dabang ...",myKhel,IPL 
IPL 2024 Auction : आयपीएल 2024 सीझनचा लिलाव 19 डिसेंबर रोजी ...,Webdunia Marathi,IPL 
A boon for sports,Daily News,IPL 
Eastern Iowans react to Alliant Energy's proposed $330 million energy rate increase; IUB seeks additional input,KGAN TV,IPL 
IPL में लगातार 5 सीजन फ्लॉप रहने वाले खिलाड़ी को मिली टीम इंडिया में जगह,TV9 Bharatvarsh,IPL 
"वेस्टइंडीज के इस खतरनाक गेंदबाज ने अंतरराष्ट्रीय क्रिकेट से लिया संन्यास, IPL में दिखाते रहेंगे दम - Sach Bedhadak",Sach Bedhadak,IPL 
Stylist Best Beauty Awards 2024: the winning tools,Stylist Magazine,IPL 
Viacom18 Sports appoints Rohit Dhawan as VP - customer marketing,Indiantelevision.com,IPL 
"TPA Piyungan Transisi, Pembangunan Zona Transisi 2 Rampung",Harianjogja.com,IPL 
Investment In IPL: ಐಪಿಎಲ್ ಮೇಲೆ ಕಣ್ಣಿಟ್ಟ ಸೌದಿ ಅರೇಬಿಯಾ! 30 ಬಿಲಿಯನ್ ಷೇರು ಖರೀದಿಸಲು ಮುಂದಾದ ದೇಶ,News18 ಕನ್ನಡ,IPL 
The Many Facets of Virat Kohli's Cricketing Genius,The Quint,IPL 
Saudi Arabia unveils new megacity project featuring 11-km-long canal ‘Oasis’ – What we know so far,News9 LIVE,IPL 
"MICKEY ARTHUR: પાકિસ્તાનની હાર માટે કોચનાં જાતજાતનાં બહાના, અમે IPL નથી રમતા, કડક સુરક્ષા પણ જવાબદાર!",News18 ગુજરાતી,IPL 
Netflix needs change in the script,The Financial Express,IPL 
'Killers of the Flower Moon' an unforgettable cinematic experience,National Herald,IPL 
'From Darshak bane Dirgha to Chopra bane Bakra': Netizens troll ...,Cricket Times,IPL 
"Diduga Tipu 60 Penghuni, Pengelola Royal Garden Residence ...",Pancar Pos,IPL 
“May very well happen that I don't get sleep at night after leaving ...,Sportskeeda,IPL 
This Is What Alcohol Really Does to Your Skin,FASHION Magazine,IPL 
Terminy NFZ w Tarnowie na leczenie aparatem ortodontycznym ...,Tarnów NaszeMiasto.pl,IPL 
人気ウェビナーの続編「目的別 IPランドスケープのポイントと実現 ...,PR TIMES,IPL 
"Luz Pulsada de Braun: el mejor secreto para lucir una piel suave y sin vello, desde casa",Vogue Spain,IPL 
Stomatolog Tarnów - terminy na NFZ. Sprawdź stan na 7 listopada ...,Radio Eska,IPL 
"Dinkes Jatim Kejar Eliminasi TBC 2030, Segini Targetnya",beritajatim | Portal Berita Jawa Timur,IPL 
"पंजाब ने पहली बार जीता मुश्ताक अली ट्रॉफी का खिताब, फाइनल में बड़ौदा को ...",NewsBytes Hindi,IPL 
Tips Timbang dan Hitung Biaya Membeli Hunian bagi Pasangan Baru - kumparan.com,kumparan.com,IPL 
World Cup 2023: वर्ल्ड कप में सेमीफाइनल की रेस से बाहर हुई ये तीन टीमें!,Samachar Jagat,IPL 
Download HD Streamz APK For Android 2023 -,VENTS Magazine,IPL 
France sets out stall for 2030 Winter Olympics bid,The Local France,Winter Olympics 
"Perjuangan Erra Fazhira, Mantan Putri Muslimah Peraih Cumlaude ...",beritajatim | Portal Berita Jawa Timur,IPL 
PENS Surabaya Kukuhkan Dua Guru Besar Baru di Bidang IoT dan AI,beritajatim | Portal Berita Jawa Timur,IPL 
"ICC ODI World Cup: अन्तरराष्ट्रीय क्रिकेट में पहली बार हुआ ऐसा, नहीं ...",Samachar Jagat,IPL 
ICC ODI World Cup: अफगानिस्तान अब ऑस्ट्रेलिया को बना सकती है ...,Samachar Jagat,IPL 
Tim Spektronics ITS Surabaya Juara Dua Chem E-Car di Amerika,beritajatim | Portal Berita Jawa Timur,IPL 
"Video: महीनों बाद रिवाबा जडेजा ने बताया आखिर क्यों छुए थे रवींद्र जडेजा के पैर, कहा- 'वो मेरे और पति के बीच..'",Oneindia Hindi,IPL 
Unesa dan CCU Taiwan Jalin Kerjasama Internasionalisasi ...,beritajatim | Portal Berita Jawa Timur,IPL 
World Cup 2023: सेमीफाइनल की रेस में बनी पाकिस्तान टीम को ICC की ...,Samachar Jagat,IPL 
Tim Dosen Universitas Ciputra Berikan Pelatihan UMKM Mamin di ...,beritajatim | Portal Berita Jawa Timur,IPL 
ICC ODI World Cup: बांग्लादेश ने वनडे विश्व कप मेें पहली बार हासिल की ...,Samachar Jagat,IPL 
बेंगलुरु में बल्लेबाज तो कोलकाता में गेंदबाज हावी; ऐसा है सभी वर्ल्ड कप ...,ABP न्यूज़,IPL 
‘오일머니’ 축구 이어 야구까지… 중동-인도 넘보는 야구[인사이드&인사이트],동아일보,IPL 
"विराट कोहली ने बनाये 9 खतरनाक रिकॉर्ड, आज तक कोई नहीं तोड़ पाया",क्रिकेट वाला,IPL 
"Virat Kohli Net worth: गुरुग्राम में 80 करोड़ का बंगला, मुंबई में महंगे आलीशान घर, लग्जरी कार और वॉच के शौकीन हैं विराट कोहली, जानें नेट वर्थ",Jansatta,IPL 
"789bet tool hack online,789win APP kèo nhà cái - 566595",Báo Sóc Trăng,IPL 
Bharathi kannan at Cricketnmore,Cricketnmore,IPL 
"धोनी ने उठाया बड़ा कदम, 16 करोड़ का चूना लगाने वाले खिलाड़ी को टीम से बाहर ...",SportzWiki,IPL 
आयपीएलमधील 'त्या' कृतीबद्दल पहिल्यांदाच बोलल्या रिवाबा जडेजा ...,MahaMTB,IPL 
"Shardul Thakur का जीवन परिचय, उम्र, पत्नी, रिकॉर्ड, नेटवर्थ, फैमिली ...",Cricket Addictor Hindi,IPL 
"युजवेंद्र चहल के हाथ पांव बांधे और मुंह पर टेप बांधकर कर लिया कमरे में कैद, इस क्रिकेटर ने तो हद ही कर दी",TV9 Bharatvarsh,IPL 
BAN vs SL: श्रीलंका उपांत्य फेरीच्या शर्यतीतून बाहेर; बांगलादेशने तीन विकेटने सामना जिंकला,Marathi Hindustan Times,IPL 
"Virat Kohli फोन पर किससे सबसे ज्यादा बात करते हैं? मां, अनुष्का और ...",News Nation,IPL 
Chinese speed skating team eyes more gold after Olympic success,Xinhua,Winter Olympics 
Olympic Highlights 06-11-2023,Olympics,Winter Olympics 
Coming to America: U.S. a hub for international championships for ...,Sports Business Journal,Winter Olympics 
IOC defends the participation of Israeli athletes in Paris 2024,Insidethegames.biz,Winter Olympics 
Five new sports added to LA28 Olympics,The Ticker,Winter Olympics 
Vicky Sunohara,The Canadian Encyclopedia,Winter Olympics 
Where to watch professional skiers and riders this winter season,The Aspen Times,Winter Olympics 
Former Olympian researching strategies for athletes transitioning out of sports at UNCG,WFMYNews2.com,Winter Olympics 
Innsbruck: Where medieval marvels and mountain majesty unite | Daily Sabah,Daily Sabah,Winter Olympics 
The best places to ski in Japan,Tatler Taiwan,Winter Olympics 
Who was Oleg Protopopov's wife Ludmila Belousova? All you need to know about former figure skater,PINKVILLA,Winter Olympics 
"Plekanec, Thornton, Mikkelson say goodbye",IIHF,Winter Olympics 
NZ curling team qualifies for world championships,RNZ,Winter Olympics 
