title,source,event
2022 US Open: What is Iga Swiatek's net worth?,AS USA,French Open (Roland Garros) 
Iga Swiatek is world No1 once again – now she means to stay there,The Athletic,French Open (Roland Garros) 
Chris Evert defends Iga Swiatek against 'disappointing season ...,Sportskeeda,French Open (Roland Garros) 
Djokovic not 'eternal' but Simon backs world number one for multiple ...,sportsmax.tv,French Open (Roland Garros) 
Tennis Channel promotes Neil Roberts to vice president of ...,Tennis Magazine,French Open (Roland Garros) 
"""100% sure Federer or Nadal would never do something like that ...",Sportskeeda,French Open (Roland Garros) 
Novak Djokovic leaves Carlos Alcaraz sponsors Nike red-faced after Paris Masters triumph,Express,French Open (Roland Garros) 
"""Even if Iga Swiatek retires with 40 slams, she will never surpass ...",Sportskeeda,French Open (Roland Garros) 
Top 10 men's title winners in Open Era: Novak Djokovic wins 97th ...,msnNOW,French Open (Roland Garros) 
ATP Sofia Day 1 Predictions Including Roberto Carballes Baena vs Albert Ramos-Vinolas,Last Word On Sports,French Open (Roland Garros) 
Novak Djokovic sets sights on major goals after securing Paris ...,sportsmax.tv,French Open (Roland Garros) 
lịch đá giải ngoại hạng anh,dienbien.gov.vn,French Open (Roland Garros) 
GC wochnelang ohne Corbeanu und Lonwijk,sport.ch,French Open (Roland Garros) 
Baltisberger zeigt Riedi im ZSC-Training den Meister,sport.ch,French Open (Roland Garros) 
«J'ai essuyé quelques larmes en revoyant les images»,blue News,French Open (Roland Garros) 
Das achte Team der Woche der National League 2023/24.,sport.ch,French Open (Roland Garros) 
Pep Guardiola lobt YBs Konterqualitäten,sport.ch,French Open (Roland Garros) 
"AC Milan gegen Paris Saint-Germain im TV und IPTV, Live-Stream ...",sport.ch,French Open (Roland Garros) 
Simon Ammann gehen vor seiner 27. Profisaison die Ideen nicht aus,sport.ch,French Open (Roland Garros) 
Für Rodriguez beginnt der Wettlauf gegen die Zeit,sport.ch,French Open (Roland Garros) 
Joel Marchon wird keine weiteren Spiele für den HC Thurgau ...,sport.ch,French Open (Roland Garros) 
Vargas wird Markenbotschafter von Adidas,sport.ch,French Open (Roland Garros) 
YB im CL-Rückspiel gegen Manchester City mit Meschack Elia,sport.ch,French Open (Roland Garros) 
Nino Niederreiter würde seinen auslaufenden Vertrag bei den ...,sport.ch,French Open (Roland Garros) 
Odermatt lieferte sich einst handgreifliche Verfolungsjagd auf Skiern,sport.ch,French Open (Roland Garros) 
Wawrinka erreicht in Metz das Achtelfinale,sport.ch,French Open (Roland Garros) 
Livio Hiltbrand als Berner Nachwuchssportler des Jahres 2023 ...,sport.ch,French Open (Roland Garros) 
Servette-Verteidiger Anthony Baron trainiert wieder mit der Mannschaft,sport.ch,French Open (Roland Garros) 
Swiss-Ski entsendet neun Athletinnen nach Levi,sport.ch,French Open (Roland Garros) 
"Pascal Schürpf und Bruno Berner äussern sich zur Frage, ob der ...",sport.ch,French Open (Roland Garros) 
Der Schweizer MLS-Torhüter Roman Bürki fliegt mit St. Louis gegen ...,sport.ch,French Open (Roland Garros) 
Rodwin Dionicio darf von der NHL träumen,sport.ch,French Open (Roland Garros) 
Billie Jean King Cup - Hoffnung auf einen Schweizer Exploit in der ...,SRF Sport,French Open (Roland Garros) 
Mike Künzle wechselt vom EHC Biel zum EV Zug,sport.ch,French Open (Roland Garros) 
"Tennis : réforme de l'ATP, difficultés financières… pourquoi la ...",Le Parisien,French Open (Roland Garros) 
Dominik Schmid vom FC Basel richtet eine Kampfansage an die ...,sport.ch,French Open (Roland Garros) 
Ehemaliger Biathlon-Europameister Krasimir Anev kämpft wegen ...,sport.ch,French Open (Roland Garros) 
Swiss-Ski reist mit einem riesigen Aufgebot nach Zermatt,sport.ch,French Open (Roland Garros) 
Juventus Turin und der FC Everton haben Interesse an Winsley ...,sport.ch,French Open (Roland Garros) 
Marlon Graf von den GCK Lions hat ein Verfahren am Hals,sport.ch,French Open (Roland Garros) 
"Steven Nyman trauert um seine erste Trainerin, nämlich um Pamela ...",sport.ch,French Open (Roland Garros) 
Niels Hintermann erfreut sich einer tollen Frühform und lässt im ...,sport.ch,French Open (Roland Garros) 
Wendy Holdener will im Weltcup-Slalom von Levi den Sieg und ...,sport.ch,French Open (Roland Garros) 
"""Papierowa liderka"". O problemach Aryny Sabalenki słów kilka",polsatsport.pl,French Open (Roland Garros) 
Το μονόγραμμα της νίκης: Τα εμβληματικά κουτιά που προστατεύουν τα μεγαλύτερα αθλητικά τρόπαια (vid),Gazzetta.gr,French Open (Roland Garros) 
"Prasówka 7.11.2023 z Polski - wydarzenia dnia, podsumowanie z ...",Portal i.pl,French Open (Roland Garros) 
"Nitto ATP Finals 2023: Draws, Dates, History & All You Need To Know",ATP Tour,ATP Tour 
2022 US Open: What is Iga Swiatek's net worth?,AS USA,US Open 
Jack Draper Returns To Winners' Circle On ATP Challenger Tour,ATP Tour,ATP Tour 
Alexander Zverev Chases Turin Hat-trick To Crown Comeback Year,ATP Tour,ATP Tour 
"Dominic Thiem, Stan Wawrinka Win Metz Openers",ATP Tour,ATP Tour 
Duo Of Victories In 2023: Hugo Dellien’s Two Challenger Titles & ...,ATP Tour,ATP Tour 
Saudis eye Aust Open lead in ATP tournament: report,The West Australian,ATP Tour 
ATP Sofia Day 1 Predictions Including Roberto Carballes Baena vs Albert Ramos-Vinolas,Last Word On Sports,ATP Tour 
"ATP Rankings: Djokovic nears year-end No.1, Shapovalov out the ...",Tennishead,ATP Tour 
"""I'm going for all possible records"": Novak Djokovic makes goal clear ...",TennisUpToDate.com,ATP Tour 
Saudis eye Aust Open lead in ATP tournament: report,Dungog Chronicle,ATP Tour 
Canadian men paced by rising Gabriel Diallo at Calgary Challenger,Calgary Sun,ATP Tour 
Paris | Djokovic regains Paris title – for a 7th time!,Tennis Threads,ATP Tour 
Holiday wish | The Standard,Hong Kong Standard,ATP Tour 
"Zverev Sobre Las Nitto ATP Finals: ""Es Un Honor Simplementte ...",ATP Tour,ATP Tour 
Stefanos Tsitsipas Reveals How He Learnt a Tennis Lesson While ...,EssentiallySports,ATP Tour 
ATP World Tour Moselle Open Results,SFGATE,ATP Tour 
Todos Los Detalles A Conocer Sobre Las Nitto ATP Finals 2023,ATP Tour,ATP Tour 
Chelsea want Jean-Clair Todibo to replace Thiago Silva who is set ...,Sky Sports,ATP Tour 
Thiem Debuta Con Victoria En Metz,ATP Tour,ATP Tour 
Nitto ATP Finals 2023: Bolsa Récord De Premios De 15 Millones de ...,ATP Tour,ATP Tour 
Recalling 'Burning Passion' Inspired by Andre Agassi and Boris ...,EssentiallySports,ATP Tour 
Coco Gauff sends four-word joke to Chris Eubanks as US ace reflects on breakthrough season,Express,ATP Tour 
ATP World Tour Moselle Open Results,New Haven Register,ATP Tour 
México Vuelve Al Top-10: 'Santi' González Ingresará Tras Su Gran ...,ATP Tour,ATP Tour 
ATP World Tour Paris Masters Results | National | gettysburgtimes.com,Gettysburg Times,ATP Tour 
El Ciclo De La Vida: ¿Puede Medvedev Cambiar Su Suerte En Turín?,ATP Tour,ATP Tour 
"Swiatek wins WTA Finals, regains world number one ranking",Reuters,US Open 
US Open champion Coco Gauff left stunned by weather as she battles elements...,talkSPORT,US Open 
Djokovic not 'eternal' but Simon backs world number one for multiple ...,beIN SPORTS,US Open 
Billie Jean King Is Still Hitting Equal Pay Milestones,Front Office Sports,US Open 
Ringgit opens lower against US$ on technical correction,The Star Online,US Open 
US open: Stocks mixed as Dow comes off best week in over a year,DIGITALLOOK,US Open 
Siegemund and Zvonareva storm to WTA Finals doubles title,WTA Tennis,US Open 
"""It's a long way back and I'm just at the beginning"": Angelique Kerber ...",TennisUpToDate.com,US Open 
Genuine test awaits Izzuddin-Sze Fei at Korea Masters,New Straits Times,US Open 
Back-to-back US wins for Singapore pool player Aloysius Yapp,The Straits Times,US Open 
U.S. Women's Wrestling Just Entered A New Era,FloWrestling,US Open 
ATP Sofia Day 1 Predictions Including Roberto Carballes Baena vs Albert Ramos-Vinolas,Last Word On Sports,US Open 
Monday qualifiers: Andy Zhang earns spot at Butterfield Bermuda ...,PGA TOUR,US Open 
America embraces Open Banking,Financial Times,US Open 
"Coco Gauff, Jessica Pegula no-shows for Team USA at Billie Jean ...",Palm Beach Post,US Open 
"Hamas war: Amid US' push, Israel open to 'little pauses' in Gaza for aid",Business Standard,US Open 
MacIntyre to play at Fortinet Australian PGA Championship and ...,DP World Tour,US Open 
Top 10 men's title winners in Open Era: Novak Djokovic wins 97th ...,msnNOW,US Open 
How the U.S. has increased its military presence in the Middle East amid Israel-Hamas war,CBS News,US Open 
Coco Gauff Reflects on 'Darkest and Brightest' Tennis Season After Losing in WTA Finals,Yahoo Eurosport UK,US Open 
Iga Swiatek earns the WTA Finals title and a return to No. 1 by ...,WFMJ,US Open 
Iga Swiatek Hits Two Winning Shots With One Racquet as Lindsey ...,EssentiallySports,US Open 
Infamous public courses,Lakenewsonline.com,US Open 
"Customers at Bank of America, Wells Fargo and other banks grappling with deposit delays",CBS News,US Open 
"U.S. Park Police officer kills fellow officer in unintentional shooting in Virgina apartment, police say",CBS News,US Open 
"Tennis, ATP – Metz Open 2023: Wawrinka defeats Zapata Miralles",Tennis Majors,US Open 
Tennis legend Serena Williams honored as 'fashion icon' at fashion ...,The Washington Post,US Open 
"Brooks Koepka, Rory McIlroy, Jon Rahm: Of these champions, who ...",SB Nation,US Open 
"Former club pro makes clutch putt to keep PGA Tour Champions spot, advance in Charles Schwab Cup",GolfDigest.com,US Open 
"LIV Golf star Graeme McDowell says majors ""need"" them after ...",The Mirror,US Open 
Rafa Nadal pays the consequences of his injury: Where does he rank in the ATP rankings now?,Marca English,ATP Tour 
"Republican Peter Meijer, who supported Trump's impeachment, enters Michigan's US Senate race",ABC News,US Open 
Iga Swiatek avoids rankings distraction and focuses on the right stuff,Sportstar,US Open 
"Rupee to weigh pause in rally on Asian Fx, rebound in US yields",Reuters,US Open 
Your horoscope for the week ahead: Stay generous with your ...,CBC.ca,US Open 
U.S. Bank renews long-term lease at downtown Minneapolis HQ,CBS Minnesota,US Open 
Has Emma Raducanu given a big hint that she will delay her ...,Tennis365,US Open 
"US, Israel to open second front in Lebanon - Indian Punchline",Indian Punchline -,US Open 
"Rory McIlroy feeling the pressure to make Boston Common Golf, TGL appeal to broader sports audience",CBS Boston,US Open 
Indian shares extend gains on easing U.S. rate concerns,Reuters India,US Open 
Open Statement: U.S. Koreans for Palestine,Workers World,US Open 
Hewett set for year-end world No.1 ranking after clinching ...,Lawn Tennis Association,US Open 
The Finals Open Beta Comes to an End After 7.5 Million Players,IGN,US Open 
"Haas right of review hearing into US GP result confirmed as Red Bull, Williams, Aston Martin also called",Sky Sports,US Open 
Jack Draper claims first title of the season at Bergamo Challenger,Lawn Tennis Association,US Open 
Swiatek romps to WTA Finals title and Word No.1 spot - RTHK,香港電台,US Open 
Excellence Honoured at NSW Golf Industry Awards,PGA of Australia,US Open 
What will Lancaster Country Club play like for the 2024 USGA Women's Open | Sunday Sitdown,WPMT FOX 43,US Open 
Novak Djokovic sets sights on major goals after securing Paris ...,sportsmax.tv,US Open 
100 best off-course amenities from our all-new Top 100 Courses in the World,Golf.com,US Open 
Team Canada Bounced in Quarter-Finals of 2023 Davis Cup Juniors ...,Tennis Canada,Davis Cup 
Loan Watch: Morgan's cup experience could help Dons,AFC Wimbledon,Wimbledon 
"With 2025 Deadline Inching Ever Closer, Paris Masters' Fight to ...",EssentiallySports,ATP Tour 
Delray Beach Open Shares What's New For 2024 Tournament,Kalkine Media,ATP Tour 
Meet the best junior tennis players aiming to become the next big ...,Tennis365,ATP Tour 
Tennis Channel promotes Neil Roberts to vice president of ...,Tennis Magazine,ATP Tour 
Tennis betting tips: Preview and best bets for Billie Jean King Cup ...,Sportinglife.com,ATP Tour 
"Serbe sieht mentalen Vorteil - Djokovic: «Sie glauben, dass ich ...",SRF Sport,ATP Tour 
Sports TV listings for Monday Nov. 6,Roanoke Times,ATP Tour 
Bridgette Wilson diagnosed with ovarian cancer,Republic World,ATP Tour 
Nino Niederreiter scores 3 times as Winnipeg Jets beat Arizona ...,Republic World,ATP Tour 
"LeBron James, back in Miami with the Lakers, reflects on his 4 Heat ...",Republic World,ATP Tour 
"""He'll have to put the brakes on"": Jannik Sinner receives warning as ...",TennisUpToDate.com,ATP Tour 
Gimenez's embarrassing penalty miss,Republic World,ATP Tour 
"ATP Finals 2023 - Calendario, gironi, gli otto partecipanti ...",Eurosport IT,ATP Tour 
Rams QB Matthew Stafford won't play vs Green Bay,Republic World,ATP Tour 
Ryan Blaney earns his 1st career NASCAR c'ship,Republic World,ATP Tour 
Netizens question Angelo Mathews' dismissal,Republic World,ATP Tour 
CWC 2023: Updated points table after BAN defeat SL,Republic World,ATP Tour 
'It Was Insane'- Eugenie Bouchard Swells With Pride as Canada ...,EssentiallySports,ATP Tour 
Ricky Ponting's words of praise for Virat Kohli,Republic World,ATP Tour 
ATP Metz: Thiem vs. Martineau jetzt live & exklusiv bei Sky,skysportaustria.at,ATP Tour 
ATP Metz: Wawrinka passe facilement le premier tour,Blue Zone,ATP Tour 
Top 10 men's title winners in Open Era: Novak Djokovic wins 97th ...,msnNOW,ATP Tour 
Charleston's Emma Navarro top seed in hometown tournament,Charleston Post Courier,ATP Tour 
Peter Gojowczyk sagt leise Servus · tennisnet.com,tennisnet.com,ATP Tour 
"Ugo Humbert - Dominic Thiem, ATP 250, Metz, Deuxième tour ...",L'Équipe,ATP Tour 
Wiadomo kto zagra w Nitto ATP Finals 2023 w Turynie,Tenis Magazyn,ATP Tour 
Tennis: Djokovic confirme son statut de numéro 1 mondial au ...,Le Figaro,ATP Tour 
"ATP - Metz: Ugo Humbert, 23e et n°1 Français : «Ma meilleure saison»",Tennis Actu,ATP Tour 
"Harold Mayot, après sa victoire face à Yosuke Watanuki au premier ...",L'Équipe,ATP Tour 
ATP-250-Turnier in Metz - Wawrinka stürmt in den Achtelfinal,SRF Sport,ATP Tour 
ATP - Sofia: Terence Atmane défie Marton Fucsovics au 1er tour ce mardi,Tennis Actu,ATP Tour 
Engaging women sports fans,Deloitte,US Open 
"""The Alcaraz era is upon us"": But not so fast as Novak Djokovic fans ...",TennisUpToDate.com,US Open 
Ibsen’s Ghosts: a resounding flop that still returns to haunt us,The Guardian,US Open 
Billy Harris - Marc-Andrea Hüsler Live - ATP Sofia: Tennis Scores ...,Eurosport COM,US Open 
"Salt Lake vs Houston: Where to watch the match online, live stream ...",Goal.com,US Open 
"Milwaukee-area restaurants, tell us if you'll be open or offering ...",Milwaukee Journal Sentinel,US Open 
MLS Playoffs 2023 Power Rankings: FC Cincinnati remains favorites ...,Goal.com,US Open 
Iga Swiatek will finish the year at No. 1 after beating Jessica Pegula ...,Danbury News Times,US Open 
"Israel says it is open to Gaza fighting pauses for aid, hostages",Reuters,US Open 
Spencer Lee Registered For 2023 Bill Farrell,FloWrestling,US Open 
Yellen to host Chinese vice premier for talks in San Francisco before APEC summit,CBS San Francisco,US Open 
"Dollar rebounds, Fed officials take center stage",Reuters,US Open 
Tennis Channel promotes Neil Roberts to vice president of ...,Tennis Magazine,US Open 
Pennsylvania Voters Weigh Abortion Rights in Open State Supreme ...,U.S. News & World Report,US Open 
DP World Tour Schedule,WTOP,US Open 
Republican Peter Meijer enters U.S. Senate race,Spectrum News,US Open 
Gauchos Prepped to Open 2023-24 Season - University of ...,UC Santa Barbara,US Open 
GolfPass Holiday Gift Guide: What to get your favorite golfer,GolfPass,US Open 
LAFC Aims for Repeated Glory in MLS: Determination and Balance ...,MLS Multiplex,US Open 
The ballot issues for Election Day 2023 with the highest stakes across U.S. voting,CBS News,US Open 
American Tennis Star Sloane Stephens Pens Beautiful Note to ...,EssentiallySports,US Open 
"""Even if Iga Swiatek retires with 40 slams, she will never surpass ...",Sportskeeda,US Open 
ITF announces record prize money for Billie Jean King Cup,Reuters,Davis Cup 
Equal pay in tennis: Billie Jean King Cup Finals prize money becomes equal to that of men’s Davis Cup,Sportstar,Davis Cup 
Billie Jean King Cup Finals prize money rises to USD 9.6 million ...,The Arunachal Times,Davis Cup 
Monday Digest: Storms in Cancun and Billie Jean King Cup Finals ...,Tennis Canada,Davis Cup 
"Novak Djokovic plans to ""leave the racket aside"" as he rests ahead ...",TennisUpToDate.com,Davis Cup 
BJK Cup: Billie Jean King on the career moment she’ll ‘never forget’ and the growth of the tournament named in her honor,CNN,Davis Cup 
Canada ready for challenge of opening Billie Jean King Cup Finals ...,TSN,Davis Cup 
Jack Draper claims first title of the season at Bergamo Challenger,Lawn Tennis Association,Davis Cup 
"Melbourne Cup results 2023 LIVE updates: Horses, time, race, field ...",Brisbane Times,Davis Cup 
Melbourne Cup results 2023 LIVE updates: Without A Fight wins ...,Brisbane Times,Davis Cup 
Today in Sports - Magic Johnson announces he has tested positive ...,Laredo Morning Times,Davis Cup 
"Melbourne Cup results 2023 LIVE updates: Horses, time, race, field ...",Brisbane Times,Davis Cup 
Van de Zandschulp richt zich op Davis Cup na teleurstellend verlies ...,NOS,Davis Cup 
Tennis Channel promotes Neil Roberts to vice president of ...,Tennis Magazine,Davis Cup 
Meet the best junior tennis players aiming to become the next big ...,msnNOW,Davis Cup 
Cricket icon Karim tips Kenya to qualify for T20 World Cup,Nation,Davis Cup 
Canadian men paced by rising Gabriel Diallo at Calgary Challenger,Calgary Sun,Davis Cup 
Darrell Davis: CFL playoffs could affect Roughriders coaching search,Regina Leader Post,Davis Cup 
AP Sports SummaryBrief at 11:49 a.m. EST | National ...,Kentucky Today,Davis Cup 
AP Sports SummaryBrief at 12:04 p.m. EST | National ...,Kentucky Today,Davis Cup 
International Championship 2023 snooker LIVE – Ronnie O'Sullivan ...,Eurosport COM,Davis Cup 
Recalling 'Burning Passion' Inspired by Andre Agassi and Boris ...,EssentiallySports,Davis Cup 
"Mladí Češi nadchli, po letech ovládli Davis Cup. Píše se o ...",Aktuálně,Davis Cup 
IN BRIEF,The Times and Democrat,Davis Cup 
Copa Davis - Zimbabue entre bambalinas,Davis Cup,Davis Cup 
'It Was Insane'- Eugenie Bouchard Swells With Pride as Canada ...,EssentiallySports,Davis Cup 
Jannik Sinner backed to 'take off' as tennis great also offers word of ...,Tennis365,Davis Cup 
Tennis betting tips: Preview and best bets for Billie Jean King Cup ...,Sportinglife.com,Davis Cup 
Brazil summons teenage sensation Endrick for World Cup qualifiers,Oil City Derrick,Davis Cup 
ATP Metz & ATP Sofia Betting Tips,BettingTips4You.com,Davis Cup 
"With Josh McDaniels gone, all eyes — and pressure — now fall to ...",Yahoo Sports,Davis Cup 
Reuters Sports News Summary,Devdiscourse,Davis Cup 
Sri Lanka's Angelo Mathews becomes first batter to be timed out in ...,Oil City Derrick,Davis Cup 
Nevada Wolf Pack start season at home against the Sacramento ...,Oil City Derrick,Davis Cup 
Penn State hosts Delaware State to start season | Sports | thederrick ...,Oil City Derrick,Davis Cup 
Australian Open build-up under threat as Saudi Arabia looks to host ...,7NEWS,Australian Open 
"Swiatek tops Pegula for WTA Finals title, regains No.1 ranking",WTA Tennis,WTA Tour 
Unveiling the Mystery Behind Storing Wimbledon Tennis Balls at 68 ...,Unique Times Magazine,Wimbledon 
Matchday Uncovered: FA Cup Fever! - News,AFC Wimbledon,Wimbledon 
Fans’ delight at fab five - News,AFC Wimbledon,Wimbledon 
Trophy Time: Dons host Palace U-21s on Tuesday at 7 pm,AFC Wimbledon,Wimbledon 
AFC Wimbledon stay top of the National League Division One South ...,South London News,Wimbledon 
Novak Djokovic sets sights on major goals after securing Paris ...,The Independent,Wimbledon 
Hercules Wimbledon round-up: Athletes in action at National Cross ...,South London News,Wimbledon 
Smith: Dons v Rams should be on telly,Kent Online,Wimbledon 
Leeds United-linked Ali Al-Hamadi profiled as rising AFC Wimbledon star turns Championship heads,Leeds Live,Wimbledon 
What is Black Rod? - Mirror Online,The Mirror,Wimbledon 
Just Stop Oil attack the Rokeby Venus: how the group is using the ...,The Conversation Indonesia,Wimbledon 
Benning late show seals Hawks triumph,Henley Rugby Club,Wimbledon 
William speaks of pride for Earthshot team and 'fantastic' finalists,Wimbledon Guardian,Wimbledon 
3 Records Novak Djokovic Can Break Before Retiring,EssentiallySports,Wimbledon 
Just Stop Oil attack the Rokeby Venus: how the group are using the ...,The Conversation,Wimbledon 
Touch your radiators when turning heating on this month,Wimbledon Guardian,Wimbledon 
£140k revamped tennis courts still not open due to flooding,Yahoo News UK,Wimbledon 
Sport England invests £250m to remove barriers to exercise,Wimbledon Guardian,Wimbledon 
Office sharing company WeWork files for bankruptcy protection,Wimbledon Guardian,Wimbledon 
"Swiatek tops Pegula for WTA Finals title, regains No.1 ranking",WTA Tennis,Wimbledon 
Billie Jean King Cup Finals: All you need to know about the women's 'World Cup of Tennis',Sky Sports,Wimbledon 
Wordle today: Wordle 871 November 7 hints and today's answer,Wimbledon Guardian,Wimbledon 
Stranger Things: The First Shadow and Stranger Sings! stage shows,Wimbledon Guardian,Wimbledon 
Celebrity Race Across The World to return for second series ...,Wimbledon Guardian,Wimbledon 
Millions of WhatsApp users targeted by new scam - what to look out for,Wimbledon Guardian,Wimbledon 
Australian PM visits China in bid to improved strained relations,Wimbledon Guardian,Wimbledon 
Erling Haaland trains for Manchester City after weekend injury scare,Wimbledon Guardian,Wimbledon 
Newsquest's Young Reporter Scheme deadline extended: Enrol ...,Wimbledon Guardian,Wimbledon 
Victor Wembanyama's Offensive Struggles in Spurs' Loss to Pacers Surprises NBA Fans,Bleacher Report,NBA 
Challenger de Calgary - Zizou Bergs se qualifie pour le 2e tour face ...,Proximus,ATP Tour 
Tennis : David Goffin se rapproche du Top 100 ATP,RTC Télé Liège,ATP Tour 
Điểm báo: Novak Djokovic & năm 2023 thi đấu thành công,VTV,ATP Tour 
Novak daleko ispred Nadala i Federera,Sport Klub Srbija,ATP Tour 
Djokovic amplió su ventaja en lo más alto del ranking ATP: en qué puesto quedaron los argentinos,El Economista,ATP Tour 
Djokovic Rompe La Barrera De Los 40 Masters 1000 En París ...,Nitto ATP Finals,ATP Tour 
"Đoković svojim 40. Mastersom ostao čvrsto na vrhu, Hrvati više ...",Sportnet.hr,ATP Tour 
Thiem erreicht souverän Achtelfinale von Metz - Tennis ...,DER STANDARD,ATP Tour 
"Tennis, ATP – Tournoi de Metz 2023 : Lestienne sort Hemery",Tennis Majors,ATP Tour 
Challenger d'Helsinki - David Goffin et Joris De Loore héritent d'un ...,Proximus,ATP Tour 
Qué jugadores están clasificados al Masters de Turín: las posiciones rumbo al ATP Finals,DSPORTS,ATP Tour 
"Tennis, ATP – Tournoi de Metz 2023 : Shevchenko bat Bourgue",Tennis Majors,ATP Tour 
Draper - Marterer Tennis Tipp | ATP Sofia 07.11.2023,Wettfreunde.net,ATP Tour 
Mektić u paru s Britancem krenuo pobjednički u Sofiji,Sportnet.hr,ATP Tour 
"ATP - Metz : Lestienne en huitièmes, Thiem pour Humbert",Orange.fr,ATP Tour 
Duje Ajduković krenuo glatkom pobjedom na turniru u Japanu,Sportnet.hr,ATP Tour 
Mexican governor says 1 child died and 3 others were exposed to ...,Oil City Derrick,ATP Tour 
ATP Challenger - Lima 2023 - LIVE - Les résultats - Kilian ...,Ski-nordique,ATP Tour 
UMass hosts Albany (NY) to begin season | Sports | thederrick.com,Oil City Derrick,ATP Tour 
esportes de campo e taco.,comVc,ATP Tour 
Toledo hosts Detroit Mercy in season opener | Sports | thederrick.com,Oil City Derrick,ATP Tour 
ATP Challenger - Helsinki 2023 - LIVE - Les résultats - Muller et ...,Ski-nordique,ATP Tour 
Novak Djoković powiększył przewagę w rankingu ATP! Co z Hubertem Hurkaczem?,polsatsport.pl,ATP Tour 
Djokovic deixa indireta… para Nadal? “Não finjo que não quero os recordes como alguns fazem”,Bola Amarela Brasil,ATP Tour 
LONDON MARKET CLOSE: Stocks mixed against strong US market ...,AJ Bell,US Open 
2023 Nedbank Golf Challenge Preview Picks Analysis,Golfshake,US Open 
Op-ed: Tennis and NYPD partner to offer young people active ...,Crain's New York Business,US Open 
"Dollar steady, Aussie weaker after RBA tempers hawkish view",Reuters,US Open 
Why Did Naomi Osaka Avoid Making Eye-Contact With Serena ...,EssentiallySports,US Open 
“How hard is it to shoot 59 like”: Padraig Harrington shares his ...,Sportskeeda,US Open 
'It Was Insane'- Eugenie Bouchard Swells With Pride as Canada ...,EssentiallySports,US Open 
Captain found guilty in 2019 dive boat fire that killed 34 off California coast,CBS Sacramento,US Open 
Airstream to open dealership in Marquette,WLUC,US Open 
Fast-expanding coffee chain reveals opening date for its second ...,The Business Desk,US Open 
"USWNT REWIND: Gotham, OL Reign Clinch Spots in NWSL ...",U.S. Soccer,US Open 
'Three of Us' film review: A voyage into all our past lives,The New Indian Express,US Open 
S&P500 Forecast: Stocks rise building on last week's gains,FOREX.com,US Open 
Photo Gallery: Determined Norwin outlasts North Allegheny to ...,Pittsburgh Soccer Now,US Open 
