title,source,event
Nieuwssprokkels van de afgelopen week uit de endurance racerij,Autosport.be,24 Hours of Le Mans 
"Nico Pino, el chileno que respira velocidad y sueña con llegar a la Fórmula 1 antes del 2027",BioBioChile,24 Hours of Le Mans 
"Guía: Museo Fernando Alonso, una colección de estrellas",La Escudería,24 Hours of Le Mans 
Mort sur la piste : ces scènes où l'on reconnait la ville du Mans,SWEET FM,24 Hours of Le Mans 
Type 136: el Lotus eléctrico 'más barato' de su catálogo cuesta ...,Híbridos y Eléctricos,24 Hours of Le Mans 
António Félix da Costa despediu-se do WEC com 'a melhor corrida ...,AutoGear,24 Hours of Le Mans 
Lo que piensa Alonso de los rumores que le ponen en Red Bull... y ...,Top Gear España,24 Hours of Le Mans 
GT World Challenge und FIA WEC 2024 für Rossi?,SPEEDWEEK.COM,24 Hours of Le Mans 
Motorsport Games licencie et perd la licence BTCC,Gamekult,24 Hours of Le Mans 
A GAGNER - France Bleu Berry Expérience : en immersion au cœur ...,France Bleu,24 Hours of Le Mans 
JOTA viaja del adiós a António Félix Da Costa al posible fichaje de ...,Motor.es,24 Hours of Le Mans 
"Littérature - Un livre pour sauver la toute dernière Fasto, voiture ...",La Montagne,24 Hours of Le Mans 
IDM News: Neukirchner und Fritz gewähren Einblicke,SPEEDWEEK.COM,24 Hours of Le Mans 
Chailles : les VTT au rendez-vous de La Forestière,La Nouvelle République,24 Hours of Le Mans 
Roberto Merhi cierra el año con un nuevo podio en SUPER GT,Motorsport.com - ES,24 Hours of Le Mans 
"8H de Bahreïn WEC : razzia Toyota, les Iron Dames dans l'histoire",Sport Auto,24 Hours of Le Mans 
"BCL - Champions League, calendario e i risultati della 3a giornata 2023-24",Pianeta Basket,24 Hours of Le Mans 
como fazer a aposta da mega da virada,comVc,24 Hours of Le Mans 
Corrado Provera : 1941-2023,Le Blog Auto,24 Hours of Le Mans 
Nell'Endurance FIM EWC arriva il quarto pilota Superstock,Corsedimoto,24 Hours of Le Mans 
Pietro Fittipaldi conquista pódio em Bahrein no WEC | Notícias de ...,Capital News,24 Hours of Le Mans 
Η Mazda ξεπέρασε την παραγωγή 2 εκατ. περιστροφικών κινητήρων,Motorone,24 Hours of Le Mans 
Formel 1: Mick Schumacher macht Andeutung - sitzt er bald ...,DER WESTEN,24 Hours of Le Mans 
Ferrari vend déjà plus d'hybrides que de thermiques,Automobile-Sportive,24 Hours of Le Mans 
Un incendie détruit un hangar agricole à Savigné-l'Évêque,France Live,24 Hours of Le Mans 
"24h of Le Mans | Here is the 2024 Poster: ""They will be there!""",Ruetir,24 Hours of Le Mans 
Neiman Marcus Christmas Book features a Cadillac Celestiq ...,البوابة,24 Hours of Le Mans 
"Bentley Racer, o ícone clássico das corridas, retorna como um carro ...",Portalcascais.pt,24 Hours of Le Mans 
"Ultim’ora Valentino Rossi, tifosi pazzi di gioia: ora potrebbe accadere davvero",Alla Guida,24 Hours of Le Mans 
Qui sont les jeunes rois et reines de la prochaine génération ? – .,News Day FR,24 Hours of Le Mans 
"NASCAR Cup Series 2024 schedule: Dates, times, networks",Yahoo Sports,NASCAR 
Marini on Martin: “His feeling with the bike is incredible”,Crash,MotoGP 
NASCAR: Ryan Blaney now elite with Cup title? Chase Elliott ...,Daytona Beach News-Journal,NASCAR 
NASCAR team opts not to compete during 2023 season,Beyond the Flag,NASCAR 
New NASCAR Cup Champ Ryan Blaney Not the Top Driver of 2023,Autoweek,NASCAR 
"In Ryan Blaney, NASCAR has a champ with the star potential it needs",The Athletic,NASCAR 
NASCAR Hits Offseason With International Goals Next,Front Office Sports,NASCAR 
NASCAR sees nine-year streak brought to screeching halt,Beyond the Flag,NASCAR 
Sask. man turns old cars into NASCAR replicas,CTV News Saskatoon,NASCAR 
NASCAR suffers embarrassing track design mistake during ...,KJZZ,NASCAR 
Adelaide 500 to host NASCAR royalty,V8 Sleuth,NASCAR 
"NASCAR Cup Phoenix showdown ""a bit of a letdown"" for Byron",Autosport,NASCAR 
NASCAR Power Rankings: Ryan Blaney finishes at No. 1 after championship run,NBC4 Washington,NASCAR 
Harvick closes full-time NASCAR racing career with solid Phoenix ...,Lynchburg News and Advance,NASCAR 
NASCAR Chevy Teams Tail Ford In 2023 Xfinity Series Championship,GM Authority,NASCAR 
"Ford's Rushbrook: Sweeping NASCAR titles ""makes a statement""",Motorsport.com,NASCAR 
NASCAR accused of discriminating against white men in diversity efforts,New York Post,NASCAR 
NASCAR dream 'getting very real' for van Gisbergen,V8 Sleuth,NASCAR 
West Point woman wins $1 million NASCAR Powerball,The Commercial Dispatch,NASCAR 
NASCAR-Craftsman Truck Fastest Laps,SFGATE,NASCAR 
“That's Dumb”- Dale Earnhardt Jr Insider Livid As NASCAR's ...,EssentiallySports,NASCAR 
NASCAR Craftsman Truck Average Running Position,San Francisco Chronicle,NASCAR 
NASCAR Craftsman Truck Manufacturer Standings,San Francisco Chronicle,NASCAR 
Kenny Wallace Resonates With Dale Earnhardt Jr's Frustrating Pain ...,EssentiallySports,NASCAR 
Ryan Blaney Could Overtake Chase Elliott as NASCAR's Favourite ...,EssentiallySports,NASCAR 
NASCAR Craftsman Truck Winners,WTOP,NASCAR 
NASCAR Xfinity Manufacturer Standings,San Francisco Chronicle,NASCAR 
NASCAR Xfinity Average Running Position,San Francisco Chronicle,NASCAR 
NASCAR Xfinity Laps Led Percentage,San Francisco Chronicle,NASCAR 
"MotoGP, Another crazy idea: Acosta to replace Jack Miller in the official KTM team",GPOne.com,MotoGP 
"Rapid KL bus service for MotoGP 2023 race, Nov 10-12 - paultan.org",Paul Tan's Automotive News,MotoGP 
Martin won't push Ducati for Bastianini's factory MotoGP ride,Motorsport.com,MotoGP 
MotoGP heading for 850cc future? | MotoGP | News,Crash,MotoGP 
"MotoGP, Marquez: With Ducati Gresini to have again those butterflies in my stomach",GPOne.com,MotoGP 
Bagnaia details a key problem with fighting multiple Ducatis for the title,Crash,MotoGP 
“Alvaro Bautista is not going to the Malaysian MotoGP just to be on the grid!”,Crash,MotoGP 
“Marc Marquez is still young - he's one of the chosen ones…”,Crash,MotoGP 
Pol Espargaro: 'My left shoulder is a bit higher than the right…',Crash,MotoGP 
MotoGP: World Championship Resumes This Coming Weekend At ...,RoadracingWorld.com,MotoGP 
MotoGP riders readying to storm a sweltering Sepang,MCNews,MotoGP 
MotoGP 2023. Malaysian GP. TV TIMES (Sprint and race at the ...,Ruetir,MotoGP 
"MotoGP, Rins will also skip Sepang Grand Prix, replaced by Lecuona",GPOne.com,MotoGP 
Revving up recruitment at MotoGP,Australian Department of Defence,MotoGP 
The heat is on as MotoGP™ mania hits Malaysia,motogp.com,MotoGP 
TIME SCHEDULE: Petronas Grand Prix of Malaysia,motogp.com,MotoGP 
"Jadwal Lengkap MotoGP Malaysia di Sirkuit Sepang, 10-12 November 2023",Bola.net,MotoGP 
Closing Shot: Rolling Through Asia,Sports Business Journal,MotoGP 
"MotoGP di Malaysia Segera Dihelat, Arena Balap Andalan Negeri Jiran Ubah Nama! - Jawa Pos",JawaPos,MotoGP 
"Alex Rins Absen Lagi di MotoGP Malaysia dan Qatar, Sempatkah Jajal Yamaha di Valencia?",Bola.net,MotoGP 
"Juara WSBK 2023 Bakal Tampil dengan Ducati di MotoGP Malaysia, Ogah Sekadar Tampil",Liputan6.com,MotoGP 
Manajer Jorge Martin dan Enea Bastianini Bantah Gosip Tukar Tim di MotoGP 2024,Bola.net,MotoGP 
"Jelang MotoGP Malaysia, Aleix dan Martin Masih Asyik Sepedaan-Motoran di Bali",detikOto,MotoGP 
Jawaban Diplomatis Marc Marquez soal Kejar Rekor Keren Valentino Rossi di MotoGP,Juara.net,MotoGP 
"Jadwal MotoGP 2023 Lengkap Jam Tayang MotoGP Malaysia Live Trans7, Panggung Bagnaia vs Martin",Tribun Kaltim,MotoGP 
"Marquez Akui Jadi Pebalap MotoGP Gaji Tertinggi, Segini Besar ...",detikOto,MotoGP 
"Event MotoGP di Sirkuit Mandalika Masih Rugi, Kepala Dinas Pariwisata NTB Buka Suara",Tribun Lombok,MotoGP 
Paddock Pass Podcast Episode 367 - Jerez WorldSBK Review And ...,MotoMatters.com,MotoGP 
NASCAR Xfinity Winners,San Francisco Chronicle,NASCAR 
NASCAR Xfinity Laps in Top 15,San Francisco Chronicle,NASCAR 
NASCAR Cup Series Average Running Position | Sports ...,The Hastings Tribune,NASCAR 
NASCAR Xfinity Pole Winners,San Francisco Chronicle,NASCAR 
NASCAR Cup Series Fastest Laps | Sports | bakersfield.com,The Bakersfield Californian,NASCAR 
NASCAR Cup Series Manufacturer Standings | Sports ...,The Hastings Tribune,NASCAR 
NASCAR-Craftsman Truck Laps in Top 15,San Francisco Chronicle,NASCAR 
This is Why Denny Hamlin is Still Championship-Less in the ...,EssentiallySports,NASCAR 
NASCAR Cup Series Winners,WTOP,NASCAR 
NASCAR Cup Series Laps Led Percentage,San Francisco Chronicle,NASCAR 
Which NASCAR driver won the 2023 Cup Series Rookie of the Year ...,Sportskeeda,NASCAR 
NASCAR Fans Call Out Kyle Petty For Saying Cup Series Champion ...,Whiskey Riff,NASCAR 
Parker Kligerman wants Emmy awarded to NASCAR analyst who ...,Sportskeeda,NASCAR 
"2023 Panini Prime NASCAR Racing Checklist, Box Info, Details",Beckett News,NASCAR 
North Wilkesboro Speedway begins repaving ahead of 2024 NASCAR All-Star Race,Yardbarker,NASCAR 
Scottsdale woman in running for NASCAR Foundation award,scottsdale.org,NASCAR 
Watch Racers Forum 'Evolution of Ownership' Panel Discussion on…,Racing America,NASCAR 
ARCA Menards Series to open 2024 season at Daytona ...,arcaracing.com,NASCAR 
NASCAR Cup Series Rookie Standings,San Francisco Chronicle,NASCAR 
Column | Blaney adds to Ohio family legacy with 1st NASCAR ...,Times Daily,NASCAR 
NASCAR Craftsman Truck Pole Winners,San Francisco Chronicle,NASCAR 
"William Sawalich replaces Chase Elliott, Joe Nemechek as the ...",Tennessean,NASCAR 
First Look at 56th Snowball Derby Entry List,Racing America,NASCAR 
"This Week in iRacing: November 7-13, 2023 - iRacing.com",iRacing,NASCAR 
Lebanon’s Spencer welcomes Petty to Hall of Fame,Main Street Media of Tennessee,NASCAR 
“Supposed To Be Happy About This?” – SMI's Final Scalpel on ...,EssentiallySports,NASCAR 
New names rise as sun sets on 2023 JuniorGP™ season in Valencia,motogp.com,MotoGP 
"MotoGP, Marc Marquez dit ne pas penser au neuvième titre qui le ...",Paddock GP,MotoGP 
"Roadracing World Now Accepting Nominations, Applications For ...",RoadracingWorld.com,MotoGP 
This weekend's racing,Honda.Racing,MotoGP 
"MotoGP, i destini incrociati di Bagnaia e Martin: in Malesia per il titolo mondiale",Sky Sport,MotoGP 
"MotoGP : ""pour Jorge Martin, rejoindre l'équipe d'usine en 2024 ...",Paddock GP,MotoGP 
Espargaró brothers under the scrutiny of the Spanish tax authorities,Motorcycle Sports Australia,MotoGP 
MotoGP 2023 – Horários do Grande Prémio da Malásia ...,Motojornal,MotoGP 
"GP de Malasia de MotoGP: TV, hora y dónde ver las carreras en Sepang en directo online",AS,MotoGP 
Fesselnder WM-Kampf 2023: Köpfchen gegen Muskelkraft?,SPEEDWEEK.COM,MotoGP 
MV Agusta Masuk Grid MotoGP Setelah 2026?,ridertua,MotoGP 
"MotoGP, Loris Capirossi : ""l'année prochaine, beaucoup de choses ...",Paddock GP,MotoGP 
"Prévia MotoGP na Malásia, R3 Cup e seletiva R15 em Goiânia ...",Yamaha Racing Brasil,MotoGP 
Dani Pedrosa tested KTM RC16 again in Jerez,Motorcycle Sports Australia,MotoGP 
【MotoGP】2023-18馬來西亞GP賽前展望：Bagnaia與Martin的冠軍之爭會如何發展？,運動視界 Sports Vision,MotoGP 
"Marc Márquez: ""Tengo el salario más alto de MotoGP, pero en 2024...""",MUNDO DEPORTIVO,MotoGP 
"UFC: Dana White confirms Strickland v Du Plessis, Volkanovski v ...",Eurosport COM,MotoGP 
MotoGP: Die merkwürdigen Geheimnisse der Startnummern,SPEEDWEEK.COM,MotoGP 
Valentino Rossi made his debut in an LMP2 prototype with a top-five ...,Motorcycle Sports Australia,MotoGP 
Bautista de retour en MotoGP : « Il n'y va pas juste pour être sur la ...,GP Inside,MotoGP 
"MotoGP, Iker Lecuona substitui Álex Rins na Malásia e no Qatar",MotoSport,MotoGP 
"'Without aerodynamics and the holeshot device, the Yamaha would ...",Motorcycle Sports Australia,MotoGP 
アレックス・リンス、MotoGPマレーシアGP＆カタールGPも欠場。再びSBKのレクオーナが代役参戦,オートスポーツweb,MotoGP 
"British Touring Car Championship Game is Dead, as TOCA ...",GTPlanet,NASCAR 
Walt Disney Co. names PepsiCo's Hugh Johnston as chief financial ...,Citrus County Chronicle,NASCAR 
Handfuls of fresh herbs enliven Sardinia's fregola-studded soup,Citrus County Chronicle,NASCAR 
"Detroit’s WMYD-TV to Become CW Affiliate on Monday, Nov. 13",Yahoo Finance,NASCAR 
Motorsport Games to lay off up to 38 employees,GamesIndustry.biz,NASCAR 
West Coast Stock Car/Motorsports HOF Reveals 2024 Nominees ...,SPEED SPORT,NASCAR 
Packers QB Jordan Love shines in second half vs. Rams,Yahoo Sports,NASCAR 
🌱 Weekend Shooting Update + One Of Mooresvilles Own,Patch,NASCAR 
"Ryan Blaney sacré champion en NASCAR, Ross Chastain remporte ...",Autohebdo,NASCAR 
Joe Gibbs Racing releases helmet cam footage of Sammy Smith pit ...,Yardbarker,NASCAR 
Gustavo Ariel Crowned First-Ever Racing Prodigy Winner,Winding Road Magazine,NASCAR 
Report Card: A rough start turns into a gem of a win against Cal,Yahoo Sports,NASCAR 
NASCAR Brasil - Pilotos que dividem equipe disputam título,UOL,NASCAR 
UFC 295 live stream: How to watch Prochazka vs Pereira online and ...,Yahoo Sports,NASCAR 
Sri Lanka sacks entire cricket board after humiliating loss to India ...,Yahoo Sports,NASCAR 
Corbin Carroll named finalist for NL Rookie of the Year,12news.com KPNX,NASCAR 
Keselowski Finishes 15th in Season Finale at Phoenix,Speedway Digest - Home for NASCAR News,NASCAR 
Calderón gana la carrera y De Alba es el campeón de NASCAR ...,El Dictamen,NASCAR 
Texans RB Dare Ogunbowale earns special teams praise from NBC ...,Yahoo Sports,NASCAR 
No. 20 Colorado stuns top-ranked defending champion LSU in ...,Yahoo Sports,NASCAR 
NASCAR Phoenix Finale: Ryan Blaney ist neuer NASCAR-Champion 2023,Motorsport-Magazin.com,NASCAR 
Michelin Introduces Three New Motorcycle Tires,RoadracingWorld.com,MotoGP 
"Parlons MotoGP : Ducati établit une dynastie, et en voici la preuve",Paddock GP,MotoGP 
MotoGP Marquez: «Δεν σκέφτομαι να ταιριάξω με τον Rossi»,Sportime,MotoGP 
Miguel Oliveira (Aprilia): Zum zweiten Mal Vater!,SPEEDWEEK.COM,MotoGP 
Grille MotoGP 2024 : Plus qu'une place ! – GP Inside,GP Inside,MotoGP 
"MotoGP, Francesco Bagnaia: “Não acho que seja um falhanço se ...",MotoSport,MotoGP 
La pesadilla de Rins no tiene fin,Marca,MotoGP 
"MotoGP, Un'altra pazza idea: Acosta al posto di Jack Miller nel team ufficiale KTM",GPOne.com,MotoGP 
Rekor Elite Valentino Rossi; Bersama Tim Satelit pun Sanggup Raih ...,Republika Online,MotoGP 
England to face Brazil and Belgium in Wembley friendlies as Gareth ...,Eurosport COM,MotoGP 
アレックス・リンス、MotoGPマレーシアGP＆カタールGPも欠場 ...,au Webポータル,MotoGP 
"MotoGP Malaisie : Alex Rins encore forfait, Iker Lecuona sera le ...",Paddock GP,MotoGP 
How to watch Northampton Saints v Exeter Chiefs in Gallagher ...,Eurosport COM,MotoGP 
"Erik ten Hag has Sir Alex Ferguson’s backing at Man Utd, Arsenal ...",Eurosport COM,MotoGP 
¿Cómo quedó Marc Márquez en el Mundial de Moto2 en MotoGP ...,dazn.com,MotoGP 
'KTM is now Ducati's strongest challenger' – Pit Beirer,Motorcycle Sports Australia,MotoGP 
Marcus Rashford wants speculation over future to 'stop' after missing ...,Eurosport COM,MotoGP 
MotoGP & eSport #18: le curve cruciali di Chang [VIDEO] - MotoGP,Moto.it,MotoGP 
MotoGP 2023. GP della Malesia. Alex Rins ancora fuori: a Sepang e ...,Moto.it,MotoGP 
"MotoGP, Stoner punge la Ducati: “Hanno la moto più forte, ma…”",Tuttosport,MotoGP 
"MotoGP, Marc Marquez rivela perchè ha scelto Gresini",Motosprint.it,MotoGP 
"MotoGP, Paolo Ciabatti : ""en plus de l'asphalte, Ducati passe aux ...",Paddock GP,MotoGP 
Марк Маркес попрощался с шансами догнать Росси по титулам в ...,motogonki.ru,MotoGP 
Переговоры Dorna с MSMA о снижении объема двигателей ...,motogonki.ru,MotoGP 
"MotoGP, Francesco Bagnaia: “Não acho que seja um falhanço se ...",MotoSport,MotoGP 
Диего Губеллини - о бессмысленности большинства концессий ...,motogonki.ru,MotoGP 
Jackson treble fires Chelsea to chaotic victory over nine-man Spurs,Yahoo Sports,NASCAR 
Report: OKC Thunder could leave Bally Sports after 2023-24 season,Yahoo Sports,NASCAR 
McLaughlin reunites with first Supercars title winner,V8 Sleuth,NASCAR 
Ryan Blaney nuevo papel campeón NASCAR Cup Series,NASCAR,NASCAR 
Blaney conquista título da Nascar após 2º lugar em Phoenix,Grande Prêmio,NASCAR 
Brian Kelly explains tackling deficiencies in loss to Alabama,Yahoo Sports,NASCAR 
"Giants QB Daniel Jones tears ACL in right knee, ending his 2023 ...",Yahoo Sports,NASCAR 
"Man, 53, dies during swimming leg of an Australian triathlon",Yahoo Sports,NASCAR 
Blaney storms to first Cup crown,The Post Star,NASCAR 
Motorsport-Kompakt: Neuer NASCAR-Champion und Alonso-Show,Motorsport-Magazin.com,NASCAR 
"McIlroy unveils Boston entry in new team golf league, promises to ...",The Washington Post,NASCAR 
FINAL AGRIDULCE PARA ANDRIK DIMAYUGA EN ÚLTIMA FECHA ...,NASCAR Mexico,NASCAR 
Celtics star Jayson Tatum named Eastern Conference Player of the ...,Yahoo Sports,NASCAR 
Chiefs to host 'Kingdom's Greetings' holiday pop-up bar at ...,Yahoo Sports,NASCAR 
Baker's Dozen: Highlights of the Weekend (November 3-5),Yahoo Sports,NASCAR 
NASCAR | Championship 4: Ryan Blaney è il campione 2023,LiveGP.it,NASCAR 
"RODRIGO REJÓN, OBTUVO EL SUBCAMPEONATO DE NASCAR ...",NASCAR Mexico,NASCAR 
Ryan Blaney es el nuevo Campeón de NASCAR,Carburando,NASCAR 
"Giants-Raiders Week 9: Offense, defense and special teams snap ...",Yahoo Sports,NASCAR 
Thoughts While Shaving For November 6 -,BladenOnline.com,NASCAR 
"Twins add minor-league home run leader, catcher to 40-man roster",Yahoo Sports,NASCAR 
What former European Ryder Cup captains say about Luke Donald ...,Yahoo Sports,NASCAR 
ARCA Menards Series West: 2023 Phoenix II Race Review,Kickin' the Tires,NASCAR 
Mégis gyári csapatnál debütálhat Acosta a MotoGP-ben?,P1Race,MotoGP 
MotoGP 2023: Расписание и прогноз погоды Гран-При Малайзии ...,motogonki.ru,MotoGP 
"MotoGP, Capirossi difende Bastianini: ""Non si discute""",Corsedimoto,MotoGP 
Mettez le réveil une dernière fois à l'occasion du GP de Malaisie !,motogp.com,MotoGP 
Álex Márquez mantém fé num futuro título no MotoGP: 'Sonhar é ...,Motorcycle Sports Australia,MotoGP 
FA 'seeking observations from Luton Town and further detail from ...,Eurosport COM,MotoGP 
"MotoGP, Yamaha vuole cambiare per Quartararo: sarà rivoluzione?",Corsedimoto,MotoGP 
Алекс Ринс досрочно завершает сезон MotoGP 2023 ...,motogonki.ru,MotoGP 
Представители Bridgepoint изучают интерес потенциальных ...,motogonki.ru,MotoGP 
Weitere zwei MotoGP-Rennen Pause für Alex Rins: Iker Lecuona erneut Ersatzmann,Motorsport-Magazin.com,MotoGP 
Sale la temperatura: la passione per la MotoGP™ invade la Malesia,motogp.com,MotoGP 
Alex Marquez Merasa Terancam dengan Kehadiran The Baby Alien?,JPNN.com English,MotoGP 
Tires and TPMS from Goodyear play key role in Team De Rooy's ...,Tire Technology International,Dakar Rally 
Alona Ben Natan ends season due to war in Gaza,The Checkered Flag,Dakar Rally 
EICMA Live: New Royal Enfield Himalayan breaks cover,The Financial Express,Dakar Rally 
Sir Jim Ratcliffe and Newcastle owners in talks on breakaway competition amid Man Utd wait,The Mirror,Dakar Rally 
"Ulas Desain Honda CRF250 Rally, Kental Aura Balap Dakar - Kompas.com",Otomotif Kompas.com,Dakar Rally 
Be The Coolest Guy In Town With This Rare Mitsubishi Pajero ...,CarBuzz,Dakar Rally 
Yamaha’s 2024 Ténéré 700 Explore: | Motorcycle News,Superbike News,Dakar Rally 
Yamaha introduces 2024 Motorcycles and Scooters line-up | Motorcycle News,Superbike News,Dakar Rally 
Ontmoet de Nederlandse Dakar-deelnemers op Dutch Dakar,RaceXpress,Dakar Rally 
"Audi presenta “Charged by Positive Energy”, una nueva iniciativa ...",AutoHebdoSport,Dakar Rally 
Nissan Z越野拉力版！ Safari Rally Z致敬經典Datsun 240Z Safari,Yahoo,Dakar Rally 
"Hot Two-Wheelers This Week: New Bikes, Thrilling Launches, and ...",Maxabout,Dakar Rally 
Voices from Largest Pro-Palestinian Protest in U.S. History,Democracy Now!,Dakar Rally 
"nhacai so 1 sbobet,60sbet APP xét xử - 409837",Báo Sóc Trăng,Dakar Rally 
Rodríguez y Guasch ultiman la preparación para el Dakar ...,ondafuerteventura.es,Dakar Rally 
Toyota ensalza su gama deportiva en el Circuito del Jarama,Motorsport.com - ES,Dakar Rally 
Novo Mitsubishi Eclipse Cross tem redução de R$ 30 mil,Metrópoles,Dakar Rally 
"The people of the world declare: ""Palestine will be free!""",Peoples Dispatch,Dakar Rally 
Stoner Penasaran Lihat Marc Marquez Geber Ducati - Kompas.com,Otomotif Kompas.com,Dakar Rally 
Niespodziewany transfer w dakarowej stawce,Motorsport.com - PL,Dakar Rally 
Sergi Pérez y Lorena Romero son los séptimos campeones de la ...,AutoHebdoSport,Dakar Rally 
Otro Porsche 911 Dakar a la venta,espíritu RACER,Dakar Rally 
Zlot Wagner Sailing Rally w styczniu na Brytyjskich Wyspach ...,pya.org.pl,Dakar Rally 
Los hermanos Luciano y Kevin Benavides llegarán a San Juan el próximo viernes,DIARIO DE CUYO,Dakar Rally 
"Mundial 2034 na Arábia Saudita: ""É o que se chama sportswashing ...",SIC Notícias,Dakar Rally 
EICMA 2023: Yamaha - Όλη η γκάμα της Iwata σε μοτοσυκλέτα και ...,motomag,Dakar Rally 
"Muere Corrado Provera, el 'gurú' que llevó a Peugeot a lo más alto ...",AutoHebdoSport,Dakar Rally 
"Voge Valico DS900X - Ολοκληρωμένο μεγάλο Adventure, με ...",motomag,Dakar Rally 
Italjet Dragster 559 Twin - Επίδοξος... T-Max Killer στην EICMA 2023,motomag,Dakar Rally 
"Nuova Yamaha Ténéré 700 Explore: foto, caratteristiche tecniche ...",Moto.it,Dakar Rally 
EICMA 2023: UM Motorcycles - Πέντε νέα μοντέλα και είσοδος σε ...,motomag,Dakar Rally 
El fútbol abraza de nuevo a los petrodólares,Las Provincias,Dakar Rally 
EICMA 2023: Fantic XE 300 - Ο πρώτος απογαλακτισμός από τη ...,motomag,Dakar Rally 
EICMA 2023: Φουλ επίθεση της VOGE και στα Scooter!,motomag,Dakar Rally 
Piezas singulares mostradas por cien expositores,Deia,Dakar Rally 
"Lambretta Elettra - Μετά τη Vespa, στην πρίζα μπαίνει και η Lambretta",motomag,Dakar Rally 
Tenere 700 Explore - Έκδοση προσανατολισμένη στο άνετο ταξίδι,motomag,Dakar Rally 
EICMA 2023: SYM - Νέα Adventure Scooter στα 300 και 400 κυβικά ...,motomag,Dakar Rally 
Moto Morini Corsaro 750 - Νέος κουρσάρος “junior” στην EICMA 2023,motomag,Dakar Rally 
"Robótica, automatización, digitalización y ciberseguridad, las ...",Interempresas Media,Dakar Rally 
"Yamaha para 2024 lanza las MT-09 y MT-09 SP, la nueva XSR900 ...",Valenciacars,Dakar Rally 
"Yamaha Ténéré 700 Explore 2024 - Precio, fotos, ficha técnica y ...",Motorbike Magazine,Dakar Rally 
Offerte moto e scooter: le promozioni di novembre 2023,SicurMOTO.it,Dakar Rally 
"Six Days: San Juan, el escenario del inicio más duro de la historia",San Juan 8,Dakar Rally 
"Fantic a EICMA 2023: 5 nuovissimi modelli, inclusi due concept",GPOne.com,Dakar Rally 
EICMA 2023: le nostre imperdibili della kermesse milanese,Motori360.it,Dakar Rally 
En Apurímac: encuentran centro ceremonial con más de 3 mil años de antigüedad,Lima Gris,Dakar Rally 
"Falleció Iván Cruz, el enfermero de La Marina que se convirtió en el rey del bolero",Lima Gris,Dakar Rally 
Festival de arte y cultura digital en la Alianza Francesa,Lima Gris,Dakar Rally 
Audi's Electric Performance Models Unite: A New Era of Racing,Motormourth,Dakar Rally 
CFMoto Teases Upcoming Adventure Bike Ahead of EICMA 2023,Chennai Print,Dakar Rally 
F1 2023 Brasil: Keasyikan Nonton Duel Fernando Alonso VS Sergio ...,mobilinanews,Dakar Rally 
Prabowo Subianto: Kisah Karier Luar Biasa dan Perjalanan Menuju Kepemimpinan Indonesia - Nol Meter,Nol Meter,Dakar Rally 
Mengulik Kembali Legenda Mobil Sport Jepang Toyota Supra - radarbanyumas.disway.id,Radar Banyumas,Dakar Rally 
Formula E CEO Jeff Dodds Added To Race Industry Week Lineup ...,SPEED SPORT,Formula E 
Formula Weeeeeee! Flat out in the GenBeta prototype,Top Gear,Formula E 
"Soal Kepastian Jakarta Formula E 2024, Jakpro: Masih Berproses",Bisnis.com,Formula E 
Ranking: Who's at the top of the tree after pre-season testing?,Motorsport Week,Formula E 
Leading Socially Impactful Brands recognised in Third Annual ...,Laureus,Formula E 
"In the round-up: Alonso ""can't wait"" for last races as team rebounds",RaceFans,Formula E 
No chance for Leclerc to continue after electronic problem - Vasseur,RaceFans,Formula E 
Shwartzman Feels “Fully Ready” to Race Ferrari 499P After Test ...,Sportscar365,Formula E 
Brazilian Grand Prix Driver Ratings 2023,Motorsport AU,Formula E 
Hexagonal-shaped graphene quantum plasmonic nano-antenna ...,Nature.com,Formula E 
Declining Stock and Decent Financials: Is The Market Wrong About Signature International Berhad (KLSE:SIGN)?,Yahoo Finance,Formula E 
Tickets for Goodwood’s 2024 motorsport events now on sale,Yahoo News UK,Formula E 
Motorsport Monday: Your free to read weekly motorsport magazine ...,Motorsport Week,Formula E 
EVs – grid assets in the making,Energy Central,Formula E 
The answer to F1's sprint race woes despite exciting Brazil dash,msnNOW,Formula E 
