title,source,event
Мрачная новелла с 26 вариантами финала. Обзор ARCHETYPE ...,Форпост Севастополь,Shanghai Masters 
Сафиуллин поднялся на шесть позиций в рейтинге ATP ...,Форпост Севастополь,Shanghai Masters 
«Тоттенхэм» — «Челси»: прогноз Егора Титова на матч АПЛ 6 ...,Echomsk.spb.ru,Shanghai Masters 
Звонарёва стала первой с 2014 года теннисисткой-мамой ...,Echomsk.spb.ru,Shanghai Masters 
Соболенко тремя словами описала своё выступление на ...,Форпост Севастополь,Shanghai Masters 
«Придётся поговорить с «Феррари». Роберт Шварцман ...,Форпост Севастополь,Shanghai Masters 
"""Спартак"" вырвал победу в игре против СКА за секунду до конца ...",Форпост Севастополь,Shanghai Masters 
"Футболисты тольяттинского ""Акрона"" стали победителями ...",Форпост Севастополь,Shanghai Masters 
Маркелл Фульц не сыграет с «Далласом»,Echomsk.spb.ru,Shanghai Masters 
«КАМАЗ» обыграл «СКА-Хабаровск» в последнем матче первого ...,Форпост Севастополь,Shanghai Masters 
Серхио Перес нашел свое место // Макс Ферстаппен снова ...,Форпост Севастополь,Shanghai Masters 
Протокол Conflux отключает эту ключевую функцию через 2 года,Форпост Севастополь,Shanghai Masters 
Голкипер «Каролины» Андерсен выбыл на неопределенный ...,Echomsk.spb.ru,Shanghai Masters 
«Атом-Курск» уступил дома белорусской «Минчанке»,Echomsk.spb.ru,Shanghai Masters 
Генетики не нашли в Шотландии чистокровных лесных котов,Echomsk.spb.ru,Shanghai Masters 
«Оренбург» — «Ростов»: в течение 20 секунд мяч дважды попал ...,Форпост Севастополь,Shanghai Masters 
«Динамо» Минск — «Авангард»: смотреть трансляцию матча ...,Echomsk.spb.ru,Shanghai Masters 
«Аль-Кува» — «Аль-Иттихад»: смотреть трансляцию матча ...,Echomsk.spb.ru,Shanghai Masters 
«Мумбай» — «Аль-Хиляль»: смотреть трансляцию матча ...,Echomsk.spb.ru,Shanghai Masters 
Павлович — Аспиналл: когда бой и где смотреть трансляцию ...,Echomsk.spb.ru,Shanghai Masters 
«Витязь» — «Динамо»: смотреть трансляцию матча КХЛ в ...,Echomsk.spb.ru,Shanghai Masters 
Бальбуэна не сыграет против «Сочи» по семейным ...,Echomsk.spb.ru,Shanghai Masters 
«Амур» — «Локомотив»: смотреть трансляцию матча КХЛ в ...,Echomsk.spb.ru,Shanghai Masters 
Вице-премьер правительства талибов*: Иран и Афганистан ...,Echomsk.spb.ru,Shanghai Masters 
«Салават Юлаев» — «Нефтехимик»: смотреть трансляцию ...,Echomsk.spb.ru,Shanghai Masters 
"«Урал» – «Рубин». Бикфалви, Шеттине, Даку и Чумич играют ...",Echomsk.spb.ru,Shanghai Masters 
Иранский «Сепахан» разгромил «АГМК» со счётом 9:0 в матче ...,Echomsk.spb.ru,Shanghai Masters 
Китай через три года запустит фабрику по выпуску оперативной ...,Echomsk.spb.ru,Shanghai Masters 
"Первая лига. «Волгарь» разгромил «Торпедо», «Акрон» обыграл ...",Echomsk.spb.ru,Shanghai Masters 
«Динамо-Брянск» выиграл матч с омским «Иртышом»,Echomsk.spb.ru,Shanghai Masters 
"""Кристалл"" проиграл ""Горняку"" по буллитам",Echomsk.spb.ru,Shanghai Masters 
Рынок акций РФ днем в понедельник сохраняет умеренный ...,Echomsk.spb.ru,Shanghai Masters 
Yearlong 1923 commemorative wraps up with innovation reception ...,Today at Elon,The Ashes 
Artist preparing portrait using deceased man’s ashes,Mathrubhumi English,The Ashes 
"""Twice as hard as the Ashes"" - Steve Harmison advises Ben Stokes ...",Sportskeeda,The Ashes 
HEAVY MUSIC HISTORY: Through The Ashes Of Empires ...,Distorted Sound Magazine -,The Ashes 
Nine and Foxtel renew ECB rights to 2031,SportBusiness,The Ashes 
'I lost the plot for 10 minutes' - Stuart Broad recalls 'picking a fight ...,Virgin Radio UK,The Ashes 
Aussies hold on to eliminate Ashes foes - Cricket Rookie Me Central,Rookie Me Central,The Ashes 
Timed out - Sri Lanka's Angelo Mathews in unwanted international ...,TNT Sports,The Ashes 
Recent Match Report - NSW vs West Aust 11th Match 2023/24,ESPNcricinfo,The Ashes 
David Bankson of Fortis provides insights into PCR packaging's ...,Packaging Gateway,The Ashes 
Is the US-ROK Alliance Prepared for a Multipolar World?,38 North,The Ashes 
Hamas and the American crossing,Arab News,The Ashes 
Anti-oil activists attack Rokeby Venus painting with hammers,9News,The Ashes 
The specter of 'genocide' over Israel's war in Gaza - The Washington ...,The Washington Post,The Ashes 
Cremations in Whanganui trending over burials for past five years,New Zealand Herald,The Ashes 
Jacobson leaves lasting legacy at alma mater | Top Stories ...,scarsdalenews.com,The Ashes 
Trashing lithium-ion batteries causing fires across Georgia,FOX 5 Atlanta,The Ashes 
'They're coming for us all': Israel's assault on Gaza's education,DAWN.com,The Ashes 
The Israelis Who No Longer Buy Into 'Having No Other Country ...,Haaretz,The Ashes 
Sevier County not issuing burn permits due to high fire risk,WATE 6 On Your Side,The Ashes 
Savannah Chrisley Goes Instagram Official With Her Boyfriend Robert Shiver: See the Cute Couple Kiss,CBS News 8,The Ashes 
Rob Burrow and Nasser Hussain record messages for the Broadcast ...,Broadcast,The Ashes 
"Shanna Moakler Reacts to Kourtney Kardashian, Travis Barker's ...",STYLECASTER,The Ashes 
CAA Notebook: FCS Playoffs Projections & A CAA Championship ...,FloFootball,The Ashes 
The finalists for the 2023 Governor General's Literary Award for young people's literature — text,CBC.ca,The Ashes 
"As Eagles eye return trip to Super Bowl, past 30 years of NFL history ...",Yahoo Sports,Super Bowl 
19 shops gutted in fire at Borbari Tiniali market,Times of India,The Ashes 
Couple carried baby son's ashes with them as they took on gruelling challenges for hospital,Stoke-on-Trent Live,The Ashes 
"Almost 2 years after fire, downtown Hillsboro has become a ...",Here is Oregon,The Ashes 
"Afghanistan blend emotional balance and talent, with a little help from head coach Jonathan Trott",The Indian Express,The Ashes 
Mostert’s Mill in Mowbray nears completion thanks to momentous ...,News24,The Ashes 
'Turning Gaza into ashes': Israeli Hasbara vs the world,The Financial Express BD,The Ashes 
'The Bear' renewed for third season at FX,NME,The Ashes 
"Carl S. Morgan, 56, Birdseye",Dubois County Free Press,The Ashes 
Catholic Church Teachings On Cremation,CatholicVote org,The Ashes 
UFC Fight Night 231 reactions: Winning and losing fighters on social ...,MMA Junkie,The Ashes 
Volunteers plant new bitterbrush growth on Corta Fire burn site,Elko Daily Free Press,The Ashes 
Lightspeed Stock Jumps 16% After 25% Increase in Revenue,The Motley Fool Canada,The Ashes 
Rebuilt Retreat: California Home Designed by Frank Lloyd Wright Protege Is Listed for $3.7M,Realtor.com News,The Ashes 
Evangelical Christians mobilize to help Israelis touched by war,Religion News Service,The Ashes 
Australia knock England out of ICC ODI World Cup,Boxscore,The Ashes 
Anthony Housefather: Hamas massacre has unleashed a demoralizing wave of hate here at home,National Post,The Ashes 
All Weapon Coating Recipes in Baldur's Gate 3 (BG3),The Escapist,The Ashes 
"Lamb of God Played Ashes Of The Wake Deep Cut ""One Gun"" and ...",MetalSucks,The Ashes 
Mariposa County Fire Department Call Log for October 30 ...,Sierra Sun Times,The Ashes 
"Stand with Israel if you value democracy, equality, human rights",The Jerusalem Post,The Ashes 
Open Statement: U.S. Koreans for Palestine,Workers World,The Ashes 
Pravin Gordhan's rough ride from anti-corruption hero to being an ...,msnNOW,The Ashes 
'I don't think so': Langer rejects fan boycott 'narrative',msnNOW,The Ashes 
"'Now we've got hope back,' says sister of Emily Hand",RTE.ie,The Ashes 
Why Usher Is Getting Paid $0 to Play the Super Bowl Halftime Show,Cosmopolitan,Super Bowl 
Usher gears up for Super Bowl,The Columbian,Super Bowl 
Usher revealing details about Super Bowl performance,Toowoomba Chronicle,Super Bowl 
"""Collections on Tour"" exhibit showcases rare Cowboys Super Bowl memorabilia",CBS News,Super Bowl 
"Tigers outlast Kish for Super Bowl victory | News, Sports, Jobs - The ...",Lewistown Sentinel,Super Bowl 
NFL surprises Las Vegas student with Super Bowl tickets,KLAS - 8 News Now,Super Bowl 
Report: CBS already close to selling out Super Bowl LVIII ...,SportsPro Media,Super Bowl 
"2023 NFL midseason awards picks, playoff predictions: Who wins MVP, Super Bowl?",FOX Sports,Super Bowl 
Plan in the works to help unhoused population ahead of Super Bowl LIX,WWLTV.com,Super Bowl 
Temporary ‘Dropicana’ configuration for F1 may be test run for Super Bowl weekend,Yahoo News,Super Bowl 
"NFL Playoff Picture 2023: Week 10 Standings, Super Bowl Odds and Wild Card Hunt",Bleacher Report,Super Bowl 
Has the Bills' Super Bowl window closed? - NFL,TSN,Super Bowl 
NFL Fans React to Super Bowl Logo Colors Conspiracy,Distractify,Super Bowl 
Has the Bills' Super Bowl window closed?,TSN,Super Bowl 
Top 10 QBs who never won a Super Bowl,GIVEMESPORT,Super Bowl 
Chiefs lean on defense to bail out offense during 7-2 start to try to repeat Super Bowl title,Yahoo News,Super Bowl 
Jr. Buffs reach Central Valley Youth Super Bowl in three levels,Manteca Bulletin,Super Bowl 
Colts work out one-time Super Bowl champ,Yardbarker,Super Bowl 
"Art Hains, voice of MSU Bears, gifted a Kansas City Super Bowl ring",KY3,Super Bowl 
"The 9 teams that can win the Super Bowl, plus James Harden’s debut",The Athletic,Super Bowl 
What 2024 Super Bowl odds look like headed into Week 10,DraftKings,Super Bowl 
"Rihanna's super-bowl red hot outfit was sold for $3,000",Luxebook,Super Bowl 
Updated Super Bowl Odds: Chiefs Favored with Eagles Close ...,The Action Network,Super Bowl 
DraftKings Network: Is the Buffalo Bills Super Bowl window closed?,DraftKings,Super Bowl 
NFL Winners and Losers: Maybe this is the season Lamar Jackson ...,Yahoo Sports,Super Bowl 
Members of K-pop band ATEEZ say their dream is to perform at the ...,Bradford Era,Super Bowl 
AMA Jr. Bullfrogs beat Calaveras Jr. Red Hawks 20-0 to win MVFL ...,Calaveras Enterprise,Super Bowl 
Did Darrelle Revis Win a Super Bowl?,Pro Football Network,Super Bowl 
Eagles Super Bowl odds: Why the best time to bet on Philadelphia is ...,Philly Sports Network,Super Bowl 
Notre Dame VS Clemson: Overreactions,One Foot Down,The Ashes 
Call of Duty: Modern Warfare 3 ending explained,GAMINGbible,The Ashes 
Like living stones: University and seminary history conveyed through ...,The Chimes,The Ashes 
The Return of Ringling (Nov. 3-5)—A Chat with Circus Artist Jan ...,CircusTalk,The Ashes 
'Real Housewives of O.C.' Alum Kara Keough Gives Birth to Fourth Child Three Years After Son McCoy's Death,CBS News 8,The Ashes 
Think Bairstow run-out was stinky? Here’s our list of controversial cricket outs,Sydney Morning Herald,The Ashes 
A Place in the Sun's Danni Menzies flooded with support after 'dark times' update,Liverpool Echo,The Ashes 
Henrietta Knight: Best Mate trainer to return 11 years after retiring,Yahoo Sports,The Ashes 
Why Lagos is deepening investment in critical infrastructure — Sanwo-Olu,Businessday,The Ashes 
Mountaineers survive season debut behind Edwards and Slazinski,The Dominion Post,The Ashes 
England's plans for 2024 in jeopardy,Serious About Rugby League,The Ashes 
Aussies Know Best: The Best Betting Sports in AU – Five Reasons ...,Five Reasons Sports Network,The Ashes 
The 25 greatest revenge movies,Yardbarker,The Ashes 
What next for England after a disastrous Cricket World Cup?,Evening Standard,The Ashes 
Roxanne Lee Cooley | Obituaries | channel3000.com,Channel3000.com - WISC-TV3,The Ashes 
Seeking justice for pets dumped on side of Utah road,KTNV 13 Action News Las Vegas,The Ashes 
OnlyFans Had More Regretted Investments Than OWL Team Owners,Medium,The Ashes 
Obituary: Peter G. MacDonald,Press Herald,The Ashes 
ENG vs NED ODI Head To Head Stats & Record Ahead of ICC ...,myKhel,The Ashes 
Toolstation Western League: Saltash United 1-2 Bridgwater United FC,Bridgwater Mercury,The Ashes 
Dortmund coach Terzic demanding a positive mindset ahead of ...,Xinhua,The Ashes 
Leila Farsakh · 'The Refugee Problem',London Review of Books,The Ashes 
Indiscriminate: The sickening lure of collective punishment,OnlySky Media,The Ashes 
Win A Copy Of The Book 'Just Once: A Novel' By Karen Kingsbury,RedCarpetCrash.com,The Ashes 
House gutted in fire at Moijing Idigah Road : 07th nov23 ~ E-Pao ...,E-Pao.net,The Ashes 
"The 'new' village in Wales that's still just a big housing estate with no schools, parks and shops",North Wales Live,The Ashes 
"The Problem With Calling Hamas ""Nazis""",Worldcrunch,The Ashes 
Drew's Decrees: It's too early to listen to Christmas music,The Post,The Ashes 
Arnot coal mine fight heads to appeals court,Sunday World,The Ashes 
Dolly Parton now open to Super Bowl show,Courier Mail,Super Bowl 
3X Super Bowl champ Shannon Sharpe drops his top 5 HBCU NFL ...,Sportskeeda,Super Bowl 
"C.J. Stroud, Dolphins Fraud Watch, and Ravens Super Bowl Hopes",The Ringer,Super Bowl 
NFL Week 9 aftershocks: Can defense carry Chiefs to Super Bowl?,Yardbarker,Super Bowl 
NFL: Defending Super Bowl champions bounce back from shock ...,Irish Independent,Super Bowl 
4 reasons to consider Baltimore Ravens as Super Bowl favorites,Ebony Bird,Super Bowl 
"Keaton Mitchell, undrafted rookie from ECU, makes impression on former Ravens' Pro Bowl RB Ray Rice",CBS Baltimore,Super Bowl 
Thornton Center and Haslam College of Business Partner for Big ...,University of Tennessee Athletics,Super Bowl 
“The narrative will continue until we change it”: McDaniel believes Dolphins not worried about losing to winning teams,NBC 6 South Florida,Super Bowl 
Sights of the Game: Week 9 Gameday Entertainment vs. Giants,Raiders.com,Super Bowl 
Save the date! 2025 NFL Draft dates officially announced,WGBA NBC 26 in Green Bay,Super Bowl 
O.J. Simpson underlines why he isn't picking Joe Burrow's Bengals ...,Sportskeeda,Super Bowl 
4 Takeaways: Saints takin' care of business,WWLTV.com,Super Bowl 
Texas State football bowl eligible for first time in nine years,University Star,Super Bowl 
"Hasbro Teases Three 'D&D' Series; 'Echo,' 'Godzilla Minus One,' and ...",ICv2,Super Bowl 
Bill Belichick avoids questions about job security with Patriots at 2-7 ...,Yahoo Sports,Super Bowl 
3 Chiefs on Thin Ice Entering Bye Week Despite Win vs. Dolphins,KC Kingdom,Super Bowl 
Which NFL teams are on bye week in Week 10?,dazn.com,Super Bowl 
O-Zone: Good conversation,jaguars.com,Super Bowl 
NBA All-Stars return to Bay Area in 2025 in early test for group ...,The Business Journals,Super Bowl 
How The Kansas City Chiefs Became So Popular In Germany,Forbes,Super Bowl 
Schrock's NFL Power Rankings: Where Bears stand after sloppy ...,Yahoo Sports,Super Bowl 
The Niagara Independent,The Niagara Independent,Super Bowl 
"""The NFL Today"" host James Brown speaks with Nate Burleson ...",CBS News,Super Bowl 
Clark Hunt Net Worth: How much money the CEO of the Kansas City Chiefs has,Marca English,Super Bowl 
Exploring Pepsi’s Super-Sized Pop Impact,Rolling Stone,Super Bowl 
Eagles: Where Is Trey Burton Now? Former Tight End Won Super Bowl LII With Philadelphia,Sports World News,Super Bowl 
"Pittsburgh Steelers vs. Green Bay Packers: Date, kick-off time ...",dazn.com,Super Bowl 
Rams falling out of playoff contention with a 3-game skid and ...,USA TODAY,Super Bowl 
Four-star Andrew Dennis to announce commitment at All-American Bowl,247Sports,Super Bowl 
Schrock's NFL Power Rankings: Where 49ers stand during Week 9 ...,Yahoo Sports,Super Bowl 
Kentucky Derby Maiden Watch: Knightsbridge catches the eye,TwinSpires.com,Kentucky Derby 
Western & Southern Open To Remain In Cincinnati,ATP Tour,Cincinnati Masters (Western & Southern Open) 
Sports News,LatestLY,The Ashes 
Over seven decades of friendship,Manila Bulletin,The Ashes 
Doctor Who fan laid to rest in TARDIS in themed funeral in Rotherham,Yahoo Eurosport UK,The Ashes 
Darkness of War,The Review of Religions,The Ashes 
Fire breaks out at parking lot in Mumbai's Dadar; vehicles destroyed,ANI News,The Ashes 
'Cottontail': Rome Review | Reviews | Screen,Screen International,The Ashes 
"Edward R. Vitarius, 88",Port City Daily,The Ashes 
"Naxalites set fire to a clothing factory to boycott elections, panic spread in area",ఇండియా హెరాల్డ్ గ్రూప్ అఫ్ పబ్లిషర్స్ ప్రై లిమిటెడ్ - India Herald Group of Publishers P LIMITED,The Ashes 
"PHOTOS: Poplar Drive Fire on Nov. 6, the fourth day of the fire",BlueRidgeNow.com,The Ashes 
Jennifer Ashe and Son offers new way of scattering ashes,Funeral Service Times,The Ashes 
1963: Surgery aids ear victims with otosclerosis,South Bend Tribune,The Ashes 
Smith 'not feeling great' on eve of Afghanistan clash | cricket.com.au,cricket.com.au,The Ashes 
"The Sault, a place worth writing about",Sault This Week,The Ashes 
Karrueche Tran spills out of tiny denim bra-top while attending Travis Scott's afterparty in Hollywood,Daily Mail,The Ashes 
"Payal Ghosh slams Bollywood director for fat-shaming her, talks ...",Passionate In Marketing,The Ashes 
"Admit It, 'Game of Thrones' Ruined Tyrion",Collider,The Ashes 
LETTER TO THE EDITOR: Israel-Hamas war: Voices for peace,The Guam Daily Post,The Ashes 
Former patients of Booth Hall and Calderstones Hospitals ...,Burnley Express,The Ashes 
"NFL targets Spain, Brazil to host international games in 2024",Sports Business Journal,Super Bowl 
Ravens Boast NFL's Top Points Differential; Best Defense Since ...,Sports Illustrated,Super Bowl 
Gallo Winery has new NFL contest: It may or may not include Taylor Swift,Yahoo Canada Sports,Super Bowl 
"LA28, World Cup top security rankings bring in significant federal ...",Sports Business Journal,Super Bowl 
Taylor Swift and Brittany Mahomes Seen Hanging Out At Star ...,Men's Journal,Super Bowl 
49ers' Chase Young 'wasn't mad' with Commanders trading him to ...,Yahoo Sports,Super Bowl 
Chiefs become first team to win in four different countries,Yahoo Sports,Super Bowl 
The NFL's Single-Season and Single-Game Rookie Records,The Analyst,Super Bowl 
Who do Bills play next? Monday Night Football vs Broncos up next,Democrat & Chronicle,Super Bowl 
Chargers GM Tom Telesco reportedly apologized to DBs for signing ...,Yahoo Sports,Super Bowl 
A.J. Brown and DeVonta Smith recreated the iconic LeBron alley-oop: Did James like it?,Marca English,Super Bowl 
'Not enough complementary football' | The Bills struggle on all three ...,BuffaloBills.com,Super Bowl 
Neil Reynolds' Wraps Week 9,NFL.com,Super Bowl 
"NFL Four Downs: AFC powerhouses get going as Chiefs, Ravens ...",The West Australian,Super Bowl 
"Before being fired, Josh McDaniels berated Antonio Pierce for bringing up Patriot's Super Bowl XLII defeat during pep talk",PINKVILLA,Super Bowl 
NFL Power Rankings entering Week 10,Yahoo Sports,Super Bowl 
Eagles stand strong as best in NFL even as Jalen Hurts stands in ...,USA TODAY,Super Bowl 
A Winning Wedding: Brooke and Rob Rittner tie the knot at an ...,PhiladelphiaEagles.com,Super Bowl 
"Chiefs' Patrick Mahomes, Eagles' Jalen Hurts lead NFL MVP race ...",Yahoo Sports,Super Bowl 
"Bill Belichick made this messy Patriots season, and despite current ...",Yahoo Sports,Super Bowl 
Taylor Swift Liked PEOPLE's Instagram About Travis Kelce's Record ...,PEOPLE,Super Bowl 
49ers Urged to Sign Super Bowl Champion Blocker,Heavy.com,Super Bowl 
Kevin Hart and Sons Show Off Dance Moves in Support of ...,PEOPLE,Super Bowl 
"Odell Beckham Jr. draws comparison between 2023 Ravens, 2021 Rams",Yardbarker,Super Bowl 
Colts 2024 season tickets on sale today,Colts.com,Super Bowl 
Cowboys’ Dak Prescott Reveals Brutal 1-Word Response To Eagles’ Loss,Yardbarker,Super Bowl 
Peter King: Panthers 'on deck' in Germany,Yahoo Sports,Super Bowl 
Jake Ferguson stands out for the Cowboys and fans notice a detail on his helmet: Why is he wearing the Spanish flag?,Marca English,Super Bowl 
How Derby got its name - and the proper way to pronounce it,Yahoo News UK,Kentucky Derby 
16-1 shot Fierceness wins Breeders' Cup Juvenile,Jamaica Observer,Kentucky Derby 
Bass Racing's Seal Team wins Twilight Derby on Breeders' Cup ...,Fort Worth Business Press,Kentucky Derby 
Most Memorable Moments of Horse Racing History - EssentiallySports,EssentiallySports,Kentucky Derby 
Who's the Horse of the Year now that the Breeders' Cup results are in?,UPI News,Kentucky Derby 
"White Abarrio wins $6-m Breeders' Cup Classic, trainer Rick Dutrow back on top after 10-year exile",Jamaica Observer,Kentucky Derby 
Virginia's capital city voting again on whether to allow a casino,Yahoo Canada Finance,Kentucky Derby 
Keeneland's 80th November Breeding Stock Sale Begins ...,Keeneland,Kentucky Derby 
Horse racing: Bossier City resident Henry B. Johnson reaches ...,Bossier Press-Tribune Online,Kentucky Derby 
"LA28, World Cup top security rankings bring in significant federal ...",Sports Business Journal,Kentucky Derby 
"Cody Dorman, namesake of Cody's Wish, dies at 17",Daily Racing Form,Kentucky Derby 
Steelers have uphill battle during second half in NFL's toughest ...,The Killeen Daily Herald,Kentucky Derby 
Breeders' Cup winning trio caps big year for Curlin,Daily Racing Form,Kentucky Derby 
Well-traveled Secretariat sculpture will preside over Ashland holiday ...,Richmond Times-Dispatch,Kentucky Derby 
"Forecast: For all their warts, Saints lead NFC South after win over Bears",WWLTV.com,Kentucky Derby 
Here’s what you missed in Garland County sports the week of Oct. 30,Hot Springs Sentinel,Kentucky Derby 
"Tiznow, the Two-Time Breeders' Cup Winner and Beacon of Hope ...",America's Best Racing,Kentucky Derby 
"BetMGM Kentucky Bonus Code BOOKIESFB200: Bet $10, Get $200 ...",Bookies.com,Kentucky Derby 
Pigeon racing in Colorado: It's all about the miraculous rush home,Colorado Springs Gazette,Kentucky Derby 
Melbourne Cup: endless media coverage drives gambling addiction,Crikey,Kentucky Derby 
"Aaron Rodgers Takes Off His Shoes at the Breeders' Cup, to Reveal ...",The Messenger,Kentucky Derby 
Investors Target Louisville as Multifamily Market Outperforms ...,REBusinessOnline,Kentucky Derby 
Lynn Mitchell Obituary - Bagnell & Son Funeral Home - 2023,Legacy.com,Kentucky Derby 
Your quick guide to the most-watched races of Election Day 2023,PBS NewsHour,Kentucky Derby 
"The tournament stays, but not the name: Western & Southern steps ...",WCPO 9 Cincinnati,Cincinnati Masters (Western & Southern Open) 
"Western & Southern Open not moving to Charlotte, staying in ...",The Cincinnati Enquirer,Cincinnati Masters (Western & Southern Open) 
Beemok set to make changes to Cincinnati tennis tournament in 2024,The Cincinnati Enquirer,Cincinnati Masters (Western & Southern Open) 
How Cincinnati prevailed over Charlotte in a tennis battle of the ...,Tennis Magazine,Cincinnati Masters (Western & Southern Open) 
Cincinnati came together to save Western & Southern Open | Opinion,The Cincinnati Enquirer,Cincinnati Masters (Western & Southern Open) 
Novak Djokovic sets sights on major goals after securing Paris ...,Western People,Cincinnati Masters (Western & Southern Open) 
"11-Year-Old Boy Killed, 5 Others Injured in Cincinnati Shooting ...",PEOPLE,Cincinnati Masters (Western & Southern Open) 
Cincinnati organist with local ties to perform Saturday,Yahoo Entertainment,Cincinnati Masters (Western & Southern Open) 
What will people vote on in the 2023 election?,The Cincinnati Enquirer,Cincinnati Masters (Western & Southern Open) 
"Western & Southern Open 2023: Draws, Dates, History & All You ...",ATP Tour,Cincinnati Masters (Western & Southern Open) 
"Novak Djokovic Saves MP, Stuns Carlos Alcaraz For Cincinnati Title",ATP Tour,Cincinnati Masters (Western & Southern Open) 
From Cincinnati to Charlotte? Future of Western & Southern Open ...,Tennis Magazine,Cincinnati Masters (Western & Southern Open) 
Ohio high school football: West Clermont coach Nate Mahon steps ...,The Cincinnati Enquirer,Cincinnati Masters (Western & Southern Open) 
Cincinnati Draw: Felix Auger-Aliassime vs. Matteo Berrettini Among ...,ATP Tour,Cincinnati Masters (Western & Southern Open) 
"Gauff earns 1st Masters 1000 title, wins Western & Southern Open - ESPN",ESPN,Cincinnati Masters (Western & Southern Open) 
