title,href
Dubs' Kerr calls Draymond's actions 'inexcusable',/nba/story/_/id/38916769/draymond-green-suspension-deserved-warriors-kerr-says
Morant can claim self-defense for fight with teen,/nba/story/_/id/38914333/ja-morant-lawyers-argue-fight-teen-was-self-defense
Hornets' Bridges anxious to return after 583 days,/nba/story/_/id/38914334/hornets-miles-bridges-anxious-return-583-days
Clips' George fined $35K for criticizing officiating,/nba/story/_/id/38916877/clippers-paul-george-fined-35k-criticizing-officiating
AD says injury not to blame: 'I just played bad',/nba/story/_/id/38910226/lakers-anthony-davis-says-injury-not-blame-9-point-night-vs-kings
"Down 2 stars, Celts show 'luxury' of depth in win",/nba/story/_/id/38907954/celtics-jaylen-brown-kristaps-porzingis-sixers
Draft rankings: Top 25 prospects,/nba/insider/story/_/id/38788364/2024-nba-draft-rankings-espn-top-25-prospects
Betting: Picks for Nets-Heat and Thunder-Warriors,/espn/betting/story/_/id/38913236/2023-nba-thursday-betting-odds-tips-lines-stats-more-november-16
Fantasy basketball tips and projections for Thursday,/fantasy/basketball/story/_/id/38905627/mens-fantasy-basketball-tips-projections-cheat-sheet-thursday-11-16-23
Dubs' Kerr calls Draymond's actions 'inexcusable',/nba/story/_/id/38916769/draymond-green-suspension-deserved-warriors-kerr-says
Morant can claim self-defense for fight with teen,/nba/story/_/id/38914333/ja-morant-lawyers-argue-fight-teen-was-self-defense
Hornets' Bridges anxious to return after 583 days,/nba/story/_/id/38914334/hornets-miles-bridges-anxious-return-583-days
Clips' George fined $35K for criticizing officiating,/nba/story/_/id/38916877/clippers-paul-george-fined-35k-criticizing-officiating
AD says injury not to blame: 'I just played bad',/nba/story/_/id/38910226/lakers-anthony-davis-says-injury-not-blame-9-point-night-vs-kings
"Down 2 stars, Celts show 'luxury' of depth in win",/nba/story/_/id/38907954/celtics-jaylen-brown-kristaps-porzingis-sixers
Draft rankings: Top 25 prospects,/nba/insider/story/_/id/38788364/2024-nba-draft-rankings-espn-top-25-prospects
