Casino,Title,Disputed Amount,Safety Index,Submitted Date
SpinBetter Casino,Player claims that payment has been delayed.,€42,High,30 Oct 2023
Botemania Casino,Player is encountering validation issues for withdrawal.,€60,Very high,30 Oct 2023
Captain Jack Casino,Player's bonus winnings have been partially confiscated.,"$2,000",Below average,29 Oct 2023
Coinplay Casino,Player's deposit was not credited.,Ξ1,Fresh casino,29 Oct 2023
Palms Bet Casino,Player struggles with complicated verification process.,134 лв,High,29 Oct 2023
Casino Royal Dragon,Player's withdrawal request rejected due to bonus terms dispute.,$100,Low,29 Oct 2023
Slotmaniax Casino,Player’s winnings haven’t been received yet.,€200,High,29 Oct 2023
VIP Arab Club Casino,Player experiences issues with slot machine betting.,300 Lek,Low,29 Oct 2023
Tournaverse Casino,Player's withdrawal is delayed.,€400,Low,29 Oct 2023
1win Casino,Player's account unexpectedly blocked.,"4,768,792 INR",Above average,29 Oct 2023
AMPM Casino,Player's winnings were confiscated.,"19,000 zł",Below average,29 Oct 2023
Brango Casino,Player’s winnings have been confiscated.,$450,High,29 Oct 2023
Casumo Casino,Player's account locked during winnings withdrawal.,"$20,000",High,29 Oct 2023
Bet24-7 Casino,Player’s winnings have been confiscated.,"€2,000",Below average,29 Oct 2023
1win Casino,Player cannot withdraw his winnings.,€400,Above average,29 Oct 2023
Ruby Slots Casino,Player struggles with winning payment denial.,$100,Above average,29 Oct 2023
21 Prive Casino,Player questions the legitimacy of the Casino.,10 лв,Above average,29 Oct 2023
Bet O Bet Casino,Player believes that their withdrawal has been delayed.,"€1,330",Very low,29 Oct 2023
Getwin Casino,Player's account with a balance has been blocked.,"$3,600",Very low,29 Oct 2023
Silver Oak Casino,"Delay in $1,000 withdrawal.","$1,000",Above average,29 Oct 2023
Betandplay Casino,Reopened player account questions unanswered.,€50,Above average,29 Oct 2023
Ocean Breeze Casino,Player’s withdrawal remains delayed.,€130,Very low,29 Oct 2023
Bet O Bet Casino,Player’s withdrawal has been delayed.,€861,Very low,29 Oct 2023
QuickWin Casino,Player’s withdrawal has been delayed.,€500,Very high,28 Oct 2023
1win Casino,Player experiencing verification issues during withdrawal.,"$10,000 CLP",Above average,28 Oct 2023
Weiss Casino,Player’s winnings are withheld.,456 TRX,High,28 Oct 2023
NordSlot Casino,Player’s winnings are cancelled and account is blocked.,"€3,830",Above average,28 Oct 2023
CosmicSlot Casino,Player’s withdrawal has been delayed.,€800,High,28 Oct 2023
LottoHoy Casino,Player claims that payment has been delayed.,€500,Fresh casino,28 Oct 2023
Monro Casino,Player from restricted location had account blocked.,$25,High,28 Oct 2023
BigWins Casino,Player’s withdrawal is significantly delayed.,£320,Very low,28 Oct 2023
Vulkan Vegas Casino,Peruvian Player's account blocked on geographical grounds.,460 S/.,Very high,28 Oct 2023
GuruPlay Casino,Player believes that their withdrawal has been delayed.,"€4,002",Low,28 Oct 2023
Ruby Slots Casino,Player claims that payment has been delayed.,$100,Above average,28 Oct 2023
PariPesa Casino,Player believes that their withdrawal has been delayed.,€85,Low,28 Oct 2023
BABU88 Casino,Player's deposited funds not added to the account.,700 INR,Above average,28 Oct 2023
BoGamba Casino,Player’s winnings haven’t been received yet.,"$2,120",Below average,28 Oct 2023
Raging Bull Slots Casino,Player claims that payment has been delayed.,$150,Above average,28 Oct 2023
Lucky Legends Casino,Player's withdrawal is delayed.,$939,Below average,28 Oct 2023
WinPort Casino,Player experiences delay in $2000 withdrawal.,"$2,000",Below average,28 Oct 2023
Royal Ace Casino,Player claims that payment has been delayed.,$110,Above average,28 Oct 2023
Raging Bull Slots Casino,Player's withdrawal is delayed.,"$2,500",Above average,28 Oct 2023
Parimatch Casino,Player's withdrawal delayed by verification process.,"21,015 S/.",Above average,28 Oct 2023
Casino33,Player’s winnings blocked in the account.,"$18,000 ARS",Very low,28 Oct 2023
Slots Safari Casino,Player challenges deposit descriptors and account closure.,£298,Very low,28 Oct 2023
Vegas Lounge Casino,Player's account closed after early bonus request.,??,Below average,28 Oct 2023
Rajabets Casino,Player experiences KYC verification delay.,"39,300 INR",Above average,28 Oct 2023
Casinoin,Casino withholding player's winnings over irrelevant documents.,"€1,650",High,28 Oct 2023
QuickWin Casino,"Player’s game freezes, blocking access to winnings.",€75,Very high,28 Oct 2023
Platincasino,Player's account blocked by Casino.,€365,High,28 Oct 2023
iWild Casino,Player reports confiscated winnings and account closure.,"3,000 R$",High,27 Oct 2023
Paradise 8 Casino,Delayed withdrawal and lack of communication.,$100,Low,27 Oct 2023
Raging Bull Slots Casino,Player's withdrawal request is unresolved.,$70,Above average,27 Oct 2023
PrimeBetz Casino,Player's withdrawal is cancelled and withdrawal methods removed.,€567,Below average,27 Oct 2023
Betstarexchange Casino,Player's loss bonus is delayed.,700 INR,Low,27 Oct 2023
BonusBet Casino,Player’s withdrawal is delayed.,"€4,000",Very low,27 Oct 2023
RANT Casino,Player complains about delayed verification process.,€250,High,27 Oct 2023
Vulkan Vegas Casino,Player’s withdrawal is delayed.,€900,Very high,27 Oct 2023
Bankonbet Casino,Player with gambling addiction breached self-exclusion.,"€10,000",Above average,27 Oct 2023
Snatch Casino,Player experiences withdrawal restrictions despite a high VIP account level.,"€57,500",High,27 Oct 2023
Anonym Bet Casino,Player’s winnings have been confiscated.,"€4,500",Very low,27 Oct 2023
Indibet Casino,Player's account was disabled due to a duplicate account accusation.,"23,850 INR",Above average,27 Oct 2023
Gamdom Casino,Casino failed to support responsible gambling for addicted player.,€600,Very high,27 Oct 2023
Hornetbet Casino,Player struggles with withdrawal due to unclear bonus wagering.,€510,Above average,27 Oct 2023
Play Fortuna Casino,Player’s winnings have been confiscated over an alleged rules violation.,€583,High,27 Oct 2023
Lucky Red Casino,Player suspects fraudulent activity at a casino.,"$4,000",Very high,27 Oct 2023
Scarabwins Casino,Player claims unauthorized transactions with SCARABWINS.,£95,Low,27 Oct 2023
Bet O Bet Casino,Player’s withdrawal has been delayed.,"€2,200",Very low,27 Oct 2023
Sultanbet Casino,Player's withdrawal is delayed due to KYC process.,"$35,000",Above average,27 Oct 2023
Royal Ace Casino,Player’s winnings haven’t been received yet.,"$1,601",Above average,27 Oct 2023
Smokace Casino,Player’s winnings haven’t been received yet.,800 R$,High,27 Oct 2023
Pacific Spins Casino,Player experiences difficulties with account verification.,$50,Below average,27 Oct 2023
DuckyLuck Casino,Player experiences game glitch and lost deposit.,$70,Below average,27 Oct 2023
Tournaverse Casino,Player's withdrawal has been delayed.,"¥196,000",Low,27 Oct 2023
Wettenlive Casino,Player's deposit has not been credited correctly.,"€1,000",Low,27 Oct 2023
MyStake Casino,Player unable to bet due to activated bonus.,"$2,625 ARS",Above average,27 Oct 2023
Heaps O Wins Casino,Player was denied winnings from free spins.,$100,Above average,27 Oct 2023
Lucky Legends Casino,Player struggles with delayed withdrawal process.,"$1,497",Below average,27 Oct 2023
Dachbet Casino,Player claims that payment has been delayed.,"€1,967",Very low,27 Oct 2023
GoldenLion.bet Casino,Player's self-exclusion request is ignored.,??,Very low,27 Oct 2023
Mr Sloty Casino,Player has delayed withdrawal issue.,£449,Very low,27 Oct 2023
Smokace Casino,Player’s winnings haven’t been received yet.,€200,High,27 Oct 2023
GoldenPark Casino PT,Player's withdrawal delayed due to document verification.,€790,High,27 Oct 2023
Vulkan Vegas Casino,Player's account blocked during name amendment process.,$447 CLP,Very high,26 Oct 2023
Winz.io Casino,Player's winnings confiscated after sudden country restriction.,$300,High,26 Oct 2023
Paradise 8 Casino,Player’s account has been blocked following verification process.,€100,Low,26 Oct 2023
Genting Casino,Player has login and deposit issues.,??,High,26 Oct 2023
PariPesa Casino,Player’s winnings haven’t been received yet.,€120,Low,26 Oct 2023
Wazamba Casino,Player's account suddenly frozen after verification.,"€11,226",Very high,26 Oct 2023
Lucky7even Casino,Player’s deposit not credited to account.,"22,450 руб",Fresh casino,26 Oct 2023
Stake Casino,Player could not pass the fourth level of account verification.,560 ₮,Above average,26 Oct 2023
BC.Game Casino,Player’s deposit and bonus fund are locked.,"10,000 ₦",Above average,26 Oct 2023
Weiss Casino,Player's withdrawal is delayed.,"8,710 ₮",High,26 Oct 2023
FoxyPlay Casino,Player complains about confiscated winnings and language discrepancy in T&Cs.,"16,560 kr",Fresh casino,26 Oct 2023
Hold'N'Spin Casino,Delayed withdrawal and deducted funds experienced by player.,"€2,603",Fresh casino,26 Oct 2023
FoxyPlay Casino,Player is struggling with an excessive wagering requirement.,"Can$2,413.9",Fresh casino,26 Oct 2023
Sol Casino,Player's withdrawal is being delayed.,790 ₮,High,26 Oct 2023
Stake Casino,Player struggles with delayed account verification.,281 R$,Above average,26 Oct 2023
Ruby Slots Casino,Player has difficulties in account verification.,$80,Above average,26 Oct 2023
Bankonbet Casino,Player's account is not closed despite request.,€150,Above average,26 Oct 2023
LevelUp Casino,Player’s winnings haven’t been received yet.,"A$2,400",High,26 Oct 2023
iWild Casino,Player's winnings have been deducted significantly due to a bonus.,"Can$1,500",High,26 Oct 2023
Sunrise Slots Casino,Player is experiencing delayed withdrawal.,$100,Below average,26 Oct 2023
1win Casino,Player's withdrawal is delayed.,"$8,000 ARS",Above average,26 Oct 2023
bwin Casino DE,Player encounters gaming software issue.,"€1,234",High,26 Oct 2023
BetOnRed Casino,Player was denied promised cashbacks.,€11,Fresh casino,26 Oct 2023
,Player suspects unlicensed use of game by casinos.,"4,000 KM",,26 Oct 2023
1Bet Casino,Player's withdrawal was repeatedly canceled.,€95,Very low,26 Oct 2023
LuckyNiki Casino DE,Player’s winnings haven’t been received yet.,€430,High,25 Oct 2023
1win Casino,Player’s account blocked with balance after KYC check.,"100,000 INR",Above average,25 Oct 2023
YoCasino,Unresolved tournament credit issue.,??,High,25 Oct 2023
Bitcasino.io,Player's promised cashback remains unpaid.,160 ₮,High,25 Oct 2023
Bitcasino.io,Player didn’t receive promised cashback.,$140,High,25 Oct 2023
22bet Casino,Player's account was closed due to accusations of opening multiple accounts.,€975,Low,25 Oct 2023
CatCasino,Player faces repeated game disruptions.,??,Very high,25 Oct 2023
Palm.Casino,Player from UK denied withdrawal and subsequently kicked out.,"€6,200",Very low,25 Oct 2023
Vulkan.bet Casino,Player's account blocked due to friend's activities.,"€6,200",High,25 Oct 2023
Lucky Creek Casino,Player gets conflicting information about winnings.,"$5,500",Below average,25 Oct 2023
Big5Casino,Player's withdrawal is delayed.,€900,Below average,25 Oct 2023
GoldenLion.bet Casino,Player's withdrawal is delayed.,£103,Very low,25 Oct 2023
Sector 777 Casino,Withdrawal of player's winnings has been delayed.,£89,Low,25 Oct 2023
BC.Game Casino,Player’s account access restricted with funds inside.,"2,400,000 INR",Above average,25 Oct 2023
Betfair Casino,Betfair account closure results in delayed refund for UK player.,"£7,000",High,25 Oct 2023
Pacific Spins Casino,Player's documents were denied with no explanation.,$50,Below average,25 Oct 2023
GoSlot! Casino,Player claims GoSlot refuses to pay winnings.,"€14,000",Above average,25 Oct 2023
PrimaPlay Casino,Player faces deposit and bonus issues.,??,Below average,25 Oct 2023
GoldenSpin Casino,Player’s withdrawal has been delayed.,"$1,000",Very low,25 Oct 2023
Slots of Vegas Casino,Player experiences withdrawal delay.,"$2,300",Above average,25 Oct 2023
Lucky Legends Casino,Player’s withdrawal is continuously delayed.,$600,Below average,25 Oct 2023
Rollino Casino,Player’s withdrawal has been delayed.,"€3,000",Above average,25 Oct 2023
Slots33 Casino,Player's account deleted upon withdrawal attempt.,"2,000 RM",Very low,25 Oct 2023
Bodog Casino,Player's account has been closed unexpectedly.,$329,Below average,25 Oct 2023
SpinBetter Casino,Player's account closure request is ignored.,"€3,000",High,25 Oct 2023
StayCasino,Player's withdrawal was denied.,€300,High,25 Oct 2023
Slootz Casino,Player believes that their withdrawal has been delayed.,"3,016 kr",Fresh casino,25 Oct 2023
BC.Game Casino,Player has issues with multiple casino accounts.,100 INR,Above average,25 Oct 2023
Velobet Casino,Player’s withdrawal has been delayed.,€750,Below average,24 Oct 2023
Lemon Casino,Player’s account has been blocked due to alleged multiple accounts.,"6,000 zł",High,24 Oct 2023
1win Casino,Player is struggling to withdraw due to an issue with the verification code.,"$4,400 ARS",Above average,24 Oct 2023
MegaBet Casino,Player cannot access account in Megabet.,"1,003 R$",Below average,24 Oct 2023
Rox Casino,Player's account has been blocked.,"€3,480",High,24 Oct 2023
GoldenPark Casino PT,Player's deposit not credited to account.,€100,High,24 Oct 2023
Bet1000 Casino,Player’s withdrawal denied over possible duplicate account.,"50,000 руб",Fresh casino,24 Oct 2023
Sunrise Slots Casino,Player's winnings have been denied.,"$16,489",Below average,24 Oct 2023
CashiMashi Casino,Player’s winnings from free spins have been limited.,€100,High,24 Oct 2023
VooZaZa Casino,Player's withdrawal is significantly delayed.,Can$900,Below average,24 Oct 2023
BitStarz Casino,Player complains about bonus insurance scheme.,A$372,Very high,24 Oct 2023
4raBet Casino,Player believes that their withdrawal has been delayed.,€120,Above average,24 Oct 2023
Winz.io Casino,Player’s withdrawal has been delayed.,€350,High,24 Oct 2023
Wins Royal Casino,KYC procedure and withdrawal process delay at Wins Royal Casino.,"$2,312",Fresh casino,24 Oct 2023
Rocketpot Casino,Player’s winnings are stuck in bonus balance.,"$16,000",Very low,24 Oct 2023
MostBet Casino,Player’s account is blocked for Identification Verification,??,Very high,24 Oct 2023
Vulkan Vegas Casino,Player cannot withdraw funds from the account.,$75,Very high,24 Oct 2023
,Player is experiencing withdrawal issues.,"A$5,400",,24 Oct 2023
Royal Ace Casino,Player’s approved withdrawal has been delayed.,$100,Above average,24 Oct 2023
King Billy Casino (Malta),Player's experiencing deposit issues.,€200,Very high,24 Oct 2023
MostBet Casino,Player suspects funds were stolen from his account.,"1,610 zł",Very high,24 Oct 2023
OXI Casino,Player's struggling with self-exclusion in the casino.,??,High,24 Oct 2023
Casinoin,Player's winnings are incorrectly reduced due to a bonus dispute.,$700,High,24 Oct 2023
Hot.Bet Casino,Player believes that their withdrawal has been delayed.,"57,456 kr",Very low,24 Oct 2023
GoldenLion.bet Casino,Player's request for account closure has been ignored.,??,Very low,24 Oct 2023
Happy Hugo Casino,Player's bonus was confiscated.,Can$85,Low,24 Oct 2023
WinnerzOn Casino,Player claims that payment has been delayed.,"$1,000",Very low,24 Oct 2023
AdmiralBet Casino BA,Player finds game by Fazi provider unfair.,"5,500 KM",Very high,24 Oct 2023
ClubWorld Casinos,Casino refuses to close player's account.,??,Very high,24 Oct 2023
FoxyPlay Casino,Player's deposit is not acknowledged by casino.,"Can$1,000",Fresh casino,23 Oct 2023
RichPrize Casino,Player’s withdrawal has been delayed.,"$2,200",Above average,23 Oct 2023
21.Red Casino,Player claims that payment has been delayed.,"€1,000",Low,23 Oct 2023
GeniusWin Casino,Player experiences delayed payouts.,"€1,402",Below average,23 Oct 2023
QuickWin Casino,Player’s struggling to withdraw her winnings.,€500,Very high,23 Oct 2023
Treasure Spins Casino,Player’s withdrawal has been delayed.,$670,Very low,23 Oct 2023
Love Casino,Player encounters delay in withdrawal.,"£1,400",Low,23 Oct 2023
LuckyGreen Casino,Player claims that payment has been delayed.,A$450,Below average,23 Oct 2023
Lucky Nugget Casino,Player’s withdrawal was halted and account temporarily locked.,"Can$3,500",Above average,23 Oct 2023
MyEmpire Casino,Player's withdrawal is delayed due to payment method issue.,700 Kč,Above average,23 Oct 2023
Khelraja Casino,Player's deposit is delayed.,500 INR,Above average,23 Oct 2023
Haz Casino,User's account and winnings blocked after victory in tournament.,"€1,000",Below average,22 Oct 2023
McBookie Casino,Player claims irresponsible gambling enforcement.,"£3,000",Below average,22 Oct 2023
Goldenbet Casino,Player with self-exclusion allowed to open new account.,"€1,500",Above average,22 Oct 2023
Slots of Vegas Casino,Player’s withdrawal has been delayed.,"$1,900",Above average,22 Oct 2023
Bet1000 Casino,Player’s withdrawal is significantly delayed.,"45,000 kr",Fresh casino,22 Oct 2023
Betonic Casino,Withdrawal of player's winnings has been delayed.,"€3,000",Very low,22 Oct 2023
Cashwin Casino,Player's verification is being repeatedly rejected.,"€1,000",High,22 Oct 2023
Raging Bull Slots Casino,Withdrawal of player's winnings has been delayed.,"$2,260",Above average,22 Oct 2023
Crypto Loko Casino,Player’s winnings haven’t been received yet.,$500,Below average,22 Oct 2023
Kwiff Casino,Withdrawal of player's winnings has been delayed.,"£10,000",High,22 Oct 2023
Winbig21 Casino,Player's Bitcoin withdrawal is delayed.,$500,Low,22 Oct 2023
TrueFortune Casino,Player’s winnings declared as fun money.,A$100,Very low,22 Oct 2023
MyStake Casino,Self-excluded player was allowed to deposit.,£450,Above average,22 Oct 2023
Tsars Casino,Player's deposit not credited to account.,€75,High,22 Oct 2023
Cashwin Casino,Player's withdrawal requests are being cancelled.,"€1,400",High,22 Oct 2023
JackpotCity Casino,Player is concerned about excessive gambling losses.,"Can$3,000",Above average,21 Oct 2023
Verde Casino,Player's deposit has not been credited to her casino account.,€200,Low,21 Oct 2023
Suprabets Casino,Player’s withdrawal has been delayed.,$165,High,21 Oct 2023
1win Casino,Player's account has been blocked.,"4,300 R$",Above average,21 Oct 2023
Silver Oak Casino,Player's withdrawal request is delayed.,$600,Above average,21 Oct 2023
1xBet Casino,Player's account blocked due to having two accounts.,144 USDC,Below average,21 Oct 2023
Bizgo777 Casino,Player's withdrawal process has been frozen.,400 R$,Below average,21 Oct 2023
SpinBetter Casino,Player's winnings are missing from account.,"€2,750",High,21 Oct 2023
FoxyPlay Casino,Player’s request to close account ignored by casino.,"€5,000",Fresh casino,21 Oct 2023
1win Casino,Player claims that payment has been delayed.,"€2,000",Above average,21 Oct 2023
Slotpot Casino,Player's awaiting account verification.,"34,877 kr",Below average,21 Oct 2023
WinVegasPlus Casino,Player's account is closed.,£25,Very low,20 Oct 2023
1win Casino,Player’s withdrawal has been delayed.,"13,300 руб",Above average,20 Oct 2023
Slots Garden Casino,Player's withdrawal delayed despite fulfilling all requirements.,30 ₮,Below average,20 Oct 2023
MagicBet Casino,Player reports bonus earnings not credited.,260 лв,Fresh casino,20 Oct 2023
Rox Casino,Player accuses casino of deceptive bonus scheme.,"€19,999",High,20 Oct 2023
MyStake Casino,Player wants to deactivate activated bonus.,??,Above average,20 Oct 2023
test,Player's winnings are significantly delayed.,$600,Struggling casino,20 Oct 2023
1win Casino,Player's account has been blocked.,"500,000 CFA",Above average,20 Oct 2023
Dreams Casino,Player is experiencing difficulties with his verification.,$350,High,20 Oct 2023
Richard Casino,Withdrawal of player's winnings has been delayed.,A$600,High,20 Oct 2023
Global-Bet Casino,Player's withdrawal requests are being delayed.,550 ₮,Fresh casino,20 Oct 2023
MyStake Casino,Player's Deposit Not Reflected in Casino Account.,"$1,000 ARS",Above average,20 Oct 2023
Tusk Casino,Player's winnings not credited to their account.,€50,Below average,20 Oct 2023
1win Casino,Player’s winnings haven’t been received yet.,"$40,000 ARS",Above average,20 Oct 2023
BetToGoal Casino,Case of deactivated timeout and missing winnings.,"€1,599",Low,19 Oct 2023
AmunRa Casino,Player’s winnings haven’t been received yet.,€494,High,19 Oct 2023
Snatch Casino,Player denied promotional spins after registration.,40 R$,High,19 Oct 2023
BETWINNER Casino,Player is having difficulties with account verification.,"5,400 S/.",Below average,19 Oct 2023
Slothub Casino,Player’s withdrawal is delayed.,€300,Very low,19 Oct 2023
Snai Casino,Player's account has been closed.,€100,Below average,19 Oct 2023
Lucky Wilds Casino,Withdrawal of player's winnings has been delayed.,€665,Low,19 Oct 2023
ShinyWilds Casino,Player's struggling to withdraw his winnings.,€410,Below average,19 Oct 2023
Batery Casino,Player's deposit has not been credited to the account.,"1,050 INR",Fresh casino,19 Oct 2023
PokerStars Casino,Player's account has been locked after attempting withdrawal.,"$97,000",Above average,19 Oct 2023
1xBet Casino,Player's winnings have been confiscated and his account blocked.,"$68,000",Below average,19 Oct 2023
Wazamba Casino,Delayed withdrawal due to unresolved wagering requirement.,€150,Very high,19 Oct 2023
Parimatch Casino,Player struggling to close a casino account due to addiction.,??,Above average,19 Oct 2023
NetBet Casino,Player's account is banned with pending withdrawals.,900 R$,Above average,19 Oct 2023
Art Casino,Player contests unfair application of free spins policy.,"€2,699",Above average,19 Oct 2023
Lucky Legends Casino,Player believes that their withdrawal has been delayed.,$116,Below average,19 Oct 2023
BetPlays Casino,Player's withdrawal request denied due to alleged terms violations.,"€1,273",Low,19 Oct 2023
Boomerang.Bet Casino,Player criticizes casino's weak self-exclusion measures.,€440,Fresh casino,18 Oct 2023
Manga Casino,Player accuses casino of operating without KSA license.,€900,High,18 Oct 2023
Casino Days,Player's winnings have been confiscated.,"250,000 INR",Above average,18 Oct 2023
Sloto Cash Casino,Player's account is locked and winnings were confiscated.,"$3,700",Above average,18 Oct 2023
JackTop Casino,Casino blocked player's account after big loss.,"€8,600",Above average,18 Oct 2023
BigWins Casino,Player's withdrawal is delayed.,€400,Very low,18 Oct 2023
Spicy Jackpots Casino,Player's withdrawal is delayed.,€750,Very low,18 Oct 2023
Players555 Casino,Player’s withdrawal has been delayed.,"70,000 INR",Fresh casino,18 Oct 2023
Mega Dice Casino,Player’s winnings confiscated by the casino.,"$2,000",Fresh casino,18 Oct 2023
1win Casino,Player’s withdrawal has been delayed.,"$15,000 ARS",Above average,18 Oct 2023
Dbosses Casino,Player's winnings confiscated and account closed.,"€2,000",High,18 Oct 2023
One Casino ES,Player’s account closed due to PayPal payment issues.,??,High,18 Oct 2023
BlueFox Casino,Player's winnings were confiscated.,€625,Above average,18 Oct 2023
MyStake Casino,Player seeks reimbursement for deposits on second account.,"£1,500",Above average,18 Oct 2023
Crypto Loko Casino,Player's withdrawal request cancelled repeatedly.,$400,Below average,18 Oct 2023
Brango Casino,Player's winnings were confiscated.,$400,High,18 Oct 2023
Brango Casino,Player’s document verification is delayed.,Can$120,High,18 Oct 2023
Gama Casino,Player's withdrawal is constantly delayed due to technical issues.,??,High,18 Oct 2023
Yabby Casino,Player is experiencing delayed verification process.,$227,High,18 Oct 2023
Crocoslots Casino,Player's account unjustly flagged as duplicate.,??,Above average,18 Oct 2023
RickyCasino,Player experienced unauthorized transactions.,A$400,High,17 Oct 2023
BetiBet Casino,Player’s winnings haven’t been received yet.,"€5,000",High,17 Oct 2023
WestCasino,Player's KYC verification is being delayed.,"€2,300",High,17 Oct 2023
GGBet Casino,Player's account with winnings has been blocked.,"1,400 R$",Low,17 Oct 2023
Bitsler Casino,Player suspects the account has been hacked.,"65,000 INR",High,17 Oct 2023
Black Lotus Casino,"Player’s $12,000 winnings are being withheld by casino.","$1,289",Below average,17 Oct 2023
Betpanda Casino,BetPanda fails to close player’s account despite self-exclusion request.,$285,Fresh casino,17 Oct 2023
1win Casino,Withdrawal of player's winnings has been delayed.,"$6,900 ARS",Above average,17 Oct 2023
Pacific Spins Casino,Player's account verification is delayed.,$50,Below average,17 Oct 2023
Goldenbet Casino,Player's deposit not credited to account.,€200,Above average,17 Oct 2023
BetItAll Casino,Player with gambling addiction can visit casino despite self-exclusion.,"€1,000",High,17 Oct 2023
Golden Tiger Casino,Player experiences delayed response from casino.,"€10,000",High,17 Oct 2023
MobileCasino 888,Player’s deposit is delayed.,€25,Below average,17 Oct 2023
Olympusbet Casino,Player experiences betting discrepancy at Olympus Bet.,Can$200,Low,17 Oct 2023
RichPrize Casino,Player's withdrawal delayed over document review.,€600,Above average,17 Oct 2023
Pirateplay Casino,Player is experiencing difficulties with the refunds of his deposits.,€500,High,16 Oct 2023
