Casino,Title,Disputed Amount,Safety Index,Submitted Date
Platincasino,Player’s deposit got rejected and not refunded.,Can$350,High,07 Nov 2023
Caliente Casino,Player's withdrawal request is being delayed.,"Mex$17,700",Above average,07 Nov 2023
Octocasino,"Player's account abruptly closed, refund requested.",€7,High,07 Nov 2023
Planet 7 Casino,Delay in player's withdrawal process.,"€1,000",Below average,07 Nov 2023
Kats Casino,Player's not able to withdraw their bonus winnings.,"$2,127",Below average,07 Nov 2023
Avantgarde Casino,Player's withdrawals are delayed.,€359,Very low,07 Nov 2023
GANABET CASINO,Player believes that their withdrawal has been delayed.,"Mex$4,500",Below average,07 Nov 2023
Golden Lady Casino,Player's winnings disappeared after disconnection.,"$1,300",Low,07 Nov 2023
MyStake Casino,Player unable to deactivate accidental bonus.,"$7,500 ARS",Above average,07 Nov 2023
Lucky Legends Casino,Player's withdrawal request is being denied.,$650,Below average,07 Nov 2023
Silver Oak Casino,Player’s withdrawal is delayed.,$429,Above average,07 Nov 2023
1Bet Casino,Player’s payout is delayed.,"€1,500",Very low,07 Nov 2023
BetOnline Casino,Player experiences slot machine glitches.,$65,Very low,07 Nov 2023
Slotmaniax Casino,Player’s withdrawal has been delayed.,288 ₮,High,07 Nov 2023
Platinum Reels Online Casino,Player's account is closed.,$300,Below average,07 Nov 2023
Lalabet Casino,Player's account and winnings have been seized for suspected multi-accounting.,"€5,000",High,07 Nov 2023
PowerUp Casino,Player's struggling to pass the verification.,"€5,000",Above average,07 Nov 2023
,Player’s bonus winning was capped.,800 R$,,07 Nov 2023
RioBet Casino,Player complains about false bonus promotions.,50 R$,Very high,07 Nov 2023
Voltslot Casino,"Player's account blocked, €5000 inaccessible.","€5,000",Above average,07 Nov 2023
Swift Casino,Player believes that their withdrawal has been delayed.,"€4,115",Above average,07 Nov 2023
IceCasino,Player's account blocked after attempted withdrawal.,"150,000 kr",Very high,07 Nov 2023
MyStake Casino,"Player's accounts get closed, refund and payout demanded.",£545,Above average,07 Nov 2023
Love Casino,Player's withdrawal is delayed.,"£2,000",Low,07 Nov 2023
1win Casino,Player's deposit is delayed.,"25,600 INR",Above average,07 Nov 2023
BC.Game Casino,Player's self-exclusion regret leads to account closure.,??,Above average,06 Nov 2023
Goldwin Casino,Player's withdrawal cancelled over additional document request.,"£2,000",Low,06 Nov 2023
BC.Game Casino,Player's account access has been blocked.,$140,Above average,06 Nov 2023
Rolletto Casino,Player's deposits not reflecting in the casino account.,€350,High,06 Nov 2023
22bet Casino,Player's withdrawal gets repeatedly rejected.,"21,251 INR",Low,06 Nov 2023
1xSlots Casino,Player's withdrawal is delayed.,"23,600 INR",High,06 Nov 2023
Boomerang.Bet Casino,Player’s winnings haven’t been received yet.,€240,Fresh casino,06 Nov 2023
MyStake Casino,Player's winnings were confiscated due to the opening of multiple accounts.,"£1,980",Above average,06 Nov 2023
1win Casino,Player's account suddenly blocked.,"40,000 INR",Above average,06 Nov 2023
Solarbet Casino,Player’s winnings have been confiscated.,"40,000 $",Below average,06 Nov 2023
Solisbet Casino,Player questions casino's license and wants his deposit back.,€40,Fresh casino,06 Nov 2023
Vave Casino,Player's winnings have been confiscated.,"$2,460",Low,06 Nov 2023
Blazzio Casino,Player's funds have been confiscated and the account closed over accusation of multiple accounts.,€723,Above average,06 Nov 2023
1xBet Casino,Player’s account is inaccessible due to authentication issue.,??,Below average,06 Nov 2023
Simple Casino,Player's refund is delayed after account closure.,"€2,750",Above average,06 Nov 2023
Vulkan Vegas Casino,Delay in player's withdrawal.,€100,Very high,06 Nov 2023
Boomerang.Bet Casino,Player's withdrawal delayed due to technical problems.,€300,Fresh casino,06 Nov 2023
Bet1000 Casino,Repeated verification requests delay player’s withdrawal.,160 ₮,Fresh casino,06 Nov 2023
Zodiac Casino,Withdrawal of large winnings blocked by the casino.,"NZ$20,000",High,06 Nov 2023
Slotmaniax Casino,Player believes that their withdrawal has been delayed.,"€4,101",High,06 Nov 2023
Roku Casino,Player struggles with mismatched withdrawal method.,"A$40,000",Very low,06 Nov 2023
WinPort Casino,Player can’t withdraw the winnings from the bonus.,$40,Below average,06 Nov 2023
WinVegasPlus Casino,Self-excluded player allowed to deposit.,£700,Very low,06 Nov 2023
Platincasino,Player’s account with winnings has been disabled.,"Can$5,000",High,06 Nov 2023
Skycrown Casino,Player's withdrawal is delayed due to requested documentation.,"A$1,000",High,06 Nov 2023
CannonBet Casino,Player's withdrawal request is repeatedly denied due to unmet selfie verification.,$255,Above average,06 Nov 2023
Sunrise Slots Casino,Player’s winnings haven’t been received yet.,$700,Below average,06 Nov 2023
MostBet Casino,Player suffers losses due to poor exchange rates.,€30,Very high,06 Nov 2023
Platincasino,Player found account deactivated after winning bet.,"€1,700",High,06 Nov 2023
22bet Casino,Player’s withdrawal is delayed.,€108,Low,06 Nov 2023
4raBet Casino,Player's withdrawal limit reduction hinders cash-out.,"12,000 INR",Above average,06 Nov 2023
1win Casino,Player's withdrawal delayed due to verification code issue.,"$35,000 ARS",Above average,06 Nov 2023
Casinozer,Player claims that payment has been delayed.,"€2,500",High,06 Nov 2023
BC.Game Casino,Player's account access is restricted.,"66,200 INR",Above average,06 Nov 2023
Wild.io Casino,Player's winnings were confiscated.,"$4,200",High,06 Nov 2023
VooZaZa Casino,Player experiencing delay in account verification and withdrawal issues.,€700,Below average,05 Nov 2023
CasinerX Casino,Player is experiencing difficulties with a refund.,£650,Low,05 Nov 2023
JoiaBet Casino,Player's account was suddenly closed.,400 R$,Fresh casino,05 Nov 2023
MrQ Casino,Player faces delay in withdrawal process.,£500,Below average,05 Nov 2023
Pribet Casino,Player experiences delayed withdrawal.,"€2,000",Low,05 Nov 2023
WildTornado Casino,Player experiences withdrawal delay due to screenshot issues.,€100,Very high,05 Nov 2023
New Funclub Casino,Player's withdrawal has been declined due to the usage of a free chip.,$408,Low,05 Nov 2023
Casino Midas,Player is unable to self-exclude from casino.,"€2,000",High,05 Nov 2023
Buumi Casino,Player complains about the lack of essential feature violating gambling law.,"€5,061",High,05 Nov 2023
Svenplay Casino,Player struggles to withdraw winnings.,"€2,000",Very low,05 Nov 2023
888Starz Casino,Player’s withdrawal is blocked due to verification issues.,"40,000 INR",Above average,05 Nov 2023
7BitCasino,Player's account disabled after deposit.,$706,High,05 Nov 2023
FortuneJack Casino,Player’s withdrawal has been delayed.,$600,High,05 Nov 2023
Stelario Casino,Player believes that their withdrawal has been delayed.,"$1,022 ARS",Above average,05 Nov 2023
Stellar Spins Casino,Player’s account has been locked with pending withdrawal.,"A$13,000",Below average,05 Nov 2023
Silver Oak Casino,Player's withdrawal is delayed.,$660,Above average,05 Nov 2023
Slots Garden Casino,Player's withdrawal has been delayed.,"$16,000",Below average,05 Nov 2023
HellSpin Casino,Player's account has been closed with winnings confiscated.,€600,Below average,05 Nov 2023
Hold'N'Spin Casino,Player experiencing difficulties with withdrawal and playing.,"€2,000",Fresh casino,04 Nov 2023
Gomblingo Casino,Player's winnings significantly reduced after bonus ended.,"€15,500",Low,04 Nov 2023
Fair Go Casino,Player's promised bonus not granted.,??,Below average,04 Nov 2023
IviBet Casino,Player’s deposit not credited to casino account.,€500,Low,04 Nov 2023
Rollino Casino,"Player's account closed, winnings confiscated due to alleged addiction.",Can$600,Above average,04 Nov 2023
Slots & Luck Casino,Player's account closed after partial payout.,"$10,349",Fresh casino,04 Nov 2023
Cashalot Casino,Player claims that payment has been delayed.,"40,000 kr",Very low,04 Nov 2023
Superb Casino,Player’s deposit not reflected in their account.,€200,Very low,04 Nov 2023
Velobet Casino,Player allowed to deposit despite self-exclusion.,£400,Below average,04 Nov 2023
Wazamba Casino,Player didn't receive promised free spins.,€20,Very high,04 Nov 2023
The Pokies Casino,Player believes that their withdrawal has been delayed.,"A$1,200",Above average,04 Nov 2023
Justbit Casino,Player's account blocked due to citizenship.,"€4,980",High,04 Nov 2023
SG Casino,Player's withdrawals have been delayed.,"€1,000",Above average,04 Nov 2023
Royal Reels Casino,Player's winnings confiscated and account restricted.,"A$2,800",High,04 Nov 2023
Unlim Casino,Player’s winnings have been confiscated.,"2,835 ₮",Fresh casino,04 Nov 2023
PalmSlots Casino,Player's withdrawal has been delayed.,Can$400,Above average,04 Nov 2023
Vulkan Vegas Casino,Player experiences repeated withdrawal errors.,"$13,200",Very high,04 Nov 2023
Hold'N'Spin Casino,Player reports casino's withdrawal and deposit methods are blocked.,$25,Fresh casino,04 Nov 2023
Wild.io Casino,Player missed promised referral spins.,$18,High,04 Nov 2023
BitReels Casino,Player’s winnings haven’t been received yet.,"A$1,000",Above average,04 Nov 2023
Rooster Bet Casino,Player frustrated with delayed verification process.,€85,Fresh casino,04 Nov 2023
Royal Ace Casino,Player’s winnings haven’t been received yet.,$177,Above average,04 Nov 2023
Winstark Casino,Player believes that their withdrawal has been delayed.,$150,Below average,04 Nov 2023
Lucky Wilds Casino,Withdrawal of player's winnings has been delayed.,€316,Low,04 Nov 2023
Snatch Casino,Player's identification not verified for withdrawal.,€100,High,04 Nov 2023
Vulkan Vegas Casino,Player is facing a delayed withdrawal process.,"€1,000",Very high,03 Nov 2023
Spin247 Casino,Player's withdrawal is significantly delayed.,"R5,000",Above average,03 Nov 2023
Marathonbet Casino,Player's account blocked due to betting amount claim.,902 R$,Above average,03 Nov 2023
Vulkan Vegas Casino,Player’s winnings keep returning to account.,350 R$,Very high,03 Nov 2023
Cafe Casino,Player facing issues with bitcoin deposit.,$50,Low,03 Nov 2023
Magic Win Casino,Player believes that their withdrawal has been delayed.,"£2,700",Very low,03 Nov 2023
EmirBet Casino,Withdrawal of player's winnings has been delayed.,"€1,261",Low,03 Nov 2023
1Bet Casino,Player’s winnings haven’t been received yet.,"€5,000",Very low,03 Nov 2023
BetItAll Casino,Player with self-exclusion issue lost winnings.,"€1,500",High,03 Nov 2023
Richard Casino,Player has an issue with failed deposit.,€500,High,03 Nov 2023
Rox Casino,Player’s account with significant winnings has been blocked.,"€20,400",High,03 Nov 2023
1xSlots Casino,Player Experiences Issues with Cashback Mechanism.,$623,High,03 Nov 2023
PariPesa Casino,Player's account blocked and withdrawal delayed.,€500,Low,03 Nov 2023
Wild.io Casino,Player’s deposit lost in blockchain.,$7,High,03 Nov 2023
NetBet Casino GR,Player believes that their withdrawal has been delayed.,€511,Below average,03 Nov 2023
24betting Casino,Player's deposit is not credited in the account.,"25,000 INR",Below average,03 Nov 2023
Bettilt Casino,Player's account has been blocked.,"10,000 INR",Low,03 Nov 2023
Gomblingo Casino,Player experiences prolonged withdrawal delay.,€821,Low,03 Nov 2023
BetPlays Casino,Player’s winnings are delayed due to verification issues.,€918,Low,03 Nov 2023
EnergieKasino Casino,Player's withdrawal has been repeatedly denied and account suspended.,€25,Above average,03 Nov 2023
SilverSands Casino,Player can't access the casino account.,R100,Below average,03 Nov 2023
Vegas2Web Casino,Player's withdrawal is being constantly delayed.,$10,Below average,03 Nov 2023
20Bet Casino,Player claims that payment has been delayed.,"€3,800",Below average,03 Nov 2023
Spintornado Casino,Player's withdrawal delayed.,"€1,100",Low,03 Nov 2023
Vulkan Vegas Casino,Player's withdrawal delayed despite KYC completion.,"€6,000",Very high,03 Nov 2023
Stelario Casino,Player’s withdrawal has been delayed.,€400,Above average,03 Nov 2023
Slots of Vegas Casino,Player’s withdrawal is delayed.,$78,Above average,03 Nov 2023
Velobet Casino,Player is requesting a deposit refund.,"£4,000",Below average,03 Nov 2023
Megapari Casino,Player experiences repeated withdrawal denials.,169 S/.,Below average,03 Nov 2023
Dafabet Casino,Player's struggling to pass the verification process.,"$1,075",Above average,03 Nov 2023
Raging Bull Slots Casino,Player's winnings were confiscated and the account was banned.,"$3,600",Above average,03 Nov 2023
888 Casino IT,Player’s withdrawal has been delayed.,"€25,000",Very high,03 Nov 2023
Betmotion Casino,Player has not received his withdrawal.,"Mex$14,759",High,03 Nov 2023
Mr Bet Casino,Player facing difficulty in verifying a payment method.,"19,700 R$",High,03 Nov 2023
HitNSpin Casino,Player faces unusual verification requirements to withdraw winnings.,€70,Very high,03 Nov 2023
Velobet Casino,Player’s withdrawal requests are getting rejected.,"£3,000",Below average,03 Nov 2023
b-Bets Casino,Player’s withdrawal payments are delayed.,"50,500 kr",Below average,03 Nov 2023
Apollo Spin Casino,Player complains about technical issues and unresponsive support.,"2,000 руб",Fresh casino,03 Nov 2023
SpinsBro Casino,Player's withdrawal is excessively delayed.,"€3,000",High,03 Nov 2023
Palm.Casino,Non-payment of winnings to a UK player.,"£3,100",Very low,03 Nov 2023
Playzilla Casino,Player struggles with bank statement verification.,"2,500 R$",High,03 Nov 2023
All Wins Casino,Player’s winnings have been restricted.,£600,Very low,03 Nov 2023
Royal Reels Casino,Player's account has been banned because of chargeback.,??,High,03 Nov 2023
Mr Bet Casino,Player can’t access his account for withdrawal.,"Can$2,748",High,03 Nov 2023
Buran Casino,Player claims that payment has been delayed.,€100,Very high,02 Nov 2023
Hold'N'Spin Casino,Player experiences issues with points in casino's tournament.,"€1,500",Fresh casino,02 Nov 2023
AmigoBingo Casino,Player is denied their bonus winnings.,$117,Very low,02 Nov 2023
CryptoBetSports Casino,Player’s withdrawal has been delayed.,"30,000 руб",Fresh casino,02 Nov 2023
BetMGM Casino UK,Player's winnings have been confiscated over self-exclusion dispute.,£600,High,02 Nov 2023
Rabona Casino,Player’s account has been flagged as duplicate.,"€15,300",Very high,02 Nov 2023
Pinsino Casino,Player is dissatisfied with the casino's bonus terms.,"€7,517",Below average,02 Nov 2023
BOHO Casino,Player's deposit has not been credited.,€25,High,02 Nov 2023
Crypto Games Casino,Player is experiencing difficulties with the self-exclusion request.,"$1,500",Above average,02 Nov 2023
Swift Casino,Player can't access deposited funds for gambling.,300 kr,Above average,02 Nov 2023
Mr Bet Casino,Player's verification process repeatedly unsuccessful.,€369,High,02 Nov 2023
BacanaPlay Casino DE,Player is experiencing difficulties with accessing the games.,€39,High,02 Nov 2023
LevelUp Casino,Player's deposit has not been credited to his casino account.,€43,High,02 Nov 2023
Wild.io Casino,Player's account has been locked abruptly.,"$20,000",High,02 Nov 2023
Slot Madness Casino,Player’s withdrawal is delayed due to unresponsive support.,$236,Below average,02 Nov 2023
Snatch Casino,Player is experiencing difficulties with her self-exclusion.,"12,000 kr",High,02 Nov 2023
Hornetbet Casino,Player's account has been locked after a deposit mistake.,€49,Above average,02 Nov 2023
African Grand Casino,Player's winnings being paid in installments.,"R20,000",Low,02 Nov 2023
VayCasino,Player's winnings are delayed.,"TL 50,000",Fresh casino,02 Nov 2023
Vulkan Vegas Casino,Player's withdrawal request was delayed due to additional verification.,"€3,000",Very high,02 Nov 2023
BetItAll Casino,Player’s winnings haven’t been received yet.,"€1,460",High,02 Nov 2023
Celu Apuestas Casino,Player's withdrawal request has been ignored.,"$500,000 ARS",Below average,02 Nov 2023
SpinBit Casino,Player's funds have been confiscated.,$500,Above average,02 Nov 2023
PlanetWin365 Casino,Player is locked out of account.,€50,Very high,02 Nov 2023
Boomerang.Bet Casino,Player’s withdrawal attempts are unsuccessful.,"€5,000",Fresh casino,02 Nov 2023
Suprabets Casino,Player's account closed after winning.,"186,600 ₦",High,02 Nov 2023
SpinCity Casino,Player's withdrawal delayed by verification.,"€1,000",Below average,02 Nov 2023
,Player account closed after location issue.,"€1,100",,02 Nov 2023
Winawin Casino,Player's deposit is delayed.,€100,High,02 Nov 2023
Lucky Legends Casino,Delay in player's Bitcoin withdrawal.,$590,Below average,02 Nov 2023
Lucky Barry Casino,Player’s withdrawals are restricted.,"€18,000",Very low,02 Nov 2023
Nomini Casino,Player unable to access account for withdrawal.,€500,Very high,02 Nov 2023
Leon Casino,Player's winnings confiscated and account closed.,"30,190 INR",Above average,02 Nov 2023
Snatch Casino,Player confronts withdrawal issues at Snatch Casino.,€165,High,02 Nov 2023
Velobet Casino,"Player bypasses self-exclusion, loses funds on sister site.",€830,Below average,02 Nov 2023
1win Casino,Player is unable to update the email address.,"R32,000",Above average,02 Nov 2023
BoGamba Casino,Withdrawal of player's winnings has been delayed.,"€2,000",Below average,02 Nov 2023
Afun Casino,Player's account abruptly blocked by casino.,70 R$,High,02 Nov 2023
1win Casino,Indian player's account blocked after five withdrawals.,"14,400 INR",Above average,02 Nov 2023
Lucky Wilds Casino,Player reports delayed withdrawal and poor customer support.,"€5,000",Low,02 Nov 2023
Betmaster Casino,Player's issue with obtained winnings.,€550,High,01 Nov 2023
Rollbit Casino,Player accused of KYC circumvention.,970 ₮,Above average,01 Nov 2023
CashiMashi Casino,Player’s winnings confiscated due to alleged manipulative gameplay.,"€9,261",High,01 Nov 2023
MyEmpire Casino,Player's deposit has not been credited.,€20,Above average,01 Nov 2023
Lucky Crypto Casino,Player's withdrawal is delayed.,"1,200 CHF",Below average,01 Nov 2023
MyEmpire Casino,Player’s winnings haven’t been received yet.,"5,260 Kč",Above average,01 Nov 2023
Casinoin,Player's account blocked and partial refund given.,"$18,600",High,01 Nov 2023
Silver Oak Casino,Player's verification and withdrawal being denied.,"2,000 KM",Above average,01 Nov 2023
Goldenbet Casino,Player believes that their withdrawal has been delayed.,"£3,500",Above average,01 Nov 2023
Casino Kakadu,Player's confirmed withdrawal has not been transferred.,"€1,000",High,01 Nov 2023
GoodMan Casino,Player's withdrawal is delayed.,"€19,000",High,01 Nov 2023
4raBet Casino,Withdrawal of player's winnings has been delayed.,"26,700 INR",Above average,01 Nov 2023
888 Casino,Player’s withdrawal is delayed.,750 R$,High,01 Nov 2023
21bit Casino,Web error blocking player's withdrawal attempt.,Ł2,High,01 Nov 2023
Bruno Casino,Player's withdrawal via crypto is still pending.,€100,High,01 Nov 2023
Blazzio Casino,Player’s winnings are not being paid to his bank account.,"€1,500",Above average,01 Nov 2023
CBet Casino,Player claims that payment has been delayed.,"2,958 ₮",Below average,01 Nov 2023
Red Dog Casino,Player’s withdrawal is limited by casino.,"$27,000",High,01 Nov 2023
Pin-Up Casino,Player experiences delayed withdrawal due to repetitive document requests.,"5,500 INR",Above average,01 Nov 2023
Prism Casino,Player’s winnings were confiscated due to alleged account duplication.,"$1,000",Above average,01 Nov 2023
SpinCity Casino,Player's withdrawal delayed due to verification process.,Can$400,Below average,01 Nov 2023
JVSpin Casino,Player’s withdrawal is delayed.,20 R$,High,01 Nov 2023
Stupid Casino,Player’s winnings haven’t been received yet.,€48,Low,01 Nov 2023
Platincasino,Player experiences withdrawal complications due to Paysafe deposit.,€137,High,01 Nov 2023
BAQTO Casino,Player's withdrawal is delayed.,"$12,000",Very low,01 Nov 2023
WinDetta Casino,Player is experiencing delayed payout.,"1,000 R$",High,01 Nov 2023
ShinyWilds Casino,Player’s winnings haven’t been received yet.,A$950,Below average,01 Nov 2023
Librabet Casino,Player claims that payment has been delayed.,€500,Very high,01 Nov 2023
BetBoom Casino,Player’s withdrawal has been delayed due to lengthy review process.,"$6,182",High,01 Nov 2023
Cloudbet Casino,Player's deposit via cryptocurrency has not been recognized.,$24,High,01 Nov 2023
SpinCity Casino,Player struggles with verification for withdrawal.,Can$200,Below average,01 Nov 2023
Jackbit Casino,Player's account has been blocked after major win.,"72,000 ₮",Fresh casino,01 Nov 2023
Hold'N'Spin Casino,Player's withdrawal of winnings has been delayed.,€950,Fresh casino,01 Nov 2023
MyStake Casino,Player used his brother's payment card without permission.,"£2,800",Above average,01 Nov 2023
FoxyPlay Casino,Player is upset over deducted winnings.,"6,400 руб",Fresh casino,01 Nov 2023
Betonic Casino,Player is experiencing difficulties with withdrawing his winnings.,"Can$3,300",Very low,31 Oct 2023
Galactic Wins Casino,Player complains about disrupted winnings.,"Can$10,000",Below average,31 Oct 2023
Bella Vegas Casino,Player's winnings confiscated due to comp points use.,$150,Low,31 Oct 2023
HotSlots Casino,Player's casino account has disappeared with funds.,"7,000 zł",Above average,31 Oct 2023
Marathonbet Casino,Player's account has been blocked.,"1,426 R$",Above average,31 Oct 2023
,Player's accounts have been locked in Zeus Casino.,"$525,000 ARS",,31 Oct 2023
Lucky Legends Casino,Player's withdrawal is delayed.,$200,Below average,31 Oct 2023
Odds96 Casino,Player's account has been blocked after verification.,"7,000 INR",Fresh casino,31 Oct 2023
NetBet Casino IT,Player’s account was closed.,"€2,154",Above average,31 Oct 2023
Hold'N'Spin Casino,Player believes that their withdrawal has been delayed.,$400,Fresh casino,31 Oct 2023
Sultanbet Casino,Delayed verification leads to player's lost winnings.,€800,Above average,31 Oct 2023
iWild Casino,Player cannot provide required ezeewallet screenshot.,"€1,200",High,31 Oct 2023
BitBetWin Casino,Player struggles with verification for withdrawal.,$20,Above average,31 Oct 2023
Neon54 Casino,Player denied bonus and unable to withdraw.,€200,Above average,31 Oct 2023
Bankonbet Casino,Player claims that payment has been delayed.,"€3,500",Above average,31 Oct 2023
Crypto Loko Casino,Player's winnings have been confiscated.,"$4,503",Below average,31 Oct 2023
WildTornado Casino,Player can't access games and withdraw funds.,A$499,Very high,31 Oct 2023
Casino Rocket,Player struggles to withdraw his winnings.,"A$6,000",High,31 Oct 2023
Lucky Legends Casino,Player's withdrawal is delayed.,"$2,000",Below average,31 Oct 2023
Yabby Casino,Player's winnings confiscated due to a duplicate account.,$900,High,31 Oct 2023
Raging Bull Slots Casino,Player experiences delayed payout.,$386,Above average,31 Oct 2023
Silverplay Casino,Player’s withdrawal of 900 euros is delayed.,€900,Low,31 Oct 2023
Spinero Casino,Player dealing with verification issues.,Can$600,Above average,31 Oct 2023
Mirax Casino,Player's request to avoid bonus was not honored.,$39,High,31 Oct 2023
Buran Casino,Player's withdrawal is delayed due to changes in rules.,"€3,500",Very high,31 Oct 2023
Wazamba Casino,Player’s withdrawal is delayed for a week.,€718,Very high,31 Oct 2023
Wazamba Casino,Player's Bonus withdrawal is delayed.,€150,Very high,31 Oct 2023
1win Casino,Player’s account has been locked.,"4,768,792 INR",Above average,31 Oct 2023
Tonybet Casino ES,Player is struggling to verify the card for withdrawal.,€50,Above average,31 Oct 2023
Casumo Casino,Player claims that payment has been delayed.,"Can$1,000",High,31 Oct 2023
Hold'N'Spin Casino,Player experiences withdrawal delay and unresponsive support.,"€1,800",Fresh casino,31 Oct 2023
Love Casino,Player’s withdrawal of winnings delayed.,"£1,000",Low,30 Oct 2023
24CasinoBet,Delayed Withdrawal and Unhelpful Customer Service.,"£1,000",Very low,30 Oct 2023
Royal Planet Casino,Player’s withdrawal delay due to casino’s ‘technical issues’.,$254,Low,30 Oct 2023
helabet Casino,Player experiences withdrawal delay after document verification.,"8,664 ¥",Below average,30 Oct 2023
IceCasino,Player’s withdrawal has been delayed.,€500,Very high,30 Oct 2023
Mr Sloty Casino,Player claims that payment has been delayed.,£524,Very low,30 Oct 2023
Nucleonbet Casino,Player’s withdrawal is being indefinitely delayed.,"€1,000",Very low,30 Oct 2023
BetOnRed Casino,Player requests refund after account closure.,"€3,000",Fresh casino,30 Oct 2023
Pinnacle Casino,Player’s withdrawal request has been rejected.,"Can$1,500",High,30 Oct 2023
CasinoCastle,Player not receiving promised bonus spins.,$25,Below average,30 Oct 2023
Bruce Bet Casino,Player with disqualified winnings due to a bonus.,400 CHF,Fresh casino,30 Oct 2023
Wild.io Casino,Player's account was blocked.,"$1,900",High,30 Oct 2023
Spin247 Casino,Player's account closed unexpectedly.,300 R$,Above average,30 Oct 2023
500 Casino,Player's account was blocked.,"77,400 ₮",Above average,30 Oct 2023
Velobet Casino,Player's casino withdrawal thwarted by non-existent bank transfer option.,"3,303 ман",Below average,30 Oct 2023
