title,title_english,processed_title,League Name,category
WATCH: John Calipari previews Kentucky Champions Classic game vs. Kansas,WATCH: John Calipari previews Kentucky Champions Classic game vs. Kansas,WATCH : John Calipari preview Kentucky Champions Classic game vs. Kansas,other,Others
"First Scouting Report: Against No. 1 Kansas, UK seeks to make an early-season statement","First Scouting Report: Against No. 1 Kansas, UK seeks to make an early-season statement","First Scouting Report : No . 1 Kansas , UK seek make early - season statement",other,Others
"Young Kentucky team focusing on the now, not looking ahead to Kansas","Young Kentucky team focusing on the now, not looking ahead to Kansas","Young Kentucky team focus , look ahead Kansas",other,Others
"Kansas vs Kentucky Odds, Pick | College Basketball Betting Guide (Tuesday, Nov. 14)","Kansas vs Kentucky Odds, Pick | College Basketball Betting Guide (Tuesday, Nov. 14)","Kansas vs Kentucky Odds , Pick | College Basketball Betting Guide ( Tuesday , Nov. 14 )",other,Others
Ten former Kentucky players are still playing college basketball. Where are they now?,Ten former Kentucky players are still playing college basketball. Where are they now?,ten former Kentucky player still play college basketball . ?,other,Others
Know your opponent: No. 1 Kansas Jayhawks,Know your opponent: No. 1 Kansas Jayhawks,know opponent : . 1 Kansas Jayhawks,other,Others
John Calipari wants to get back to being 'Kentucky good',John Calipari wants to get back to being 'Kentucky good',John Calipari want get back ' Kentucky good ',other,Others
49ers Get Promising News on 10-Time Pro Bowler,49ers Get Promising News on 10-Time Pro Bowler,49er get promise News 10 - Time Pro Bowler,other,Others
49ers need stars to lead them out of losing streak,49ers need stars to lead them out of losing streak,49er need star lead lose streak,other,Others
Transcript: What Kyle Shanahan said the day after 49ers' Week 10 win vs. Jaguars,Transcript: What Kyle Shanahan said the day after 49ers' Week 10 win vs. Jaguars,transcript : Kyle Shanahan say day 49er ' week 10 win vs. jaguar,other,Others
49ers news: Trent Williams intends to play today against the Jaguars,49ers news: Trent Williams intends to play today against the Jaguars,49er news : Trent Williams intend play today jaguar,other,Others
49ers news: Trent Williams and Deebo Samuel return against the Jaguars,49ers news: Trent Williams and Deebo Samuel return against the Jaguars,49er news : Trent Williams Deebo Samuel return jaguar,other,Others
"Trent Williams, Javon Hargrave not among 49ers' 7 inactives vs. Jaguars, will play","Trent Williams, Javon Hargrave not among 49ers' 7 inactives vs. Jaguars, will play","Trent Williams , Javon Hargrave among 49er ' 7 inactive vs. jaguar , play",other,Others
"NFL early slate: 49ers vs. Jaguars score, highlights, news, inactives and live updates","NFL early slate: 49ers vs. Jaguars score, highlights, news, inactives and live updates","NFL early slate : 49er vs. Jaguars score , highlight , news , inactive live update",nfl,Football
"Deebo Samuel, Trent Williams make impactful returns for 49ers; Williams not completely healthy","Deebo Samuel, Trent Williams make impactful returns for 49ers; Williams not completely healthy","Deebo Samuel , Trent Williams make impactful return 49er ; Williams completely healthy",other,Others
Deebo Samuel Highlights 'Full Team' Win in Jacksonville,Deebo Samuel Highlights 'Full Team' Win in Jacksonville,Deebo Samuel Highlights ' Full team ' win Jacksonville,other,Others
"49ers LT Trent Williams (ankle) expected to play at Jaguars, source says - ESPN","49ers LT Trent Williams (ankle) expected to play at Jaguars, source says - ESPN","49er LT Trent Williams ( ankle ) expect play jaguar , source say - ESPN",other,Others
"Saints' Derek Carr In Concussion Protocol; CB Marshon Lattimore, WR Michael Thomas Facing ""Signficant Injuries""","Saints' Derek Carr In Concussion Protocol; CB Marshon Lattimore, WR Michael Thomas Facing ""Signficant Injuries""","saint ' Derek Carr Concussion Protocol ; CB Marshon Lattimore , WR Michael Thomas face "" Signficant Injuries """,other,Others
Patriots Release DB Jack Jones,Patriots Release DB Jack Jones,Patriots Release DB Jack Jones,other,Others
"Saints' Dennis Allen: Derek Carr in concussion protocol but shoulder OK; Michael Thomas (knee), Marshon Lattimore ...","Saints' Dennis Allen: Derek Carr in concussion protocol but shoulder OK; Michael Thomas (knee), Marshon Lattimore ...","saint ' Dennis Allen : Derek Carr concussion protocol shoulder OK ; Michael Thomas ( knee ) , Marshon Lattimore ...",other,Others
"Saints say injuries to WR Thomas, CB Lattimore ignificant' - ESPN","Saints say injuries to WR Thomas, CB Lattimore ignificant' - ESPN","saint say injury WR Thomas , CB Lattimore ignificant ' - ESPN",other,Others
Quarterbacks are taking beatings when they face the Vikings,Quarterbacks are taking beatings when they face the Vikings,quarterback take beating face viking,other,Others
"Saints' Derek Carr in concussion protocol, 2 stars have 'fairly significant' injuries","Saints' Derek Carr in concussion protocol, 2 stars have 'fairly significant' injuries","saint ' Derek Carr concussion protocol , 2 star ' fairly significant ' injury",other,Others
"Michael Thomas, Marshon Lattimore have ""fairly significant"" injuries; Derek Carr shoulder is fine","Michael Thomas, Marshon Lattimore have ""fairly significant"" injuries; Derek Carr shoulder is fine","Michael Thomas , Marshon Lattimore "" fairly significant "" injury ; Derek Carr shoulder fine",other,Others
Jameis Winston gives the full Jameis Winston experience in Saints loss to Vikings,Jameis Winston gives the full Jameis Winston experience in Saints loss to Vikings,Jameis Winston give full Jameis Winston experience Saints loss viking,other,Others
Former Raider Derek Carr Week 10: Carr exits game after brutal hit,,former Raider Derek Carr Week 10 : Carr exit game brutal hit,other,Others
"NFL Injury Roundup: Saints, Watson, Heinicke, Thibodeaux","NFL Injury Roundup: Saints, Watson, Heinicke, Thibodeaux","NFL Injury Roundup : Saints , Watson , Heinicke , Thibodeaux",nfl,Football
The Fallout: Injury updates on Saints' Big 3; no staff changes imminent; how Jameis Winston-A.T. Perry worked behind ...,The Fallout: Injury updates on Saints' Big 3; no staff changes imminent; how Jameis Winston-A.T. Perry worked behind ...,Fallout : injury update Saints ' big 3 ; staff change imminent ; Jameis Winston - A.T. Perry work behind ...,other,Others
Saints QB Derek Carr leaves game vs. Vikings; Winston rallies team and then throws late INTs,Saints QB Derek Carr leaves game vs. Vikings; Winston rallies team and then throws late INTs,saint QB Derek Carr leave game vs. Vikings ; Winston rally team throw late int,other,Others
NFL Injury Updates & Fantasy Football Impact (2023),NFL Injury Updates & Fantasy Football Impact (2023),NFL Injury Updates & Fantasy Football Impact ( 2023 ),nfl,Football
"Thomas, Lattimore suffered ‘significant’ injuries; Carr ‘checked out fine’","Thomas, Lattimore suffered ‘significant’ injuries; Carr ‘checked out fine’","Thomas , Lattimore suffer ' significant ' injury ; Carr ' check fine '",other,Others
The Training Room: Week 10 Injury Recap,The Training Room: Week 10 Injury Recap,Training Room : Week 10 Injury Recap,other,Others
"Saints' Michael Thomas, Marshon Lattimore Have 'Fairly Significant' Injuries, per HC","Saints' Michael Thomas, Marshon Lattimore Have 'Fairly Significant' Injuries, per HC","saint ' Michael Thomas , Marshon Lattimore ' fairly significant ' Injuries , per hc",other,Others
Saints: Allen says Thomas and Lattimore injuries are significant,Saints: Allen says Thomas and Lattimore injuries are significant,saint : Allen say Thomas Lattimore injury significant,other,Others
"Week 10 NFL Injuries Recap: Latest Updates on Alexander Mattison, Michael Thomas, Derek Carr, and Others","Week 10 NFL Injuries Recap: Latest Updates on Alexander Mattison, Michael Thomas, Derek Carr, and Others","week 10 NFL Injuries recap : late update Alexander Mattison , Michael Thomas , Derek Carr ,",nfl,Football
"Saints share injury status of Mike Thomas, Marshon Lattimore","Saints share injury status of Mike Thomas, Marshon Lattimore","saint share injury status Mike Thomas , Marshon Lattimore",other,Others
"Saints’ Derek Carr exits with concussion, shoulder injury; Jameis Winston finishes game vs. Vikings","Saints’ Derek Carr exits with concussion, shoulder injury; Jameis Winston finishes game vs. Vikings","saint ' Derek Carr exit concussion , shoulder injury ; Jameis Winston finish game vs. viking",other,Others
"Saints QB Derek Carr (concussion, shoulder) exits vs. Vikings","Saints QB Derek Carr (concussion, shoulder) exits vs. Vikings","saint QB Derek Carr ( concussion , shoulder ) exit vs. viking",other,Others
"Carr, Mayfield, Watson among injured in NFL Week 10","Carr, Mayfield, Watson among injured in NFL Week 10","Carr , Mayfield , Watson among injure NFL Week 10",nfl,Football
Patriots waive CB Jack Jones after two seasons - ESPN,Patriots waive CB Jack Jones after two seasons - ESPN,patriot waive CB Jack Jones two season - ESPN,other,Others
Patriots will waive Jack Jones,Patriots will waive Jack Jones,patriot waive Jack Jones,other,Others
Patriots waiving once-promising CB Jack Jones,Patriots waiving once-promising CB Jack Jones,patriot waive - promise CB Jack Jones,other,Others
Raiders news: Why Jack Jones may end up in Las Vegas,Raiders news: Why Jack Jones may end up in Las Vegas,raider news : Jack Jones may end Las Vegas,other,Others
"Patriots waive CB Jack Jones after Week 10 loss, his agent confirms","Patriots waive CB Jack Jones after Week 10 loss, his agent confirms","patriot waive CB Jack Jones Week 10 loss , agent confirm",other,Others
The Patriots’ 2022 draft class is looking like a complete disaster,The Patriots’ 2022 draft class is looking like a complete disaster,Patriots ’ 2022 draft class look like complete disaster,other,Others
Patriots release cornerback Jack Jones,Patriots release cornerback Jack Jones,patriot release cornerback Jack Jones,other,Others
Patriots Rumors: Final Straw For Jack Jones Before His Release,Patriots Rumors: Final Straw For Jack Jones Before His Release,Patriots Rumors : Final Straw Jack Jones Release,other,Others
"Patriots release troubled CB Jack Jones, claim RB JaMychal Hasty","Patriots release troubled CB Jack Jones, claim RB JaMychal Hasty","patriot release troubled CB Jack Jones , claim RB JaMychal Hasty",other,Others
New England Patriots waive CB Jack Jones,New England Patriots waive CB Jack Jones,New England Patriots waive CB Jack Jones,other,Others
Patriots cut cornerback Jack Jones after rocky tenure that included gun arrest,Patriots cut cornerback Jack Jones after rocky tenure that included gun arrest,patriot cut cornerback Jack Jones rocky tenure include gun arrest,other,Others
Patriots Waiving Player Who Reportedly Missed Curfew Night Before Game,Patriots Waiving Player Who Reportedly Missed Curfew Night Before Game,Patriots Waiving Player reportedly miss Curfew Night game,other,Others
"Patriots waive cornerback Jack Jones after turbulent tenure with New England, per report","Patriots waive cornerback Jack Jones after turbulent tenure with New England, per report","patriot waive cornerback Jack Jones turbulent tenure New England , per report",other,Others
"Patriots CB Jack Jones being waived, after playing only 10 snaps","Patriots CB Jack Jones being waived, after playing only 10 snaps","patriot CB Jack Jones waive , play 10 snap",other,Others
"Jack Jones Landing Spots: Cowboys, Raiders, Eagles Could Consider Free Agent CB","Jack Jones Landing Spots: Cowboys, Raiders, Eagles Could Consider Free Agent CB","Jack Jones Landing Spots : Cowboys , Raiders , Eagles could consider Free Agent cb",other,Others
"Patriots Make Surprise Move, Release Troubled CB","Patriots Make Surprise Move, Release Troubled CB","patriot make Surprise Move , Release troubled cb",other,Others
Patriots move on from cornerback after second consecutive benching,Patriots move on from cornerback after second consecutive benching,patriot move cornerback second consecutive benching,other,Others
Patriots Cut Jack Jones After Colts Loss; CB Was 4th-Round Pick in 2022 NFL Draft,Patriots Cut Jack Jones After Colts Loss; CB Was 4th-Round Pick in 2022 NFL Draft,patriot Cut Jack Jones Colts Loss ; CB 4th - Round Pick 2022 NFL draft,nfl,Football
Jack Jones is a symptom of greater Patriots problem | Guregian,Jack Jones is a symptom of greater Patriots problem | Guregian,Jack Jones symptom great Patriots problem | Guregian,other,Others
Patriots' Jack Jones Completes the Rare Feat of Alienating a Team That Stuck by Him After Getting Arrested at an ...,Patriots' Jack Jones Completes the Rare Feat of Alienating a Team That Stuck by Him After Getting Arrested at an ...,patriot ' Jack Jones complete Rare Feat Alienating team stick getting arrest ...,other,Others
Latest Patriots cut highlights failures of team recent draft classes,Latest Patriots cut highlights failures of team recent draft classes,late Patriots cut highlight failure team recent draft class,other,Others
"Patriots release DB Jack Jones, ending tumultuous tenure with team","Patriots release DB Jack Jones, ending tumultuous tenure with team","patriot release DB Jack Jones , end tumultuous tenure team",other,Others
Patriots Waive CB Jack Jones,Patriots Waive CB Jack Jones,Patriots Waive CB Jack Jones,other,Others
Report: Titans add TK McLendon Jr. to roster after waiving Naquan Jones,Report: Titans add TK McLendon Jr. to roster after waiving Naquan Jones,report : Titans add TK McLendon Jr. roster waive Naquan Jones,other,Others
Titans Waive DL Naquan Jones While Also Doing Some Practice Squad Shuffling,Titans Waive DL Naquan Jones While Also Doing Some Practice Squad Shuffling,Titans Waive DL Naquan Jones also Practice Squad shuffle,other,Others
NFL notebook: Patriots waiving troubled CB Jack Jones in second season,NFL notebook: Patriots waiving troubled CB Jack Jones in second season,NFL notebook : patriot waive troubled CB Jack Jones second season,nfl,Football
Patriots reportedly cut Jack Jones,Patriots reportedly cut Jack Jones,patriot reportedly cut Jack Jones,other,Others
You Can’t Even Bet on the Patriots to Win the AFC East Anymore,You Can’t Even Bet on the Patriots to Win the AFC East Anymore,even bet Patriots win AFC East Anymore,other,Others
Fantasy Injury Updates Week 11: News on Alexander Mattison & Michael Thomas impacting waiver claims,Fantasy Injury Updates Week 11: News on Alexander Mattison & Michael Thomas impacting waiver claims,Fantasy Injury Updates Week 11 : news Alexander Mattison & Michael Thomas impacting waiver claim,other,Others
Dennis Allen Confirms Derek Carr Is QB1 When Healthy,Dennis Allen Confirms Derek Carr Is QB1 When Healthy,Dennis Allen confirm Derek Carr QB1 healthy,other,Others
Derek Carr (concussion/shoulder) expected to return after bye week,Derek Carr (concussion/shoulder) expected to return after bye week,Derek Carr ( concussion / shoulder ) expect return bye week,other,Others
Derek Carr Hoping to play after bye - Fantasy Football News,Derek Carr Hoping to play after bye - Fantasy Football News,Derek Carr hope play bye - Fantasy Football News,other,Others
2023 NFL Injury Report Week 11: Alexander Mattison & Michael Thomas Injury Updates,2023 NFL Injury Report Week 11: Alexander Mattison & Michael Thomas Injury Updates,2023 NFL Injury Report Week 11 : Alexander Mattison & Michael Thomas Injury Updates,nfl,Football
Saints Vikings Football | National Sports | meridianstar.com,Saints Vikings Football | National Sports | meridianstar.com,Saints Vikings Football | National Sports | meridianstar.com,other,Others
Saints' Derek Carr gets Dennis Allen endorsement amid offensive struggles,,saint ' Derek Carr get Dennis Allen endorsement amid offensive struggle,other,Others
"Dennis Allen provides injury updates, Saints’ goals during bye week","Dennis Allen provides injury updates, Saints’ goals during bye week","Dennis Allen provide injury update , Saints ’ goal bye week",other,Others
Saints Get Full Jameis Winston Experience In Loss To Vikings,Saints Get Full Jameis Winston Experience In Loss To Vikings,saint get full Jameis Winston experience Loss Vikings,other,Others
"Derek Carr injury: Here when the Saints QB could return from shoulder, concussion problems","Derek Carr injury: Here when the Saints QB could return from shoulder, concussion problems","Derek Carr injury : Saints QB could return shoulder , concussion problem",other,Others
Two key Saints players have ‘fairly significant’ injuries,Two key Saints players have ‘fairly significant’ injuries,two key Saints player ' fairly significant ' injury,other,Others
"Saints' Derek Carr (shoulder, concussion) 'all good' following early Week 10 exit","Saints' Derek Carr (shoulder, concussion) 'all good' following early Week 10 exit","saint ' Derek Carr ( shoulder , concussion ) ' good ' follow early Week 10 exit",other,Others
"Saints QB Derek Carr exits game against Vikings with concussion, shoulder injury","Saints QB Derek Carr exits game against Vikings with concussion, shoulder injury","saint QB Derek Carr exit game Vikings concussion , shoulder injury",other,Others
"Saints receive tough news regarding Michael Thomas, Marshon Lattimore","Saints receive tough news regarding Michael Thomas, Marshon Lattimore","saint receive tough news regard Michael Thomas , Marshon Lattimore",other,Others
"Saints lose Derek Carr, Michael Thomas, Marcus Lattimore to injuries - ESPN","Saints lose Derek Carr, Michael Thomas, Marcus Lattimore to injuries - ESPN","saint lose Derek Carr , Michael Thomas , Marcus Lattimore injury - ESPN",other,Others
"Derek Carr likely avoids major right shoulder injury, again","Derek Carr likely avoids major right shoulder injury, again","Derek Carr likely avoid major right shoulder injury ,",other,Others
"Saints offense remains a one-step-forward, two-steps-back unit — with Derek Carr or Jameis Winston at QB","Saints offense remains a one-step-forward, two-steps-back unit — with Derek Carr or Jameis Winston at QB","saint offense remain one - step - forward , two - step - back unit — Derek Carr Jameis Winston QB",other,Others
"Saints QB Derek Carr ruled out early in loss to Vikings with concussion, shoulder injury","Saints QB Derek Carr ruled out early in loss to Vikings with concussion, shoulder injury","saint QB Derek Carr rule early loss Vikings concussion , shoulder injury",other,Others
Jameis Winston to close out Saints vs. Vikings after Derek Carr leaves with concussion,Jameis Winston to close out Saints vs. Vikings after Derek Carr leaves with concussion,Jameis Winston close Saints vs. Vikings Derek Carr leave concussion,other,Others
Derek Carr leaves after big hit in third quarter,Derek Carr leaves after big hit in third quarter,Derek Carr leave big hit third quarter,other,Others
Broncos could find defensive line help on the waiver wire,Broncos could find defensive line help on the waiver wire,Broncos could find defensive line help waiver wire,other,Others
Former Michigan State DL waived by Titans,Former Michigan State DL waived by Titans,former Michigan State DL waive titan,other,Others
Patriots Cut Playmaker in Shocking First Bye Week Move,Patriots Cut Playmaker in Shocking First Bye Week Move,patriot Cut Playmaker Shocking First Bye Week Move,other,Others
Agent: Patriots waiving second-year CB Jack Jones,Agent: Patriots waiving second-year CB Jack Jones,agent : patriot waive second - year CB Jack Jones,other,Others
Patriots Waiving CB Jack Jones - NFLTradeRumors.co,Patriots Waiving CB Jack Jones - NFLTradeRumors.co,patriot waive CB Jack Jones - NFLTradeRumors.co,nfl,Football
Patriots Waiving Jack Jones,Patriots Waiving Jack Jones,patriot Waiving Jack Jones,other,Others
"Patriots Waive CB Jack Jones, Who Had Plenty Of Off-Field Issues","Patriots Waive CB Jack Jones, Who Had Plenty Of Off-Field Issues","Patriots Waive CB Jack Jones , Plenty Off - Field issue",other,Others
More details revealed on why the Patriots waived CB Jack Jones,More details revealed on why the Patriots waived CB Jack Jones,More detail reveal Patriots waive CB Jack Jones,other,Others
Patriots Release Jack Jones,Patriots Release Jack Jones,Patriots Release Jack Jones,other,Others
"Patriots Release CB Jack Jones, Who Committed Curfew Violation","Patriots Release CB Jack Jones, Who Committed Curfew Violation","Patriots Release CB Jack Jones , Committed Curfew Violation",other,Others
Jack Jones waived by the Patriots,Jack Jones waived by the Patriots,Jack Jones waive patriot,other,Others
Patriots move on from troubled CB,Patriots move on from troubled CB,patriot move troubled cb,other,Others
Patriots waive CB Jack Jones: Why now?,Patriots waive CB Jack Jones: Why now?,patriot waive CB Jack Jones : ?,other,Others
Patriots are releasing cornerback Jack Jones,Patriots are releasing cornerback Jack Jones,patriot release cornerback Jack Jones,other,Others
Patriots’ 2022 Draft Takes Yet Another Hit With Jack Jones Release,Patriots’ 2022 Draft Takes Yet Another Hit With Jack Jones Release,patriot ’ 2022 draft take yet another Hit Jack Jones Release,other,Others
Patriots Reportedly Cut Jack Jones Amid Disappointing Season,Patriots Reportedly Cut Jack Jones Amid Disappointing Season,patriot reportedly cut Jack Jones Amid Disappointing Season,other,Others
"NFL Week 11 early odds: Chiefs favored over Eagles in Super Bowl rematch, Packers underdogs at Lambeau Field","NFL Week 11 early odds: Chiefs favored over Eagles in Super Bowl rematch, Packers underdogs at Lambeau Field","NFL Week 11 early odd : chief favor Eagles Super Bowl rematch , Packers underdog Lambeau Field",nfl,Football
Badgers roundtable: Is Luke Fickell the answer at HC?,Badgers roundtable: Is Luke Fickell the answer at HC?,badger roundtable : Luke Fickell answer HC ?,other,Others
QB Tyler Van Dyke back as Miami starter with Emory Williams out - ESPN,QB Tyler Van Dyke back as Miami starter with Emory Williams out - ESPN,QB Tyler Van Dyke back Miami starter Emory Williams - ESPN,other,Others
2024 NFL Draft order: Giants holding No. 3 pick; Jets move up to No. 11,2024 NFL Draft order: Giants holding No. 3 pick; Jets move up to No. 11,2024 NFL Draft order : giant hold . 3 pick ; jet move No . 11,nfl,Football
Jets' unbelievable offensive woes continue as they lose to the Raiders,Jets' unbelievable offensive woes continue as they lose to the Raiders,jet ' unbelievable offensive woe continue lose Raiders,other,Others
Arkansas’ Sam Pittman explains viral halftime Polar Express locker room video vs. Auburn,Arkansas’ Sam Pittman explains viral halftime Polar Express locker room video vs. Auburn,arkansa ' Sam Pittman explain viral halftime Polar Express locker room video vs. Auburn,other,Others
"2023 NFL Week 11 games: Betting odds, lines, spreads, more - ESPN","2023 NFL Week 11 games: Betting odds, lines, spreads, more - ESPN","2023 NFL Week 11 game : bet odd , line , spread , - ESPN",nfl,Football
"NFL power rankings Week 11: Cowboys, Texans both shining brightly","NFL power rankings Week 11: Cowboys, Texans both shining brightly","NFL power ranking Week 11 : cowboy , Texans shine brightly",nfl,Football
"Philadelphia Eagles at Kansas City Chiefs predictions, odds: Who wins NFL Week 11 game?","Philadelphia Eagles at Kansas City Chiefs predictions, odds: Who wins NFL Week 11 game?","Philadelphia Eagles Kansas City Chiefs prediction , odd : win NFL Week 11 game ?",nfl,Football
Taking a look at AFC South standings after Week 10,Taking a look at AFC South standings after Week 10,take look AFC South standing Week 10,other,Others
"Early NFL Week 11 Predictions and Picks Against the Spread: Joe Burrow vs. Lamar Jackson, Jalen Hurts vs. Patrick ...","Early NFL Week 11 Predictions and Picks Against the Spread: Joe Burrow vs. Lamar Jackson, Jalen Hurts vs. Patrick ...","early NFL Week 11 prediction Picks Spread : Joe Burrow vs. Lamar Jackson , Jalen Hurts vs. Patrick ...",nfl,Football
"NFL Week 11 Early Odds, Picks & Predictions (2023)","NFL Week 11 Early Odds, Picks & Predictions (2023)","NFL Week 11 early Odds , Picks & Predictions ( 2023 )",nfl,Football
"NFL Week 11 picks, predictions: Who wins Bengals-Ravens, Steelers-Browns, Eagles-Chiefs?","NFL Week 11 picks, predictions: Who wins Bengals-Ravens, Steelers-Browns, Eagles-Chiefs?","NFL Week 11 pick , prediction : win Bengals - Ravens , Steelers - Browns , Eagles - Chiefs ?",nfl,Football
"NFL Power Rankings Week 11: Eagles, Chiefs atop the league, 49ers move back to top 3, Falcons tumble after loss","NFL Power Rankings Week 11: Eagles, Chiefs atop the league, 49ers move back to top 3, Falcons tumble after loss","NFL Power Rankings Week 11 : eagle , Chiefs atop league , 49er move back top 3 , falcon tumble loss",nfl,Football
NFL Power Rankings entering Week 11,,NFL Power Rankings enter Week 11,nfl,Football
"NFL 2023 Week 11 Survivor Pool Picks, Predictions","NFL 2023 Week 11 Survivor Pool Picks, Predictions","NFL 2023 week 11 Survivor Pool Picks , prediction",nfl,Football
"NFL Week 11 Betting: Best spread, over/under bets before lines move | NFL and NCAA Betting Picks",,"NFL Week 11 bet : best spread , / bet line move | NFL NCAA Betting pick",nfl,Football
Talk the Line: Early breakdown of NFL Week 11 odds,Talk the Line: Early breakdown of NFL Week 11 odds,talk line : early breakdown NFL Week 11 odd,nfl,Football
NFC standings update: Vikings still 1.5 games behind Lions in North,NFC standings update: Vikings still 1.5 games behind Lions in North,nfc standing update : viking still 1.5 game behind Lions North,other,Others
