title,title_english,processed_title,League Name,category
NBA Twitter reacts to Clippers being 0-4 since the James Harden trade: 'Tyrese Maxey the real winner',NBA Twitter reacts to Clippers being 0-4 since the James Harden trade: 'Tyrese Maxey the real winner',NBA Twitter react clipper 0 - 4 since James Harden trade : ' tyrese Maxey real winner ',nba,Basketball
"Tyronn Lue expresses frustration as Clippers fall to Grizzlies, lose fifth straight game: ‘We got to be better’","Tyronn Lue expresses frustration as Clippers fall to Grizzlies, lose fifth straight game: ‘We got to be better’","Tyronn Lue express frustration clipper fall grizzly , lose fifth straight game : ' get well '",other,Others
"Desmond Bane scores 27, Memphis Grizzlies thwart Clippers for 2nd win","Desmond Bane scores 27, Memphis Grizzlies thwart Clippers for 2nd win","Desmond Bane score 27 , Memphis Grizzlies thwart clipper 2nd win",other,Others
"James Harden is back home in Los Angeles, but nothing looks comfortable","James Harden is back home in Los Angeles, but nothing looks comfortable","James Harden back home Los Angeles , nothing look comfortable",other,Others
"Clippers Drop Fifth Game in a Row, Fall to Grizz 105-101","Clippers Drop Fifth Game in a Row, Fall to Grizz 105-101","clipper Drop Fifth Game row , fall Grizz 105 - 101",other,Others
"Grizzlies vs. Lakers prediction, odds, line, spread, start time: 2023 NBA picks, November 14 best bets from proven ...","Grizzlies vs. Lakers prediction, odds, line, spread, start time: 2023 NBA picks, November 14 best bets from proven ...","grizzly vs. Lakers prediction , odd , line , spread , start time : 2023 NBA pick , November 14 good bet proven ...",nba,Basketball
"Memphis Grizzlies vs Los Angeles Lakers Prediction, 11/14/2023 Preview and Pick","Memphis Grizzlies vs Los Angeles Lakers Prediction, 11/14/2023 Preview and Pick","Memphis Grizzlies vs Los Angeles Lakers Prediction , 11/14/2023 Preview Pick",other,Others
Ty Lue Following Loss To Grizzlies: Clippers 'Playing Too Slow',Ty Lue Following Loss To Grizzlies: Clippers 'Playing Too Slow',Ty Lue follow Loss grizzly : clipper ' play Too Slow ',other,Others
BREAKING: Pat Murphy named Manager of the Milwaukee Brewers,BREAKING: Pat Murphy named Manager of the Milwaukee Brewers,breaking : Pat Murphy name Manager Milwaukee Brewers,other,Others
Report: Milwaukee Brewers to name Pat Murphy as new manager,Report: Milwaukee Brewers to name Pat Murphy as new manager,report : Milwaukee Brewers name Pat Murphy new manager,other,Others
Brewers reportedly expected to promote bench coach Pat Murphy to manager,Brewers reportedly expected to promote bench coach Pat Murphy to manager,brewer reportedly expect promote bench coach Pat Murphy manager,other,Others
Report: Brewers to name bench coach Pat Murphy as next manager,Report: Brewers to name bench coach Pat Murphy as next manager,report : brewer name bench coach Pat Murphy next manager,other,Others
Pat Murphy is reportedly the next Brewers manager. Here what to know about him.,Pat Murphy is reportedly the next Brewers manager. Here what to know about him.,Pat Murphy reportedly next Brewers manager . know .,other,Others
Pat Murphy could represent the most logical choice as the Brewers' next manager,Pat Murphy could represent the most logical choice as the Brewers' next manager,Pat Murphy could represent logical choice Brewers ' next manager,other,Others
This Just In: Brewers Name Pat Murphey As Manager,This Just In: Brewers Name Pat Murphey As Manager,: brewer Name Pat Murphey Manager,other,Others
Bench coach Pat Murphy serious candidate for Brewers manager position,Bench coach Pat Murphy serious candidate for Brewers manager position,Bench coach Pat Murphy serious candidate Brewers manager position,other,Others
Report: Brewers expected to name bench coach Pat Murphy manager,Report: Brewers expected to name bench coach Pat Murphy manager,report : brewer expect name bench coach Pat Murphy manager,other,Others
Report: Brewers expected to hire Pat Murphy as new manager,Report: Brewers expected to hire Pat Murphy as new manager,report : brewer expect hire Pat Murphy new manager,other,Others
Brewers GM Matt Arnold discusses replacing Craig Counsell,Brewers GM Matt Arnold discusses replacing Craig Counsell,brewer GM Matt Arnold discuss replace Craig Counsell,epl,Soccer
"The RSM Classic TV Schedule, How to Watch and Live Stream","The RSM Classic TV Schedule, How to Watch and Live Stream","RSM Classic TV Schedule , watch live Stream",other,Others
"DraftKings PGA DFS Lineup Picks - The RSM Classic With Ludvig Aberg, Cameron Young, Russell Henley, Brendon ...","DraftKings PGA DFS Lineup Picks - The RSM Classic With Ludvig Aberg, Cameron Young, Russell Henley, Brendon ...","DraftKings PGA DFS Lineup Picks - RSM Classic Ludvig Aberg , Cameron Young , Russell Henley , Brendon ...",other,Others
Fantasy Golf: 2023 RSM Classic DFS Player Selections,Fantasy Golf: 2023 RSM Classic DFS Player Selections,Fantasy Golf : 2023 RSM Classic DFS Player Selections,other,Others
Win $10000 When You Correctly Predict the Top Three at the RSM Classic,Win $10000 When You Correctly Predict the Top Three at the RSM Classic,win $ 10000 correctly predict Top Three RSM Classic,other,Others
"Fantasy Golf Picks, Odds, and Predictions - 2023 RSM Classic","Fantasy Golf Picks, Odds, and Predictions - 2023 RSM Classic","Fantasy Golf Picks , Odds , prediction - 2023 RSM Classic",other,Others
"RSM Classic 2023: Preview, betting tips, how to watch","RSM Classic 2023: Preview, betting tips, how to watch","RSM Classic 2023 : Preview , bet tip , watch",other,Others
"2023 RSM Classic odds, picks and PGA Tour predictions","2023 RSM Classic odds, picks and PGA Tour predictions","2023 RSM Classic odd , pick PGA Tour prediction",pga tour,Golf
"Brian Harman, Ludvig Aberg highlight field for PGA Tour season finale at 2023 RSM Classic","Brian Harman, Ludvig Aberg highlight field for PGA Tour season finale at 2023 RSM Classic","Brian Harman , Ludvig Aberg highlight field PGA Tour season finale 2023 RSM Classic",pga tour,Golf
Monday qualifiers: The RSM Classic - PGA TOUR,Monday qualifiers: The RSM Classic - PGA TOUR,Monday qualifier : RSM Classic - PGA TOUR,pga tour,Golf
What at stake: 2024 status on line as PGA TOUR concludes at The RSM Classic,What at stake: 2024 status on line as PGA TOUR concludes at The RSM Classic,stake : 2024 status line PGA TOUR conclude RSM Classic,pga tour,Golf
2023 RSM Classic Preview Picks Analysis,2023 RSM Classic Preview Picks Analysis,2023 RSM Classic Preview pick Analysis,other,Others
The RSM Classic purse breakdown - PGA TOUR,The RSM Classic purse breakdown - PGA TOUR,RSM Classic purse breakdown - PGA TOUR,pga tour,Golf
10 pros playing for their PGA Tour futures (in some form) at this week’s RSM Classic,10 pros playing for their PGA Tour futures (in some form) at this week’s RSM Classic,10 pro play PGA Tour future ( form ) week ’s RSM Classic,pga tour,Golf
Top amateur David Ford fulfills dream alongside identical twin at RSM Classic - PGA TOUR,Top amateur David Ford fulfills dream alongside identical twin at RSM Classic - PGA TOUR,top amateur David Ford fulfill dream alongside identical twin RSM Classic - PGA TOUR,pga tour,Golf
Grizzlies vs Clippers Prediction - NBA Picks 11/12/23,Grizzlies vs Clippers Prediction - NBA Picks 11/12/23,grizzly vs Clippers Prediction - NBA pick 11/12/23,nba,Basketball
76ers are proving they won the James Harden trade with Clippers,76ers are proving they won the James Harden trade with Clippers,76er prove win James Harden trade clipper,other,Others
James Harden admits to harsh reality Clippers are facing amid 5-game slump,James Harden admits to harsh reality Clippers are facing amid 5-game slump,James Harden admit harsh reality clipper face amid 5 - game slump,other,Others
Lakers provide injury updates on LeBron James and Anthony Davis ahead of Tuesday’s matchup vs. Grizzlies,Lakers provide injury updates on LeBron James and Anthony Davis ahead of Tuesday’s matchup vs. Grizzlies,laker provide injury update LeBron James Anthony Davis ahead Tuesday ’s matchup vs. grizzly,other,Others
James Harden suffers FOURTH straight loss since Clippers trade as Los Angeles falls to the Grizzlies - the NBA,James Harden suffers FOURTH straight loss since Clippers trade as Los Angeles falls to the Grizzlies - the NBA,James Harden suffer FOURTH straight loss since clipper trade Los Angeles fall Grizzlies - NBA,nba,Basketball
Ben Weber AMERICAN PURGATORY,,Ben Weber AMERICAN PURGATORY,other,Others
Ivica Zubac NBA Preview vs. the Grizzlies,Ivica Zubac NBA Preview vs. the Grizzlies,Ivica Zubac NBA Preview vs. grizzly,nba,Basketball
"Will the Grizzlies cover the spread vs. the Clippers? Promo Codes, Betting Trends, Records ATS","Will the Grizzlies cover the spread vs. the Clippers? Promo Codes, Betting Trends, Records ATS","Grizzlies cover spread vs. Clippers ? Promo Codes , Betting Trends , Records ATS",other,Others
"Insider Insights: Bane Continues Stellar Play In LA, Grizzlies Outlast Clippers, Move to 2-8","Insider Insights: Bane Continues Stellar Play In LA, Grizzlies Outlast Clippers, Move to 2-8","insider insight : Bane continue Stellar play LA , Grizzlies Outlast Clippers , move 2 - 8",other,Others
"Jaren Jackson Jr. Player Props: Three-Pointer Props & Odds vs. the Clippers - Sunday, November 12, 2023","Jaren Jackson Jr. Player Props: Three-Pointer Props & Odds vs. the Clippers - Sunday, November 12, 2023","Jaren Jackson Jr. Player Props : three - Pointer Props & Odds vs. Clippers - Sunday , November 12 , 2023",other,Others
"Tyrese Maxey has career-high 50 points, 76ers beat Pacers 137-126 for 8th straight win","Tyrese Maxey has career-high 50 points, 76ers beat Pacers 137-126 for 8th straight win","tyrese Maxey career - high 50 point , 76er beat Pacers 137 - 126 8th straight win",other,Others
"Bane scores 27 points, Grizzlies survive Clippers' 4th-quarter charge for 2nd win, 105-101","Bane scores 27 points, Grizzlies survive Clippers' 4th-quarter charge for 2nd win, 105-101","bane score 27 point , grizzly survive Clippers ' 4th - quarter charge 2nd win , 105 - 101",other,Others
Grizzlies vs. Clippers NBA Betting Odds & Prediction,Grizzlies vs. Clippers NBA Betting Odds & Prediction,grizzly vs. Clippers NBA Betting Odds & Prediction,nba,Basketball
Russell Westbrook Player Prop Bets: Clippers vs. Grizzlies | November 12,,Russell Westbrook Player Prop Bets : Clippers vs. Grizzlies | November 12,other,Others
"Grizzlies vs Lakers: times, how to watch on TV, stream online | NBA","Grizzlies vs Lakers: times, how to watch on TV, stream online | NBA","grizzly vs laker : time , watch tv , stream online | NBA",nba,Basketball
Grizzlies fight off skidding Clippers for second win of season,Grizzlies fight off skidding Clippers for second win of season,grizzly fight skid clipper second win season,other,Others
"Los Angeles takes on Memphis, looks for 5th straight home win","Los Angeles takes on Memphis, looks for 5th straight home win","Los Angeles take Memphis , look 5th straight home win",other,Others
How to Watch the Grizzlies vs. Clippers Game: Streaming & TV Info,How to Watch the Grizzlies vs. Clippers Game: Streaming & TV Info,watch Grizzlies vs. Clippers Game : Streaming & TV Info,other,Others
NBA: Memphis Grizzlies at Los Angeles Clippers | Fieldlevel | henryherald.com,NBA: Memphis Grizzlies at Los Angeles Clippers | Fieldlevel | henryherald.com,NBA : Memphis Grizzlies Los Angeles Clippers | Fieldlevel | henryherald.com,nba,Basketball
The Milwaukee Brewers Hire Manager With 947-400 Career Coaching Record (Breaking),The Milwaukee Brewers Hire Manager With 947-400 Career Coaching Record (Breaking),Milwaukee Brewers Hire Manager 947 - 400 career Coaching Record ( Breaking ),other,Others
Brewers expected to promote bench coach Pat Murphy to manager,Brewers expected to promote bench coach Pat Murphy to manager,brewer expect promote bench coach Pat Murphy manager,other,Others
Milwaukee Brewers to name bench coach Murphy as new manager,Milwaukee Brewers to name bench coach Murphy as new manager,Milwaukee Brewers name bench coach Murphy new manager,other,Others
Report: Brewers expected to promote bench coach Pat Murphy to manager,Report: Brewers expected to promote bench coach Pat Murphy to manager,report : brewer expect promote bench coach Pat Murphy manager,other,Others
Brewers make decision on their new manager,Brewers make decision on their new manager,brewer make decision new manager,other,Others
Brewers bench coach to replace Craig Counsell as manager,Brewers bench coach to replace Craig Counsell as manager,brewer bench coach replace Craig Counsell manager,epl,Soccer
"Milwaukee Brewers: Everything Fans Need to Know about Pat Murphy, the 20th Manager in Franchise History","Milwaukee Brewers: Everything Fans Need to Know about Pat Murphy, the 20th Manager in Franchise History","Milwaukee brewer : everything fan need know Pat Murphy , 20th Manager Franchise history",other,Others
Milwaukee Brewers Fans React to Pat Murphy Being Promoted to New Manager,Milwaukee Brewers Fans React to Pat Murphy Being Promoted to New Manager,Milwaukee Brewers Fans react Pat Murphy promote New Manager,other,Others
Milwaukee Brewers Manager Candidate Spotlight: Jeff Banister,,Milwaukee Brewers Manager Candidate Spotlight : Jeff Banister,other,Others
Milwaukee Brewers: Pat Murphy the Best Option to Replace Craig Counsell?,Milwaukee Brewers: Pat Murphy the Best Option to Replace Craig Counsell?,Milwaukee brewer : Pat Murphy Best Option replace Craig Counsell ?,epl,Soccer
"RSM Classic 2023 Odds, Field: Ludvig Aberg, Cameron Young & Brian Harman Favored at Sea Island","RSM Classic 2023 Odds, Field: Ludvig Aberg, Cameron Young & Brian Harman Favored at Sea Island","RSM Classic 2023 Odds , field : Ludvig Aberg , Cameron Young & Brian Harman favor Sea Island",other,Others
"PGA DFS First Look: RSM Classic Odds, Salaries, Course History","PGA DFS First Look: RSM Classic Odds, Salaries, Course History","PGA DFS First Look : RSM Classic Odds , Salaries , course history",other,Others
Odds Outlook: Ludvig Åberg headlines top picks for The RSM Classic - PGA TOUR,Odds Outlook: Ludvig Åberg headlines top picks for The RSM Classic - PGA TOUR,odd Outlook : Ludvig Åberg headline top pick RSM Classic - PGA TOUR,pga tour,Golf
FedExCup Fall scenarios for The RSM Classic - PGA TOUR,FedExCup Fall scenarios for The RSM Classic - PGA TOUR,fedexcup fall scenario RSM Classic - PGA TOUR,pga tour,Golf
The First Look: The RSM Classic - PGA TOUR,The First Look: The RSM Classic - PGA TOUR,First Look : RSM Classic - PGA TOUR,pga tour,Golf
Inside the Field: See who heading to St. Simons Island for The RSM Classic - PGA TOUR,Inside the Field: See who heading to St. Simons Island for The RSM Classic - PGA TOUR,inside field : see head St. Simons Island RSM Classic - PGA TOUR,pga tour,Golf
"The RSM Classic: PGA TOUR Golf Best Bets, Predictions, Odds to Consider on DraftKings Sportsbook","The RSM Classic: PGA TOUR Golf Best Bets, Predictions, Odds to Consider on DraftKings Sportsbook","RSM Classic : PGA TOUR Golf Best Bets , prediction , odd consider DraftKings Sportsbook",pga tour,Golf
"2023 RSM Classic: Course & Field Breakdown, Odds, + Key Stats","2023 RSM Classic: Course & Field Breakdown, Odds, + Key Stats","2023 RSM Classic : Course & Field Breakdown , Odds , + Key Stats",other,Others
"DraftKings Fantasy Golf Picks: The RSM Classic Predictions, Preview","DraftKings Fantasy Golf Picks: The RSM Classic Predictions, Preview","DraftKings Fantasy Golf Picks : RSM Classic Predictions , Preview",other,Others
Fantasy Golf Value Picks: Top DraftKings PGA TOUR DFS Bargain Plays for The RSM Classic,Fantasy Golf Value Picks: Top DraftKings PGA TOUR DFS Bargain Plays for The RSM Classic,Fantasy Golf Value Picks : Top DraftKings PGA TOUR DFS Bargain play RSM Classic,pga tour,Golf
PGA odds 2023: Odds to win the RSM Classic on DraftKings Sportsbook,PGA odds 2023: Odds to win the RSM Classic on DraftKings Sportsbook,PGA odd 2023 : odd win RSM Classic DraftKings Sportsbook,other,Others
2023 RSM Classic Preview,2023 RSM Classic Preview,2023 RSM Classic Preview,other,Others
LA Clippers - Memphis Grizzlies Live - NBA: Basketball Scores & Highlights - 12/11/2023,LA Clippers - Memphis Grizzlies Live - NBA: Basketball Scores & Highlights - 12/11/2023,LA Clippers - Memphis Grizzlies Live - NBA : Basketball Scores & Highlights - 12/11/2023,nba,Basketball
Memphis Grizzlies secure road victory against struggling Los Angeles Clippers,Memphis Grizzlies secure road victory against struggling Los Angeles Clippers,Memphis Grizzlies secure road victory struggle Los Angeles Clippers,other,Others
Grizzlies vs. Clippers Injury Report Today - November 12,Grizzlies vs. Clippers Injury Report Today - November 12,grizzly vs. Clippers Injury Report Today - November 12,other,Others
Full Grizzlies - Clippers Highlights | Highlights and Live Video from Bleacher Report,Full Grizzlies - Clippers Highlights | Highlights and Live Video from Bleacher Report,full Grizzlies - Clippers Highlights | Highlights Live Video Bleacher Report,other,Others
Los Angeles Lakers vs Memphis Grizzlies How to Stream & TV Channel - November 14,Los Angeles Lakers vs Memphis Grizzlies How to Stream & TV Channel - November 14,Los Angeles Lakers vs Memphis Grizzlies Stream & TV Channel - November 14,other,Others
Lakers vs. Grizzlies NBA Betting Preview for November 14,Lakers vs. Grizzlies NBA Betting Preview for November 14,laker vs. Grizzlies NBA bet Preview November 14,nba,Basketball
Marcus Smart NBA Preview vs. the Clippers,Marcus Smart NBA Preview vs. the Clippers,Marcus Smart NBA Preview vs. clipper,nba,Basketball
Grizzlies Get Second Win of the Season,Grizzlies Get Second Win of the Season,grizzly get second win season,other,Others
Struggling Grizzlies survive to bump Clippers to 0-4 with Harden in lineup,Struggling Grizzlies survive to bump Clippers to 0-4 with Harden in lineup,struggle grizzly survive bump clipper 0 - 4 Harden lineup,other,Others
"Clippers Still Winless With James Harden, Fall to Wounded Grizzlies","Clippers Still Winless With James Harden, Fall to Wounded Grizzlies","clipper still Winless James Harden , fall wounded grizzly",other,Others
Clippers face Grizzlies looking to get stars aligned,Clippers face Grizzlies looking to get stars aligned,clipper face grizzly look get star align,other,Others
"Are the Grizzlies favored vs. the Clippers on November 12? Game odds, spread, over/under","Are the Grizzlies favored vs. the Clippers on November 12? Game odds, spread, over/under","Grizzlies favor vs. Clippers November 12 ? game odd , spread , /",other,Others
Lakers vs. Grizzlies Prediction & Picks - November 14,Lakers vs. Grizzlies Prediction & Picks - November 14,laker vs. Grizzlies Prediction & Picks - November 14,other,Others
NBA Best Bets Today | Expert Picks for NBA Monday,NBA Best Bets Today | Expert Picks for NBA Monday,NBA Best Bets today | Expert pick NBA Monday,nba,Basketball
"Tom Aspinall scoffs at Ciryl Gane callout, suggests he fights Jailton Almeida","Tom Aspinall scoffs at Ciryl Gane callout, suggests he fights Jailton Almeida","Tom Aspinall scoff Ciryl Gane callout , suggest fight Jailton Almeida",other,Others
RSM Classic Betting Picks and Predictions,RSM Classic Betting Picks and Predictions,RSM Classic Betting Picks prediction,other,Others
"Win $10,000 on the RSM Classic When You Predict the Top Three Finishers","Win $10,000 on the RSM Classic When You Predict the Top Three Finishers","win $ 10,000 RSM Classic predict Top Three finisher",other,Others
NBA: Memphis Grizzlies at Los Angeles Clippers | Fieldlevel | news-daily.com,NBA: Memphis Grizzlies at Los Angeles Clippers | Fieldlevel | news-daily.com,NBA : Memphis Grizzlies Los Angeles Clippers | Fieldlevel | news-daily.com,nba,Basketball
"Memphis Grizzlies at Los Angeles Clippers odds, picks and predictions","Memphis Grizzlies at Los Angeles Clippers odds, picks and predictions","Memphis Grizzlies Los Angeles Clippers odd , pick prediction",other,Others
"2023 NBA bets, lines and stats for Monday - ESPN","2023 NBA bets, lines and stats for Monday - ESPN","2023 NBA bet , line stat Monday - ESPN",nba,Basketball
"NBA DFS Picks Breakdown on DraftKings and FanDuel (Monday, Nov. 13)","NBA DFS Picks Breakdown on DraftKings and FanDuel (Monday, Nov. 13)","NBA DFS pick Breakdown DraftKings FanDuel ( Monday , Nov. 13 )",nba,Basketball
"NBA DFS: Top DraftKings, FanDuel daily Fantasy basketball picks for Monday, Nov. 13 include Pascal Siakam","NBA DFS: Top DraftKings, FanDuel daily Fantasy basketball picks for Monday, Nov. 13 include Pascal Siakam","NBA DFS : Top DraftKings , FanDuel daily Fantasy basketball pick Monday , Nov. 13 include Pascal Siakam",nba,Basketball
"NBA Same Game Parlay Odds, Picks & Predictions: Monday (11/13)","NBA Same Game Parlay Odds, Picks & Predictions: Monday (11/13)","NBA Same Game Parlay Odds , Picks & prediction : Monday ( 11/13 )",nba,Basketball
NBA Best Bets Today | Expert Picks for NBA Sunday,NBA Best Bets Today | Expert Picks for NBA Sunday,NBA Best Bets today | Expert pick NBA Sunday,nba,Basketball
"NBA Best Bets Today - Free Picks for Monday, November 13","NBA Best Bets Today - Free Picks for Monday, November 13","NBA Best Bets today - Free Picks Monday , November 13",nba,Basketball
"Expert NBA Best Bets and Player Props Today - Monday, November 13","Expert NBA Best Bets and Player Props Today - Monday, November 13","expert NBA Best Bets Player Props Today - Monday , November 13",nba,Basketball
"NBA DFS Picks: FanDuel Plays and Strategy for Monday, November 13","NBA DFS Picks: FanDuel Plays and Strategy for Monday, November 13","NBA DFS Picks : FanDuel Plays Strategy Monday , November 13",nba,Basketball
"NBA DFS, 2023: Top FanDuel, DraftKings tournament picks, advice for Monday, Nov. 13 from a daily Fantasy pro","NBA DFS, 2023: Top FanDuel, DraftKings tournament picks, advice for Monday, Nov. 13 from a daily Fantasy pro","NBA DFS , 2023 : Top FanDuel , DraftKings tournament pick , advice Monday , Nov. 13 daily Fantasy pro",nba,Basketball
Fantasy Basketball Value Picks: Top DraftKings NBA DFS Bargain Plays for November 13,Fantasy Basketball Value Picks: Top DraftKings NBA DFS Bargain Plays for November 13,Fantasy Basketball Value pick : Top DraftKings NBA DFS Bargain Plays November 13,nba,Basketball
NBA DFS Picks & Building Blocks: Malik Monk and Scottie Barnes Lead the Way (November 13),NBA DFS Picks & Building Blocks: Malik Monk and Scottie Barnes Lead the Way (November 13),NBA DFS Picks & Building Blocks : Malik Monk Scottie Barnes Lead Way ( November 13 ),nba,Basketball
"NBA DFS Top Picks: Core Plays LIVE for Monday, November 13th","NBA DFS Top Picks: Core Plays LIVE for Monday, November 13th","NBA DFS Top Picks : Core play LIVE Monday , November 13th",nba,Basketball
NBA DraftKings & FanDuel DFS Primer: Monday (11/13),,NBA DraftKings & FanDuel DFS Primer : Monday ( 11/13 ),nba,Basketball
NBA Daily Fantasy Picks & Playbook November 13,NBA Daily Fantasy Picks & Playbook November 13,NBA Daily Fantasy Picks & Playbook November 13,nba,Basketball
NBA DFS Picks for Monday 11/13/23,NBA DFS Picks for Monday 11/13/23,NBA DFS Picks Monday 11/13/23,nba,Basketball
"NBA DFS Picks: Yahoo Plays and Strategy for Monday, November 13","NBA DFS Picks: Yahoo Plays and Strategy for Monday, November 13","NBA DFS Picks : Yahoo Plays Strategy Monday , November 13",nba,Basketball
"NBA Player Props & Best Bets Today - Schedule, Picks for Monday","NBA Player Props & Best Bets Today - Schedule, Picks for Monday","NBA Player Props & Best Bets today - Schedule , Picks Monday",nba,Basketball
"NBA DFS Cheat Sheets for November 12, 2023 - FanDuel, DraftKings, & Yahoo","NBA DFS Cheat Sheets for November 12, 2023 - FanDuel, DraftKings, & Yahoo","NBA DFS Cheat Sheets November 12 , 2023 - FanDuel , DraftKings , & Yahoo",nba,Basketball
"How to Watch the NBA on Sunday: TV Channel, Game Times and Odds","How to Watch the NBA on Sunday: TV Channel, Game Times and Odds","watch NBA Sunday : TV Channel , Game Times odd",nba,Basketball
"NBA odds, best bets and props for Wednesday, November 8th","NBA odds, best bets and props for Wednesday, November 8th","NBA odd , good bet prop Wednesday , November 8th",nba,Basketball
How to Watch NBA Games Online on Sling,How to Watch NBA Games Online on Sling,watch NBA Games Online Sling,nba,Basketball
NBA DFS Strategy and Picks for Friday (11/10),NBA DFS Strategy and Picks for Friday (11/10),NBA DFS Strategy Picks Friday ( 11/10 ),nba,Basketball
NBA First FG Props - November 12,NBA First FG Props - November 12,NBA First FG Props - November 12,nba,Basketball
"What Is ESPN BET? How It Works, Where It Is Legal, and More","What Is ESPN BET? How It Works, Where It Is Legal, and More","ESPN BET ? work , legal ,",other,Others
"Monday NBA Player Prop Cheat Sheet: Targeting Nikola Jokic, Anthony Edwards, and More","Monday NBA Player Prop Cheat Sheet: Targeting Nikola Jokic, Anthony Edwards, and More","Monday NBA Player Prop Cheat Sheet : target Nikola Jokic , Anthony Edwards ,",nba,Basketball
"Peter Points: NBA Best Bets Today (Expert Predictions, Picks for Immanuel Quickley, Kyle Kuzma)","Peter Points: NBA Best Bets Today (Expert Predictions, Picks for Immanuel Quickley, Kyle Kuzma)","Peter point : NBA Best Bets today ( Expert prediction , Picks Immanuel Quickley , Kyle Kuzma )",nba,Basketball
"Tom Aspinall wins interim heavyweight title, Alex Pereira crowned light heavyweight champ at UFC 295","Tom Aspinall wins interim heavyweight title, Alex Pereira crowned light heavyweight champ at UFC 295","Tom Aspinall win interim heavyweight title , Alex Pereira crown light heavyweight champ UFC 295",ufc,Fighting
