title,title_english,processed_title,League Name,category
Report: Video Footage Unable to Confirm Evidence of Hit-and-Run Involving Kelly Oubre,Report: Video Footage Unable to Confirm Evidence of Hit-and-Run Involving Kelly Oubre,report : Video Footage unable confirm Evidence Hit - - Run Involving Kelly Oubre,other,Others
"No evidence yet 76ers' Kelly Oubre Jr. was victim of hit-and-run, police say","No evidence yet 76ers' Kelly Oubre Jr. was victim of hit-and-run, police say","evidence yet 76er ' Kelly Oubre Jr. victim hit - - run , police say",other,Others
Kelly Oubre hit-and-run: Philly advocates press for traffic safety solutions,Kelly Oubre hit-and-run: Philly advocates press for traffic safety solutions,Kelly Oubre hit - - run : Philly advocate press traffic safety solution,other,Others
TMZ Has Footage of Kelly Oubre After Reported Hit and Run Incident,TMZ Has Footage of Kelly Oubre After Reported Hit and Run Incident,TMZ footage Kelly Oubre report Hit Run Incident,other,Others
"Kelly Oubre Jr.: No evidence found for hit-and-run involving 76ers guard, police say","Kelly Oubre Jr.: No evidence found for hit-and-run involving 76ers guard, police say","Kelly Oubre Jr. : evidence find hit - - run involve 76er guard , police say",other,Others
"76ers' Kelly Oubre has rib, hip and leg injuries after hit-and-run incident","76ers' Kelly Oubre has rib, hip and leg injuries after hit-and-run incident","76er ' Kelly Oubre rib , hip leg injury hit - - run incident",other,Others
Steph Curry reveals the Warriors prayed for Kelly Oubre Jr.,Steph Curry reveals the Warriors prayed for Kelly Oubre Jr.,Steph Curry reveal warrior pray Kelly Oubre Jr.,other,Others
"Atlantic Notes: Oubre, Simmons, Dinwiddie, Towns",,"Atlantic Notes : Oubre , Simmons , Dinwiddie , town",other,Others
Video doesn't show vehicle injuring Philadelphia 76ers' Oubre Jr. in hit-and-run; police still investigating,Video doesn't show vehicle injuring Philadelphia 76ers' Oubre Jr. in hit-and-run; police still investigating,video show vehicle injure Philadelphia 76er ' Oubre Jr. hit - - run ; police still investigate,other,Others
"Lakers vs. Kings odds, line, spread: 2023 NBA picks, November 15 predictions from proven model","Lakers vs. Kings odds, line, spread: 2023 NBA picks, November 15 predictions from proven model","laker vs. king odd , line , spread : 2023 NBA pick , November 15 prediction proven model",nba,Basketball
"Lakers Injury Report: LA Reveals Final Status of LeBron James, Anthony Davis for Wednesday Kings Battle","Lakers Injury Report: LA Reveals Final Status of LeBron James, Anthony Davis for Wednesday Kings Battle","Lakers Injury Report : LA reveal Final Status LeBron James , Anthony Davis Wednesday king Battle",other,Others
"Lakers vs. Kings Preview, Start Time and TV Schedule","Lakers vs. Kings Preview, Start Time and TV Schedule","laker vs. king Preview , Start Time TV schedule",other,Others
"Kings hold off Lakers comeback attempt, win fourth straight 125-110","Kings hold off Lakers comeback attempt, win fourth straight 125-110","king hold laker comeback attempt , win fourth straight 125 - 110",other,Others
Kings defeat Lakers for fourth straight win,Kings defeat Lakers for fourth straight win,king defeat laker fourth straight win,other,Others
"Three Things to Know: Lakers vs Kings, 11-15-23","Three Things to Know: Lakers vs Kings, 11-15-23","three thing know : laker vs king , 11 - 15 - 23",other,Others
Sluggish Lakers fall easily to the Sacramento Kings,Sluggish Lakers fall easily to the Sacramento Kings,Sluggish laker fall easily Sacramento king,other,Others
"Kings vs Lakers Picks, Predictions & Odds Tonight - NBA","Kings vs Lakers Picks, Predictions & Odds Tonight - NBA","king vs Lakers Picks , Predictions & Odds Tonight - NBA",nba,Basketball
"Sacramento Kings vs. Los Angeles Lakers FREE LIVE STREAM (11/15/23): Watch NBA online | Time, TV, channel","Sacramento Kings vs. Los Angeles Lakers FREE LIVE STREAM (11/15/23): Watch NBA online | Time, TV, channel","Sacramento king vs. Los Angeles Lakers free live STREAM ( 11/15/23 ): Watch NBA online | Time , tv , channel",nba,Basketball
"Lakers vs Kings Prediction, Pick Tonight | Best Bet for Wednesday","Lakers vs Kings Prediction, Pick Tonight | Best Bet for Wednesday","laker vs king Prediction , Pick Tonight | Best Bet Wednesday",other,Others
Kings vs. Lakers Preview and Predictions: California Beamin',Kings vs. Lakers Preview and Predictions: California Beamin',king vs. Lakers Preview prediction : California Beamin ',other,Others
"Sacramento Kings vs. Los Angeles Lakers Prediction: Can LeBron James, Anthony Davis Lead Lakers to Victory?","Sacramento Kings vs. Los Angeles Lakers Prediction: Can LeBron James, Anthony Davis Lead Lakers to Victory?","Sacramento king vs. Los Angeles Lakers Prediction : LeBron James , Anthony Davis Lead Lakers victory ?",other,Others
"Kings vs. Lakers gameday live: LeBron James, Anthony Davis injuries and scouting reports","Kings vs. Lakers gameday live: LeBron James, Anthony Davis injuries and scouting reports","king vs. Lakers gameday live : LeBron James , Anthony Davis injury scouting report",other,Others
"Sacramento Kings vs Los Angeles Lakers Prediction, 11/15/2023 Preview and Pick","Sacramento Kings vs Los Angeles Lakers Prediction, 11/15/2023 Preview and Pick","Sacramento king vs Los Angeles Lakers Prediction , 11/15/2023 Preview Pick",other,Others
"Are the Kings favored vs. the Lakers on November 15? Game odds, spread, over/under","Are the Kings favored vs. the Lakers on November 15? Game odds, spread, over/under","king favor vs. Lakers November 15 ? game odd , spread , /",other,Others
Recap: Lakers Winning Streak Comes To End As Kings Hand Them First Home Loss,Recap: Lakers Winning Streak Comes To End As Kings Hand Them First Home Loss,recap : laker win streak come end king hand First Home Loss,other,Others
"Are the Kings favored vs. the Lakers on November 15? Game odds, spread, over/under","Are the Kings favored vs. the Lakers on November 15? Game odds, spread, over/under","king favor vs. Lakers November 15 ? game odd , spread , /",other,Others
"Cameron Reddish Player Props: Three-Pointer Props & Odds vs. the Kings - Wednesday, November 15, 2023","Cameron Reddish Player Props: Three-Pointer Props & Odds vs. the Kings - Wednesday, November 15, 2023","Cameron Reddish Player Props : three - Pointer Props & Odds vs. king - Wednesday , November 15 , 2023",other,Others
NBA DFS Showdown Playbook November 15: Sacramento Kings vs Los Angeles Lakers Top Picks,NBA DFS Showdown Playbook November 15: Sacramento Kings vs Los Angeles Lakers Top Picks,NBA DFS Showdown Playbook November 15 : Sacramento king vs Los Angeles Lakers Top pick,nba,Basketball
"Sacramento 125, L.A. Lakers 110",,"Sacramento 125 , L.A. laker 110",other,Others
Mac Jones has lost 'vast majority' of Patriots' locker room amid disastrous season: report,Mac Jones has lost 'vast majority' of Patriots' locker room amid disastrous season: report,Mac Jones lose ' vast majority ' Patriots ' locker room amid disastrous season : report,other,Others
Fire Bill Belichick? Bench Mac Jones? What next for Patriots - ESPN,Fire Bill Belichick? Bench Mac Jones? What next for Patriots - ESPN,Fire Bill Belichick ? Bench Mac Jones ? next Patriots - ESPN,other,Others
Jason McCourty: Kraft needs to hear these assurances from Belichick,Jason McCourty: Kraft needs to hear these assurances from Belichick,Jason McCourty : Kraft need hear assurance Belichick,other,Others
After Further Review: How Will the Patriots Approach the Quarterback Position Following the Bye Week?,After Further Review: How Will the Patriots Approach the Quarterback Position Following the Bye Week?,Further Review : Patriots approach Quarterback Position follow Bye Week ?,other,Others
"Film Room: The Good, the Bad, and the Ugly from Mac Jones’ Week 10 Collapse","Film Room: The Good, the Bad, and the Ugly from Mac Jones’ Week 10 Collapse","Film Room : Good , Bad , Ugly Mac Jones ' week 10 collapse",other,Others
Are players or coaches at fault for Pats' woes? Curran weighs in,Are players or coaches at fault for Pats' woes? Curran weighs in,player coach fault pat ' woe ? Curran weigh,other,Others
Dan Shaughnessy: Are Patriots fans being too rough on Mac Jones?,Dan Shaughnessy: Are Patriots fans being too rough on Mac Jones?,Dan Shaughnessy : patriot fan rough Mac Jones ?,other,Others
Callahan: Mac Jones has lost the locker room and 6 more Patriots thoughts at the bye,Callahan: Mac Jones has lost the locker room and 6 more Patriots thoughts at the bye,Callahan : Mac Jones lose locker room 6 patriot thought bye,other,Others
Mac Jones talks future as Patriots’ starting quarterback and more on WEEI,Mac Jones talks future as Patriots’ starting quarterback and more on WEEI,Mac Jones talk future Patriots ' start quarterback WEEI,other,Others
Mac Jones: 'We Haven't Talked About' Patriots' QB1 vs. Giants amid Bailey Zappe Buzz,Mac Jones: 'We Haven't Talked About' Patriots' QB1 vs. Giants amid Bailey Zappe Buzz,Mac Jones : ' talk ' patriot ' qb1 vs. Giants amid Bailey Zappe Buzz,other,Others
Patriots Rumors: Mac Jones Lost ‘Vast Majority’ Of Locker Room,Patriots Rumors: Mac Jones Lost ‘Vast Majority’ Of Locker Room,Patriots rumor : Mac Jones lose ' vast majority ' Locker Room,other,Others
Patriots QB Mac Jones takes first reps with starting offense at practice,Patriots QB Mac Jones takes first reps with starting offense at practice,patriot QB Mac Jones take first rep start offense practice,other,Others
The Mac Jones era in New England is over as Patriots fall to Colts in Germany,The Mac Jones era in New England is over as Patriots fall to Colts in Germany,Mac Jones era New England Patriots fall Colts Germany,other,Others
Back to Mac? Ex Patriots Star Bold Prediction of New England QB Decision,Back to Mac? Ex Patriots Star Bold Prediction of New England QB Decision,back Mac ? Ex Patriots Star Bold Prediction New England QB decision,other,Others
"Patriots' practice offers glimpse into quarterback rotation, players returning","Patriots' practice offers glimpse into quarterback rotation, players returning","patriot ' practice offer glimpse quarterback rotation , player return",other,Others
Mac Jones doesn't know whether he will start in Week 12,Mac Jones doesn't know whether he will start in Week 12,Mac Jones know whether start Week 12,other,Others
Mac Jones Doesn't Know Whether He Will Start In Week 12,Mac Jones Doesn't Know Whether He Will Start In Week 12,Mac Jones know whether start Week 12,other,Others
Bill O'Brien seen screaming at Mac Jones on sideline during Patriots' game in Germany,Bill O'Brien seen screaming at Mac Jones on sideline during Patriots' game in Germany,Bill O'Brien see scream Mac Jones sideline Patriots ' game Germany,other,Others
Bill Belichick update on Patriots QB situation after benching Mac Jones is about what you'd expect,Bill Belichick update on Patriots QB situation after benching Mac Jones is about what you'd expect,Bill Belichick update Patriots QB situation bench Mac Jones would expect,other,Others
Mac Jones Got Benched After Awful 4th Quarter Interception,Mac Jones Got Benched After Awful 4th Quarter Interception,Mac Jones got bench awful 4th Quarter Interception,other,Others
“Joker just knows”: How Nikola Jokic and the Nuggets held off the Clippers,“Joker just knows”: How Nikola Jokic and the Nuggets held off the Clippers,""" Joker know "" : Nikola Jokic Nuggets hold clipper",other,Others
Panthers HC Frank Reich taking back play-calling duties after giving them to OC Thomas Brown,Panthers HC Frank Reich taking back play-calling duties after giving them to OC Thomas Brown,panther HC Frank Reich take back play - call duty give OC Thomas Brown,other,Others
QB Bryce Young gets old new play-caller in Carolina,QB Bryce Young gets old new play-caller in Carolina,QB Bryce Young get old new play - caller Carolina,other,Others
Panthers coach Frank Reich announces decision to take over play-calling from OC Thomas Brown,Panthers coach Frank Reich announces decision to take over play-calling from OC Thomas Brown,panther coach Frank Reich announce decision take play - calling OC Thomas Brown,other,Others
Frank Reich will call offensive plays for Panthers,Frank Reich will call offensive plays for Panthers,Frank Reich call offensive play panther,other,Others
Should the Carolina Panthers Fire Frank Reich?,Should the Carolina Panthers Fire Frank Reich?,Carolina Panthers Fire Frank Reich ?,other,Others
A Hypothetical Question - Carolina Panthers,A Hypothetical Question - Carolina Panthers,Hypothetical Question - Carolina Panthers,other,Others
Panthers head coach Frank Reich takes back playcalling duties - ESPN,Panthers head coach Frank Reich takes back playcalling duties - ESPN,panther head coach Frank Reich take back playcalle duty - ESPN,other,Others
Another Panthers coaching change could happen much sooner than you think,Another Panthers coaching change could happen much sooner than you think,another panther coaching change could happen much soon think,other,Others
Notebook: Frank Reich to resume play-calling on offense,Notebook: Frank Reich to resume play-calling on offense,notebook : Frank Reich resume play - calling offense,other,Others
Three thoughts on Panthers: Reich retaking play-calling would be bad look for everyone,Three thoughts on Panthers: Reich retaking play-calling would be bad look for everyone,three thought panther : reich retake play - calling would bad look everyone,other,Others
NFL Insider Believes Panthers Coach Frank Reich Job Could Be in Jeopardy,NFL Insider Believes Panthers Coach Frank Reich Job Could Be in Jeopardy,NFL Insider believe Panthers Coach Frank Reich Job could jeopardy,nfl,Football
Frank Reich makes desperate about-face with Panthers in NFL basement,Frank Reich makes desperate about-face with Panthers in NFL basement,Frank Reich make desperate - face panther NFL basement,nfl,Football
Cowboys at Panthers: Frank Reich to take over offensive play-calling duties,Cowboys at Panthers: Frank Reich to take over offensive play-calling duties,cowboy panther : Frank Reich take offensive play - call duty,other,Others
Panthers HC Frank Reich Reclaims Play-Calling Duties,Panthers HC Frank Reich Reclaims Play-Calling Duties,panther HC Frank Reich Reclaims Play - Calling duty,other,Others
Panthers' Frank Reich takes play-calling duties back from OC Thomas Brown after 1-8 start,Panthers' Frank Reich takes play-calling duties back from OC Thomas Brown after 1-8 start,panther ' Frank Reich take play - call duty back OC Thomas Brown 1 - 8 start,other,Others
Panthers coach Frank Reich suddenly retakes play-calling duties after team’s latest loss,Panthers coach Frank Reich suddenly retakes play-calling duties after team’s latest loss,panther coach Frank Reich suddenly retake play - call duty team ’s late loss,other,Others
Emma Hayes Knows What American Soccer Needs,Emma Hayes Knows What American Soccer Needs,Emma Hayes know american Soccer need,mma,Fighting
Cowboys 'keep hands around' Leighton Vander Esch following linebacker potential career-ending neck injury,Cowboys 'keep hands around' Leighton Vander Esch following linebacker potential career-ending neck injury,cowboy ' keep hand around ' Leighton Vander Esch follow linebacker potential career - end neck injury,other,Others
"The 49ers are back while C.J. Stroud and the Texans are here early. Plus, Texas A&M fires Jimbo Fisher","The 49ers are back while C.J. Stroud and the Texans are here early. Plus, Texas A&M fires Jimbo Fisher","49er back C.J. Stroud Texans early . plus , Texas A&M fire Jimbo Fisher",other,Others
"Jaguars embarrassed at home, lose 34-3 to San Francisco 49ers","Jaguars embarrassed at home, lose 34-3 to San Francisco 49ers","jaguar embarrassed home , lose 34 - 3 San Francisco 49er",other,Others
"49ers vs. Jaguars odds, line, spread: Proven model reveals NFL picks, predictions for Week 10, 2023","49ers vs. Jaguars odds, line, spread: Proven model reveals NFL picks, predictions for Week 10, 2023","49er vs. Jaguars odd , line , spread : prove model reveal NFL pick , prediction Week 10 , 2023",nfl,Football
"3 takeaways after 49ers demolish Jaguars, get back in win column","3 takeaways after 49ers demolish Jaguars, get back in win column","3 takeaway 49er demolish jaguar , get back win column",other,Others
"How to watch today San Francisco 49ers vs. Jacksonville Jaguars game: Livestream options, kickoff time, more","How to watch today San Francisco 49ers vs. Jacksonville Jaguars game: Livestream options, kickoff time, more","watch today San Francisco 49er vs. Jacksonville Jaguars game : Livestream option , kickoff time ,",other,Others
Jaguars embarrassed and humbled in a 34-3 loss to 49ers that ended a 5-game winning streak,Jaguars embarrassed and humbled in a 34-3 loss to 49ers that ended a 5-game winning streak,jaguar embarrassed humble 34 - 3 loss 49er end 5 - game win streak,other,Others
"NFL Week 10 Game Recap: San Francisco 49ers 34, Jacksonville Jaguars 3 | NFL News, Rankings and Statistics","NFL Week 10 Game Recap: San Francisco 49ers 34, Jacksonville Jaguars 3 | NFL News, Rankings and Statistics","NFL Week 10 Game recap : San Francisco 49er 34 , Jacksonville Jaguars 3 | NFL News , Rankings statistic",nfl,Football
3 Takeaways from 49ers' Week 10 Win vs. Jaguars,3 Takeaways from 49ers' Week 10 Win vs. Jaguars,3 takeaway 49er ' Week 10 Win vs. jaguar,other,Others
Locals in the NFL: Fred Warner pick helps 49ers snap 3-game skid,Locals in the NFL: Fred Warner pick helps 49ers snap 3-game skid,local NFL : Fred Warner pick help 49er snap 3 - game skid,nfl,Football
"Bye does 49ers well, as San Francisco travels and dominates contending Jaguars","Bye does 49ers well, as San Francisco travels and dominates contending Jaguars","Bye 49er well , San Francisco travel dominate contend jaguar",other,Others
49ers dominate Jaguars 34-3 to end a 3-game skid and look like Super Bowl contenders again,49ers dominate Jaguars 34-3 to end a 3-game skid and look like Super Bowl contenders again,49er dominate Jaguars 34 - 3 end 3 - game skid look like Super Bowl contender,super bowl,Football
"Sunday NFL Week 10 Picks: Washington at Seattle, 49ers at Jaguars, and more!","Sunday NFL Week 10 Picks: Washington at Seattle, 49ers at Jaguars, and more!","Sunday NFL Week 10 pick : Washington Seattle , 49er Jaguars , !",nfl,Football
Week 11 NFL Player Props: Travis Etienne Odds vs. the Titans,Week 11 NFL Player Props: Travis Etienne Odds vs. the Titans,week 11 NFL Player prop : Travis Etienne Odds vs. Titans,nfl,Football
"49ers end NFL skid with big win at Jacksonville, Cowboys humble Giants","49ers end NFL skid with big win at Jacksonville, Cowboys humble Giants","49er end NFL skid big win Jacksonville , Cowboys humble Giants",nfl,Football
NFL picks for Week 10 from Matt Youmans,NFL picks for Week 10 from Matt Youmans,NFL pick Week 10 Matt Youmans,nfl,Football
Police say no video found of alleged hit-and run accident involving 76ers’ Oubre; coach backs player,Police say no video found of alleged hit-and run accident involving 76ers’ Oubre; coach backs player,Police say video find allege hit - run accident involve 76er ' Oubre ; coach back player,other,Others
Kelly Oubre Jr. 'in good spirits' as he returns to 76ers' facility days after being struck by motor vehicle,Kelly Oubre Jr. 'in good spirits' as he returns to 76ers' facility days after being struck by motor vehicle,Kelly Oubre Jr. ' good spirit ' return 76er ' facility day strike motor vehicle,other,Others
Philadelphia police still searching for evidence in incident involving 76ers' Kelly Oubre Jr.,Philadelphia police still searching for evidence in incident involving 76ers' Kelly Oubre Jr.,Philadelphia police still search evidence incident involve 76er ' Kelly Oubre Jr.,other,Others
"NBA Star Kelly Oubre Jr. Struck by Vehicle, Hospitalized in Philadelphia","NBA Star Kelly Oubre Jr. Struck by Vehicle, Hospitalized in Philadelphia","NBA Star Kelly Oubre Jr. Struck Vehicle , hospitalize Philadelphia",nba,Basketball
Police say no video found of alleged hit-and run accident involving 76ers' Oubre; coach backs player,Police say no video found of alleged hit-and run accident involving 76ers' Oubre; coach backs player,Police say video find allege hit - run accident involve 76er ' Oubre ; coach back player,other,Others
Surveillance footage so far does not show alleged hit-and-run involving Kelly Oubre Jr.,Surveillance footage so far does not show alleged hit-and-run involving Kelly Oubre Jr.,surveillance footage far show alleged hit - - run involve Kelly Oubre Jr.,other,Others
Kelly Oubre Jr. hit-and-run: Fresh footage of player struggling to walk emerges,Kelly Oubre Jr. hit-and-run: Fresh footage of player struggling to walk emerges,Kelly Oubre Jr. hit - - run : fresh footage player struggle walk emerge,other,Others
Police say no video found of alleged hit-and run accident involving 76ers' Oubre; coach backs player,Police say no video found of alleged hit-and run accident involving 76ers' Oubre; coach backs player,Police say video find allege hit - run accident involve 76er ' Oubre ; coach back player,other,Others
There No Video Or Photographic Evidence Of Kelly Oubre Hit & Run Accident And The Conspiracy Theories Are ...,There No Video Or Photographic Evidence Of Kelly Oubre Hit & Run Accident And The Conspiracy Theories Are ...,Video Photographic Evidence Kelly Oubre Hit & Run Accident Conspiracy Theories ...,other,Others
76ers’ Kelly Oubre Jr. in stable condition after being struck by motor vehicle,76ers’ Kelly Oubre Jr. in stable condition after being struck by motor vehicle,76er ' Kelly Oubre Jr. stable condition strike motor vehicle,other,Others
"Kelly Oubre, Jr. on Sixers’ minds as they play on without him","Kelly Oubre, Jr. on Sixers’ minds as they play on without him","Kelly Oubre , Jr. sixer ’ mind play without",other,Others
"NBA guard hit by vehicle in Philadelphia, to miss ‘significant’ time","NBA guard hit by vehicle in Philadelphia, to miss ‘significant’ time","NBA guard hit vehicle Philadelphia , miss ' significant ' time",nba,Basketball
Sixers' Kelly Oubre briefly hospitalized after being struck by car as a pedestrian,Sixers' Kelly Oubre briefly hospitalized after being struck by car as a pedestrian,sixer ' Kelly Oubre briefly hospitalize strike car pedestrian,other,Others
76ers' Kelly Oubre Jr. has a broken rib after being struck by vehicle that fled the scene,76ers' Kelly Oubre Jr. has a broken rib after being struck by vehicle that fled the scene,76er ' Kelly Oubre Jr. broken rib strike vehicle flee scene,other,Others
Police say no video found of alleged hit-and run accident involving 76ers' Oubre; coach backs player,Police say no video found of alleged hit-and run accident involving 76ers' Oubre; coach backs player,Police say video find allege hit - run accident involve 76er ' Oubre ; coach back player,other,Others
"Sixers' Kelly Oubre Jr. struck by motor vehicle, expected to miss significant time with injuries","Sixers' Kelly Oubre Jr. struck by motor vehicle, expected to miss significant time with injuries","sixer ' Kelly Oubre Jr. strike motor vehicle , expect miss significant time injury",other,Others
"Ex-Suns F Kelly Oubre Jr. hit by vehicle, in stable condition","Ex-Suns F Kelly Oubre Jr. hit by vehicle, in stable condition","Ex - Suns F Kelly Oubre Jr. hit vehicle , stable condition",other,Others
76ers Star Kelly Oubre Jr. Struck By Car in Philadelphia Hit & Run,76ers Star Kelly Oubre Jr. Struck By Car in Philadelphia Hit & Run,76er Star Kelly Oubre Jr. Struck Car Philadelphia Hit & Run,other,Others
"Former Wizards forward Kelly Oubre Jr. hit by vehicle in Philly, to miss ‘significant’ time","Former Wizards forward Kelly Oubre Jr. hit by vehicle in Philly, to miss ‘significant’ time","former Wizards forward Kelly Oubre Jr. hit vehicle Philly , miss ' significant ' time",other,Others
"76ers' Kelly Oubre Jr. struck by motor vehicle, expected to miss significant time","76ers' Kelly Oubre Jr. struck by motor vehicle, expected to miss significant time","76er ' Kelly Oubre Jr. strike motor vehicle , expect miss significant time",other,Others
Kelly Oubre injury: Broken ribs for 76ers forward after being hit by car,Kelly Oubre injury: Broken ribs for 76ers forward after being hit by car,Kelly Oubre injury : broken rib 76er forward hit car,other,Others
Former KU wing Kelly Oubre Jr. of 76ers released from hospital after being hit by car,Former KU wing Kelly Oubre Jr. of 76ers released from hospital after being hit by car,former KU wing Kelly Oubre Jr. 76er release hospital hit car,other,Others
76ers' Kelly Oubre Jr. has a broken rib after being struck by vehicle that fled the scene,76ers' Kelly Oubre Jr. has a broken rib after being struck by vehicle that fled the scene,76er ' Kelly Oubre Jr. broken rib strike vehicle flee scene,other,Others
NBA player to miss ignificant' game time after being hurt in hit-and-run incident,NBA player to miss ignificant' game time after being hurt in hit-and-run incident,NBA player miss ignificant ' game time hurt hit - - run incident,nba,Basketball
New details emerge regarding Sixers' Kelly Oubre Jr. condition after being struck by car,New details emerge regarding Sixers' Kelly Oubre Jr. condition after being struck by car,new detail emerge regard sixer ' Kelly Oubre Jr. condition strike car,other,Others
"Former Charlotte Hornets star Kelly Oubre Jr. hit by vehicle, to miss ‘significant’ time","Former Charlotte Hornets star Kelly Oubre Jr. hit by vehicle, to miss ‘significant’ time","former Charlotte Hornets star Kelly Oubre Jr. hit vehicle , miss ' significant ' time",other,Others
