title,title_english,processed_title,League Name,category
Falcons’ skid at three games with latest close loss as Cardinals win,Falcons’ skid at three games with latest close loss as Cardinals win,falcon ’ skid three game late close loss cardinal win,other,Others
Kyler Murray return ignites spark amongst Cardinals roster,Kyler Murray return ignites spark amongst Cardinals roster,Kyler Murray return ignite spark amongst Cardinals roster,other,Others
Cardinals' Kyler Murray leads winning drive in return,Cardinals' Kyler Murray leads winning drive in return,cardinal ' Kyler Murray lead win drive return,other,Others
"Kyler Murray takes first-team reps at Cardinals practice, in line to return from knee injury","Kyler Murray takes first-team reps at Cardinals practice, in line to return from knee injury","Kyler Murray take first - team rep Cardinals practice , line return knee injury",other,Others
3 Changes Atlanta Falcons head coach must make to save his job,3 Changes Atlanta Falcons head coach must make to save his job,3 change Atlanta Falcons head coach must make save job,other,Others
The Atlanta Falcons are failing to use their top weapons,The Atlanta Falcons are failing to use their top weapons,Atlanta Falcons fail use top weapon,other,Others
Falcons: Maybe Arthur Smith should start playing fantasy football,Falcons: Maybe Arthur Smith should start playing fantasy football,falcon : maybe Arthur Smith start play fantasy football,other,Others
Is Falcons head coach Arthur Smith on the hot seat?,Is Falcons head coach Arthur Smith on the hot seat?,falcon head coach Arthur Smith hot seat ?,other,Others
JMU men’s basketball breaks into AP Top 25 for first time,JMU men’s basketball breaks into AP Top 25 for first time,JMU man ’s basketball break AP Top 25 first time,other,Others
Four Big 12 Basketball Teams Ranked in Top 25 of Week 2 AP Poll,Four Big 12 Basketball Teams Ranked in Top 25 of Week 2 AP Poll,four big 12 basketball Teams Ranked Top 25 Week 2 AP Poll,other,Others
James Madison enters AP Top 25 for first time; Michigan State drops to No. 18,James Madison enters AP Top 25 for first time; Michigan State drops to No. 18,James Madison enter AP Top 25 first time ; Michigan State drop No . 18,other,Others
Vols Rise to No. 7/8 in National Polls - University of Tennessee Athletics,Vols Rise to No. 7/8 in National Polls - University of Tennessee Athletics,vol rise No . 7/8 National Polls - University Tennessee Athletics,other,Others
College Basketball Top 25: Tennessee climbs in latest polls,College Basketball Top 25: Tennessee climbs in latest polls,college Basketball Top 25 : Tennessee climb late poll,other,Others
MSU Men Basketball falls to No. 18 in week two AP Poll rankings,MSU Men Basketball falls to No. 18 in week two AP Poll rankings,MSU Men Basketball fall No . 18 week two AP Poll ranking,other,Others
James Madison gains first AP men basketball poll ranking in school history,James Madison gains first AP men basketball poll ranking in school history,James Madison gain first AP man basketball poll rank school history,other,Others
"Men college basketball Power Rankings: Arizona, mid-majors shine as Duke, Michigan State fall - ESPN","Men college basketball Power Rankings: Arizona, mid-majors shine as Duke, Michigan State fall - ESPN","man college basketball power Rankings : Arizona , mid - major shine Duke , Michigan State fall - ESPN",other,Others
"Arizona jumps 9 spots after taking down Duke while James Madison, Colorado make AP Top 25 rankings","Arizona jumps 9 spots after taking down Duke while James Madison, Colorado make AP Top 25 rankings","Arizona jump 9 spot take Duke James Madison , Colorado make AP Top 25 ranking",other,Others
"AP Top 25 college basketball poll: Arizona, James Madison ranked","AP Top 25 college basketball poll: Arizona, James Madison ranked","AP Top 25 college basketball poll : Arizona , James Madison rank",other,Others
College basketball rankings: Michigan State plummets in Coaches Poll after losing to James Madison,College basketball rankings: Michigan State plummets in Coaches Poll after losing to James Madison,college basketball ranking : Michigan State plummet Coaches Poll lose James Madison,other,Others
Football: Harbaugh suspended for remainder of regular season,Football: Harbaugh suspended for remainder of regular season,football : Harbaugh suspend remainder regular season,other,Others
Coach Jim Harbaugh Banned From 3 Games Over Sign-Stealing Allegations. Michigan Asks Judge For Stay.,Coach Jim Harbaugh Banned From 3 Games Over Sign-Stealing Allegations. Michigan Asks Judge For Stay.,Coach Jim Harbaugh ban 3 game Sign - Stealing Allegations . Michigan ask Judge Stay .,other,Others
PL: Haaland hits brace as Manchester City-Chelsea play pulsating 4-4 draw at Stamford Bridge,PL: Haaland hits brace as Manchester City-Chelsea play pulsating 4-4 draw at Stamford Bridge,PL : Haaland hit brace Manchester City - Chelsea play pulsate 4 - 4 draw Stamford Bridge,other,Others
Chelsea FC vs. Manchester City Arsenal Live Stream: How to Watch EPL in Canada,Chelsea FC vs. Manchester City Arsenal Live Stream: How to Watch EPL in Canada,Chelsea FC vs. Manchester City Arsenal Live Stream : watch EPL Canada,epl,Soccer
"Chelsea, Man City play to 4-4 thriller at the Bridge","Chelsea, Man City play to 4-4 thriller at the Bridge","Chelsea , Man City play 4 - 4 thriller Bridge",other,Others
Thoughts and analysis from dramatic weekend of Premier League action,Thoughts and analysis from dramatic weekend of Premier League action,thought analysis dramatic weekend Premier League action,premier league,Soccer
"Is Chelsea v Manchester City on TV? Channel, time and how to watch Premier League fixture","Is Chelsea v Manchester City on TV? Channel, time and how to watch Premier League fixture","Chelsea v Manchester City TV ? Channel , time watch Premier League fixture",premier league,Soccer
Watch: Thiago Silva equalizes for Chelsea against Manchester City | Premier League,Watch: Thiago Silva equalizes for Chelsea against Manchester City | Premier League,watch : Thiago Silva equalize Chelsea Manchester City | Premier League,premier league,Soccer
Premier League 2023-24: Chelsea 4-4 Manchester City - In Pics,Premier League 2023-24: Chelsea 4-4 Manchester City - In Pics,Premier League 2023 - 24 : Chelsea 4 - 4 Manchester City - pic,premier league,Soccer
Palmer grabs point for Chelsea in eight-goal epic against Man City,Palmer grabs point for Chelsea in eight-goal epic against Man City,palmer grab point Chelsea eight - goal epic Man City,other,Others
Chelsea gem Colwill out of action with shoulder injury,Chelsea gem Colwill out of action with shoulder injury,Chelsea gem colwill action shoulder injury,other,Others
Cole Palmer booked for scuffing penalty spot before Haaland goal but Chelsea fans rage ‘Garnacho got away w...,Cole Palmer booked for scuffing penalty spot before Haaland goal but Chelsea fans rage ‘Garnacho got away w...,Cole Palmer book scuff penalty spot Haaland goal Chelsea fan rage ' Garnacho get away w ...,other,Others
"FIRST-PLACE MANCHESTER CITY VISIT CHELSEA THIS SUNDAY, NOV. 12, AT 11:30 A.M. ET ON USA NETWORK AND TELEMUNDO","FIRST-PLACE MANCHESTER CITY VISIT CHELSEA THIS SUNDAY, NOV. 12, AT 11:30 A.M. ET ON USA NETWORK AND TELEMUNDO","first - PLACE MANCHESTER CITY VISIT CHELSEA SUNDAY , NOV . 12 , 11:30 A.M. ET ON USA NETWORK TELEMUNDO",other,Others
Man City boss Pep Guardiola makes Liverpool and Arsenal excuse after Chelsea draw,Man City boss Pep Guardiola makes Liverpool and Arsenal excuse after Chelsea draw,Man City boss Pep Guardiola make Liverpool Arsenal excuse Chelsea draw,other,Others
Chelsea Palmer comes back to haunt Man City in thrilling 4-4 draw,Chelsea Palmer comes back to haunt Man City in thrilling 4-4 draw,Chelsea Palmer come back haunt Man City thrill 4 - 4 draw,other,Others
Rodri hails Man City positive mentality in 4-4 draw with Chelsea,Rodri hails Man City positive mentality in 4-4 draw with Chelsea,Rodri hail Man City positive mentality 4 - 4 draw Chelsea,other,Others
Mudryk or Sterling: Chelsea Predicted Lineup vs Manchester City,Mudryk or Sterling: Chelsea Predicted Lineup vs Manchester City,Mudryk Sterling : Chelsea Predicted Lineup vs Manchester City,other,Others
Soccer-Chelsea take leap forward in 4-4 draw with Man City,Soccer-Chelsea take leap forward in 4-4 draw with Man City,Soccer - Chelsea take leap forward 4 - 4 draw Man City,other,Others
"Arthur Smith, Bijan Robinson: Broken logic for Falcons RB’s misuse","Arthur Smith, Bijan Robinson: Broken logic for Falcons RB’s misuse","Arthur Smith , Bijan Robinson : broken logic Falcons RB ’s misuse",other,Others
Falcons' Arthur Smith' savage response to Kurt Warner criticism,Falcons' Arthur Smith' savage response to Kurt Warner criticism,falcon ' Arthur Smith ' savage response Kurt Warner criticism,other,Others
Biden jokes about Las Vegas luring Eagles away from Philly: 'I’ll get divorced if that happens',Biden jokes about Las Vegas luring Eagles away from Philly: 'I’ll get divorced if that happens',Biden joke Las Vegas lure Eagles away Philly : ' I ’ll get divorce happen ',other,Others
"Video: In Latest Gaffe, Joe Biden Calls Vice President Kamala Harris ""President""","Video: In Latest Gaffe, Joe Biden Calls Vice President Kamala Harris ""President""","video : Latest Gaffe , Joe Biden call Vice President Kamala Harris "" President """,other,Others
Biden honors Stanley Cup champion Vegas Golden Knights in the return of an NHL tradition,Biden honors Stanley Cup champion Vegas Golden Knights in the return of an NHL tradition,Biden honor Stanley Cup champion Vegas Golden Knights return NHL tradition,nhl,nan
Vegas Golden Knights visit White House: Watch live as Stanley Cup champs meet Biden,Vegas Golden Knights visit White House: Watch live as Stanley Cup champs meet Biden,Vegas Golden Knights visit White House : watch live Stanley Cup champ meet Biden,stanley cup,Ice Hockey
WATCH: Biden again refers to VP as 'President Harris' during White House Stanley Cup celebration,WATCH: Biden again refers to VP as 'President Harris' during White House Stanley Cup celebration,WATCH : Biden refer VP ' President Harris ' White House Stanley Cup celebration,stanley cup,Ice Hockey
World Champion Vegas Golden Knights honored in White House celebration,World Champion Vegas Golden Knights honored in White House celebration,World Champion Vegas Golden Knights honor White House celebration,other,Others
"Golden Knights visit White House, President Biden to celebrate Stanley Cup championship","Golden Knights visit White House, President Biden to celebrate Stanley Cup championship","Golden Knights visit White House , President Biden celebrate Stanley Cup championship",stanley cup,Ice Hockey
Vegas Golden Knights gift President Biden a jersey and stick,,Vegas Golden Knights gift President Biden jersey stick,other,Others
President Biden Welcomes Las Vegas Golden Knights to White House,President Biden Welcomes Las Vegas Golden Knights to White House,President Biden Welcomes Las Vegas Golden Knights White House,other,Others
Biden again calls VP 'President Harris' at Stanley Cup celebration,Biden again calls VP 'President Harris' at Stanley Cup celebration,Biden call VP ' President Harris ' Stanley Cup celebration,stanley cup,Ice Hockey
President Joe Biden honors Stanley Cup champion Vegas Golden Knights,President Joe Biden honors Stanley Cup champion Vegas Golden Knights,President Joe Biden honor Stanley Cup champion Vegas Golden Knights,stanley cup,Ice Hockey
"Bruce Cassidy, Jack Eichel discuss Vegas Golden Knights' trip to White House","Bruce Cassidy, Jack Eichel discuss Vegas Golden Knights' trip to White House","Bruce Cassidy , Jack Eichel discuss Vegas Golden Knights ' trip White House",other,Others
"NHL-Hockey pressure no match for White House visit, says Vegas captain Stone","NHL-Hockey pressure no match for White House visit, says Vegas captain Stone","NHL - Hockey pressure match White House visit , say Vegas captain Stone",nhl,nan
"After celebrating Cup title, Golden Knights face hungry Capitals","After celebrating Cup title, Golden Knights face hungry Capitals","celebrate Cup title , Golden Knights face hungry capital",other,Others
LIVE | Biden celebrates the Vegas Golden Nights for their 2023 Stanley Cup win,LIVE | Biden celebrates the Vegas Golden Nights for their 2023 Stanley Cup win,LIVE | Biden celebrate Vegas Golden Nights 2023 Stanley Cup win,stanley cup,Ice Hockey
Graney: Knights’ day at White House had bipartisan feel,Graney: Knights’ day at White House had bipartisan feel,Graney : knight ' day White House bipartisan feel,other,Others
Biden hosts VGK at White House to celebrate Cup,Biden hosts VGK at White House to celebrate Cup,Biden host vgk White House celebrate Cup,other,Others
Takeaways from Michigan’s road win over St. John’s,Takeaways from Michigan’s road win over St. John’s,takeaway Michigan ’s road win St. John ’s,other,Others
"Matt LaFleur takeaways: Baffled by lateral, more from Christian Watson","Matt LaFleur takeaways: Baffled by lateral, more from Christian Watson","Matt LaFleur takeaway : baffle lateral , Christian Watson",afl,Cricket
Patriots shouldn't fire Bill Belichick with No. 1 draft pick in sight,Patriots shouldn't fire Bill Belichick with No. 1 draft pick in sight,patriot fire Bill Belichick No . 1 draft pick sight,other,Others
Dan Quinn addresses frustration from Micah Parsons,Dan Quinn addresses frustration from Micah Parsons,Dan Quinn address frustration Micah Parsons,other,Others
Golden Knights Make Champions Visit To White House,Golden Knights Make Champions Visit To White House,Golden Knights Make Champions Visit White House,other,Others
Biden honors Stanley Cup champion Vegas Golden Knights at White House,Biden honors Stanley Cup champion Vegas Golden Knights at White House,Biden honor Stanley Cup champion Vegas Golden Knights White House,stanley cup,Ice Hockey
Joe Biden welcomes NHL Stanley Cup winners Vegas Golden Knights to White House,Joe Biden welcomes NHL Stanley Cup winners Vegas Golden Knights to White House,Joe Biden welcome NHL Stanley Cup winner Vegas Golden Knights White House,nhl,nan
Biden Golden Knights Hockey | Us | lufkindailynews.com,Biden Golden Knights Hockey | Us | lufkindailynews.com,Biden Golden Knights Hockey | Us | lufkindailynews.com,other,Others
President Biden hosts Las Vegas Golden Knights at the White House,President Biden hosts Las Vegas Golden Knights at the White House,President Biden host Las Vegas Golden Knights White House,other,Others
White House honors Stanley Cup champs Vegas Golden Knights,White House honors Stanley Cup champs Vegas Golden Knights,White House honor Stanley Cup champ Vegas Golden Knights,stanley cup,Ice Hockey
Biden Golden Knights Hockey | US and World News | wvnews.com,Biden Golden Knights Hockey | US and World News | wvnews.com,Biden Golden Knights Hockey | US World News | wvnews.com,other,Others
Golden Knights visit White House to celebrate Stanley Cup championship,Golden Knights visit White House to celebrate Stanley Cup championship,Golden Knights visit White House celebrate Stanley Cup championship,stanley cup,Ice Hockey
Biden Golden Knights Hockey | National News | clintonherald.com,Biden Golden Knights Hockey | National News | clintonherald.com,Biden Golden Knights Hockey | National News | clintonherald.com,other,Others
NHL-MODULE-111423-FEATURE,NHL-MODULE-111423-FEATURE,NHL - module-111423 - feature,nhl,nan
"Joe Biden Latest 'Senile' Moment, Addresses VP Kamala Harris Incorrectly","Joe Biden Latest 'Senile' Moment, Addresses VP Kamala Harris Incorrectly","Joe Biden late ' Senile ' Moment , Addresses VP Kamala Harris incorrectly",other,Others
Michigan basketball guards have career nights in win at St. John,Michigan basketball guards have career nights in win at St. John,Michigan basketball guard career night win St. John,other,Others
"Michigan basketball ready to hit the road, take 'huge test' at Madison Square Garden","Michigan basketball ready to hit the road, take 'huge test' at Madison Square Garden","Michigan basketball ready hit road , take ' huge test ' Madison Square Garden",other,Others
Wolverines Big Apple Bound to Face St. John in Gavitt Games - University of Michigan Athletics,Wolverines Big Apple Bound to Face St. John in Gavitt Games - University of Michigan Athletics,wolverine Big Apple Bound face St. John Gavitt Games - University Michigan Athletics,other,Others
"How to watch Michigan vs. St. John’s (11/13): Live stream, TV channel, tipoff time","How to watch Michigan vs. St. John’s (11/13): Live stream, TV channel, tipoff time","watch Michigan vs. St. John ’s ( 11/13 ): live stream , tv channel , tipoff time",other,Others
Game 3: Michigan at St. John Open Thread,Game 3: Michigan at St. John Open Thread,game 3 : Michigan St. John Open Thread,other,Others
"Takeaways: Burnett shines, McDaniel dazzles as Michigan whacks St. John in New York","Takeaways: Burnett shines, McDaniel dazzles as Michigan whacks St. John in New York","takeaway : Burnett shine , McDaniel dazzle Michigan whack St. John New York",other,Others
Three takeaways: Michigan blitzes St. John at Madison Square Garden - Maize&BlueReview,Three takeaways: Michigan blitzes St. John at Madison Square Garden - Maize&BlueReview,three takeaway : Michigan blitz St. John Madison Square Garden - Maize&BlueReview,other,Others
"Michigan vs. St. John prediction, odds, line: 2023 college basketball picks, Nov. 13 bets by proven model","Michigan vs. St. John prediction, odds, line: 2023 college basketball picks, Nov. 13 bets by proven model","Michigan vs. St. John prediction , odd , line : 2023 college basketball pick , Nov. 13 bet proven model",other,Others
"Michigan vs. St. John line, picks: Advanced computer college basketball model releases selections for Monday matchup","Michigan vs. St. John line, picks: Advanced computer college basketball model releases selections for Monday matchup","Michigan vs. St. John line , pick : advanced computer college basketball model release selection Monday matchup",other,Others
"Burnett, McDaniel combine for nearly 50 points as Michigan topples St. John’s at Madison Square Garden","Burnett, McDaniel combine for nearly 50 points as Michigan topples St. John’s at Madison Square Garden","Burnett , McDaniel combine nearly 50 point Michigan topple St. John ’s Madison Square Garden",other,Others
"Michigan vs St. John Odds, Picks, & Predictions Tonight","Michigan vs St. John Odds, Picks, & Predictions Tonight","Michigan vs St. John Odds , Picks , & Predictions Tonight",other,Others
"Dug McDaniel, Nimari Burnett power Michigan past St. John",,"Dug McDaniel , Nimari Burnett power Michigan past St. John",other,Others
"St. John’s vs. Michigan: Preview, notes, prediction, odds","St. John’s vs. Michigan: Preview, notes, prediction, odds","St. John ’s vs. Michigan : Preview , note , prediction , odd",other,Others
2023 Gavitt Tipoff Games: Three takeaways from opening night,2023 Gavitt Tipoff Games: Three takeaways from opening night,2023 Gavitt Tipoff Games : three takeaway open night,other,Others
Steelers' Damontae Kazee game-sealing interception leads to fight with Packers players,Steelers' Damontae Kazee game-sealing interception leads to fight with Packers players,steeler ' Damontae Kazee game - seal interception lead fight Packers player,other,Others
Former top referee thinks NFL messed up review of pass in Packers vs. Steelers,Former top referee thinks NFL messed up review of pass in Packers vs. Steelers,former top referee think NFL mess review pass Packers vs. Steelers,nfl,Football
Pittsburgh Steelers Game Ends in Brawl With Packers,Pittsburgh Steelers Game Ends in Brawl With Packers,Pittsburgh Steelers Game Ends Brawl Packers,other,Others
Bucky Brooks: The Steelers Are '6-3 And It Probably One Of The Biggest Miracles That I've Seen',Bucky Brooks: The Steelers Are '6-3 And It Probably One Of The Biggest Miracles That I've Seen',Bucky Brooks : steeler ' 6 - 3 probably one big miracle I 've see ',other,Others
Mark Madden: The Steelers' 6-3 record disguises real problems that inevitably await,Mark Madden: The Steelers' 6-3 record disguises real problems that inevitably await,Mark Madden : Steelers ' 6 - 3 record disguise real problem inevitably await,other,Others
Steelers report card: Running game carries offense to win over Packers,Steelers report card: Running game carries offense to win over Packers,steeler report card : run game carry offense win packer,other,Others
"Steelers’ dormant run game has come alive (again), propelling win vs. Packers","Steelers’ dormant run game has come alive (again), propelling win vs. Packers","steeler ’ dormant run game come alive ( ) , propel win vs. Packers",other,Others
Lolley 10 Thoughts,Lolley 10 Thoughts,lolley 10 thought,other,Others
The Steelers Stink! They Might Be A Playoff Team!,The Steelers Stink! They Might Be A Playoff Team!,Steelers stink ! might Playoff Team !,other,Others
Key to the game: Steelers' steadiness neutralized Packers' explosive gains,Key to the game: Steelers' steadiness neutralized Packers' explosive gains,key game : steeler ' steadiness neutralize Packers ' explosive gain,other,Others
Varsity & JV: Winners & losers from the Steelers’ Week 10 win over the Packers,Varsity & JV: Winners & losers from the Steelers’ Week 10 win over the Packers,varsity & JV : winner & loser Steelers ' week 10 win Packers,other,Others
Packers Inactives vs. Steelers: Green Bay out 2 defensive starters,Packers Inactives vs. Steelers: Green Bay out 2 defensive starters,Packers inactive vs. steeler : Green Bay 2 defensive starter,other,Others
"Outgained and seemingly outclassed again, the Steelers just keep doing enough","Outgained and seemingly outclassed again, the Steelers just keep doing enough","outgained seemingly outclassed , Steelers keep enough",other,Others
Make the Call: Kenny Pickett Pass vs. Packers Was Backward,Make the Call: Kenny Pickett Pass vs. Packers Was Backward,make call : Kenny Pickett Pass vs. Packers Backward,other,Others
"Watch Pittsburgh Steelers vs. Green Bay Packers: TV channel, live stream info, start time","Watch Pittsburgh Steelers vs. Green Bay Packers: TV channel, live stream info, start time","watch Pittsburgh Steelers vs. Green Bay Packers : tv channel , live stream info , start time",other,Others
Fire Bill Belichick? Bench Mac Jones? What next for Patriots - ESPN,Fire Bill Belichick? Bench Mac Jones? What next for Patriots - ESPN,Fire Bill Belichick ? Bench Mac Jones ? next Patriots - ESPN,other,Others
The Mac Jones era in New England is over as Patriots fall to Colts in Germany,The Mac Jones era in New England is over as Patriots fall to Colts in Germany,Mac Jones era New England Patriots fall Colts Germany,other,Others
Bill Belichick: We'll look at everything across the board,Bill Belichick: We'll look at everything across the board,Bill Belichick : look everything across board,other,Others
Bill Belichick on benching QB Mac Jones in loss to Colts: 'Thought it was time for a change',Bill Belichick on benching QB Mac Jones in loss to Colts: 'Thought it was time for a change',Bill Belichick bench QB Mac Jones loss colt : ' think time change ',other,Others
Bill Belichick gives assessment of Patriots’ backup quarterback options,Bill Belichick gives assessment of Patriots’ backup quarterback options,Bill Belichick give assessment patriot ’ backup quarterback option,other,Others
"Christian Fauria on Sports Final: ""You can't start Mac Jones anymore""","Christian Fauria on Sports Final: ""You can't start Mac Jones anymore""","Christian Fauria Sports Final : "" start Mac Jones anymore """,other,Others
Callahan: It’s time for the Mac Jones era to end in New England,Callahan: It’s time for the Mac Jones era to end in New England,Callahan : ’ time Mac Jones era end New England,other,Others
Scott Zolak: I wouldn't assume Mac Jones is going to start again,Scott Zolak: I wouldn't assume Mac Jones is going to start again,Scott Zolak : I would assume Mac Jones go start,other,Others
Colin Cowherd Shares Concerning Report About ‘Bratty’ Mac Jones,Colin Cowherd Shares Concerning Report About ‘Bratty’ Mac Jones,Colin Cowherd Shares concern Report ' Bratty ' Mac Jones,other,Others
"Patriots do not believe in Mac Jones, and they made that clear by benching him with the game on the line","Patriots do not believe in Mac Jones, and they made that clear by benching him with the game on the line","patriot believe Mac Jones , make clear bench game line",other,Others
Mac Jones Seemed to Call Out Patriots Coaches Over Questionable Decision,Mac Jones Seemed to Call Out Patriots Coaches Over Questionable Decision,Mac Jones seem call Patriots Coaches questionable decision,other,Others
Patriots-Colts takeaways: Disastrous QB play costs Pats in ugly loss,Patriots-Colts takeaways: Disastrous QB play costs Pats in ugly loss,patriot - Colts takeaway : disastrous QB play cost pat ugly loss,other,Others
Poll: Who is to blame for the Patriots' struggles?,Poll: Who is to blame for the Patriots' struggles?,poll : blame Patriots ' struggle ?,other,Others
"Mac Jones: ‘Right now, everybody’s counting him out’","Mac Jones: ‘Right now, everybody’s counting him out’","Mac Jones : ' right , everybody ’s count '",other,Others
"Patriots' Mac Jones Slammed by NFL Fans, Benched for Bailey Zappe in Loss to Colts","Patriots' Mac Jones Slammed by NFL Fans, Benched for Bailey Zappe in Loss to Colts","patriot ' Mac Jones Slammed NFL Fans , bench Bailey Zappe Loss Colts",nfl,Football
