title,title_english,processed_title,League Name,category
Even Nick Kyrgios Thought Rublev On-Court Outburst Was a Bit Over the Top,Even Nick Kyrgios Thought Rublev On-Court Outburst Was a Bit Over the Top,even Nick Kyrgios Thought Rublev On - Court Outburst bit top,other,Others
Russian tennis star Andrey Rublev furiously slams his racquet into his knee SIX TIMES during a meltdown in Tur,Russian tennis star Andrey Rublev furiously slams his racquet into his knee SIX TIMES during a meltdown in Tur,russian tennis star Andrey Rublev furiously slam racquet knee six TIMES meltdown Tur,other,Others
"Wednesday ATP Finals Predictions | Alcaraz vs Rublev, Medvedev vs Zverev (November 15)",,"Wednesday ATP Finals Predictions | Alcaraz vs Rublev , Medvedev vs Zverev ( November 15 )",other,Others
Furious Andrey Rublev left bloodied after smashing his racquet into his knee during ATP Finals loss to Carlos Alcaraz,Furious Andrey Rublev left bloodied after smashing his racquet into his knee during ATP Finals loss to Carlos Alcaraz,Furious Andrey Rublev leave bloody smash racquet knee ATP Finals loss Carlos Alcaraz,other,Others
ATP Finals Singles Results | Associated Press | wfmz.com,ATP Finals Singles Results | Associated Press | wfmz.com,ATP Finals Singles result | Associated Press | wfmz.com,other,Others
Sports Digest: Rublev bloodies himself with racket in frustration during loss to Alcaraz,Sports Digest: Rublev bloodies himself with racket in frustration during loss to Alcaraz,sport Digest : Rublev bloody racket frustration loss Alcaraz,other,Others
Tennis star Andrey Rublev cuts leg open after furiously smacking racket against himself SIX times...,Tennis star Andrey Rublev cuts leg open after furiously smacking racket against himself SIX times...,tennis star Andrey Rublev cut leg open furiously smacking racket six time ...,other,Others
Italy Tennis ATP Finals (copy) | National | hpenews.com,Italy Tennis ATP Finals (copy) | National | hpenews.com,Italy Tennis ATP Finals ( copy ) | National | hpenews.com,other,Others
Debutant Alcaraz Wins His Maiden ATP Finals Match Beating Rublev,Debutant Alcaraz Wins His Maiden ATP Finals Match Beating Rublev,Debutant Alcaraz win Maiden ATP Finals Match Beating Rublev,other,Others
Andrey Rublev bloodies himself with racket in ATP Finals meltdown,Andrey Rublev bloodies himself with racket in ATP Finals meltdown,Andrey Rublev bloody racket ATP Finals meltdown,other,Others
Carlos Alcaraz returns to the Masters with a convincing win over Rublev,Carlos Alcaraz returns to the Masters with a convincing win over Rublev,Carlos Alcaraz return Masters convincing win Rublev,other,Others
"Alcaraz convincingly defeated Rublev, securing his victory in the inaugural match of the ATP Finals","Alcaraz convincingly defeated Rublev, securing his victory in the inaugural match of the ATP Finals","Alcaraz convincingly defeat Rublev , secure victory inaugural match ATP Finals",other,Others
Andrey Rublev furiously smashes himself with tennis racquet six times in bloody meltdown,Andrey Rublev furiously smashes himself with tennis racquet six times in bloody meltdown,Andrey Rublev furiously smash tennis racquet six time bloody meltdown,other,Others
ATP Finals: Was ranting Andrey Rublev self-destructive in defeat to Carlos Alcaraz?,ATP Finals: Was ranting Andrey Rublev self-destructive in defeat to Carlos Alcaraz?,ATP final : rant Andrey Rublev self - destructive defeat Carlos Alcaraz ?,other,Others
Carlos Alcaraz first ATP Finals win seals records Novak Djokovic and Roger Federer never had,Carlos Alcaraz first ATP Finals win seals records Novak Djokovic and Roger Federer never had,Carlos Alcaraz first ATP Finals win seal record Novak Djokovic Roger Federer never,other,Others
Where and how to watch Carlos Alcaraz vs Andrey Rublev ATP Finals 2023 live in India?,Where and how to watch Carlos Alcaraz vs Andrey Rublev ATP Finals 2023 live in India?,watch Carlos Alcaraz vs Andrey Rublev ATP Finals 2023 live India ?,other,Others
"Carlos Alcaraz back to brilliance, bashes Andrey Rublev at ATP Finals","Carlos Alcaraz back to brilliance, bashes Andrey Rublev at ATP Finals","Carlos Alcaraz back brilliance , bash Andrey Rublev ATP final",other,Others
First Blood: Alcaraz Knocks Rublev Out at ATP Finals,First Blood: Alcaraz Knocks Rublev Out at ATP Finals,first blood : Alcaraz Knocks Rublev Out ATP final,other,Others
Alcaraz still ‘alive’ in the ATP Finals after defeating Rublev,Alcaraz still ‘alive’ in the ATP Finals after defeating Rublev,alcaraz still ' alive ' ATP Finals defeat Rublev,other,Others
ATP Finals: Carlos Alcaraz snaps three-match losing streak after beating Andrey Rublev,ATP Finals: Carlos Alcaraz snaps three-match losing streak after beating Andrey Rublev,ATP final : Carlos Alcaraz snap three - match lose streak beat Andrey Rublev,other,Others
ATP World Tour Finals: Carlos Alcaraz beats troubled Andrey Rublev to keep hopes alive,ATP World Tour Finals: Carlos Alcaraz beats troubled Andrey Rublev to keep hopes alive,ATP World Tour Finals : Carlos Alcaraz beat trouble Andrey Rublev keep hope alive,other,Others
Nitto ATP Finals tennis pick and prediction: Alcaraz vs. Rublev,Nitto ATP Finals tennis pick and prediction: Alcaraz vs. Rublev,Nitto ATP Finals tennis pick prediction : Alcaraz vs. Rublev,other,Others
Alcaraz beats Rublev at ATP Finals in Turin,Alcaraz beats Rublev at ATP Finals in Turin,alcaraz beat Rublev ATP Finals Turin,other,Others
Rublev bloodies himself with his racket in frustration during loss to Alcaraz at ATP Finals,Rublev bloodies himself with his racket in frustration during loss to Alcaraz at ATP Finals,Rublev bloody racket frustration loss Alcaraz ATP final,other,Others
Tennis-Alcaraz eases to win as ranting Rublev self-destructs,Tennis-Alcaraz eases to win as ranting Rublev self-destructs,Tennis - Alcaraz ease win rant Rublev self - destruct,other,Others
Rublev bloodies himself with racket during loss to Alcaraz at ATP Finals. Medvedev advances,Rublev bloodies himself with racket during loss to Alcaraz at ATP Finals. Medvedev advances,Rublev bloody racket loss Alcaraz ATP Finals . Medvedev advance,other,Others
Rublev bloodies himself with racket during loss to Alcaraz at ATP Finals. Medvedev advances,Rublev bloodies himself with racket during loss to Alcaraz at ATP Finals. Medvedev advances,Rublev bloody racket loss Alcaraz ATP Finals . Medvedev advance,other,Others
Carlos Alcaraz up and running at ATP Finals after powering past troubled Andrey Rublev,Carlos Alcaraz up and running at ATP Finals after powering past troubled Andrey Rublev,Carlos Alcaraz run ATP Finals power past troubled Andrey Rublev,other,Others
Carlos Alcaraz breaks Andrey Rublev soul in securing first ATP Finals win,Carlos Alcaraz breaks Andrey Rublev soul in securing first ATP Finals win,Carlos Alcaraz break Andrey Rublev soul secure first ATP Finals win,other,Others
Coach Vicente Breaks Down Rublev vs. Alcaraz Battle,Coach Vicente Breaks Down Rublev vs. Alcaraz Battle,Coach Vicente break Rublev vs. Alcaraz Battle,other,Others
Hot Shot: 'A Stunner!' Alcaraz Powers Backhand From Out Wide In Turin | Video Search Results,,hot Shot : ' A Stunner ! ' Alcaraz Powers Backhand Out wide Turin | Video Search result,other,Others
Carlos Alcaraz hits 'different level' to see off struggling Andrey Rublev in straight sets of ATP Finals clash,Carlos Alcaraz hits 'different level' to see off struggling Andrey Rublev in straight sets of ATP Finals clash,Carlos Alcaraz hit ' different level ' see struggle Andrey Rublev straight set ATP Finals clash,other,Others
Carlos Alcaraz Defeats Andrey Rublev At Nitto ATP Finals,Carlos Alcaraz Defeats Andrey Rublev At Nitto ATP Finals,Carlos Alcaraz Defeats Andrey Rublev Nitto ATP final,other,Others
Highlights: Alcaraz Earns Maiden Nitto ATP Finals Victory | Video Search Results,Highlights: Alcaraz Earns Maiden Nitto ATP Finals Victory | Video Search Results,highlight : Alcaraz earn Maiden Nitto ATP Finals Victory | Video Search result,other,Others
Hot Shot: Alcaraz Opens Up Rublev In Turin With Backhand | Video Search Results,Hot Shot: Alcaraz Opens Up Rublev In Turin With Backhand | Video Search Results,hot Shot : Alcaraz open Rublev Turin Backhand | Video Search result,other,Others
Rublev bloodies himself with his racket in frustration during loss to Alcaraz at ATP Finals,Rublev bloodies himself with his racket in frustration during loss to Alcaraz at ATP Finals,Rublev bloody racket frustration loss Alcaraz ATP final,other,Others
ATP Finals: Carlos Alcaraz eases to win as ranting Andrey Rublev self-destructs while Daniil Medvedev reaches final four,ATP Finals: Carlos Alcaraz eases to win as ranting Andrey Rublev self-destructs while Daniil Medvedev reaches final four,ATP final : Carlos Alcaraz ease win rant Andrey Rublev self - destruct Daniil Medvedev reach final four,other,Others
Tennis great says Andrey Rublev needs help after violent meltdown against Carlos Alcaraz,Tennis great says Andrey Rublev needs help after violent meltdown against Carlos Alcaraz,Tennis great say Andrey Rublev need help violent meltdown Carlos Alcaraz,other,Others
Alcaraz eases to win as ranting Rublev self-destructs,Alcaraz eases to win as ranting Rublev self-destructs,alcaraz ease win rant Rublev self - destruct,other,Others
Russian Tennis Star Requires Medical Assistance After On-Court Meltdown,Russian Tennis Star Requires Medical Assistance After On-Court Meltdown,russian Tennis Star require Medical Assistance On - Court Meltdown,other,Others
"Texas A&M searching for next R.C. Slocum? Jeff Traylor, Mike Elko fit bill","Texas A&M searching for next R.C. Slocum? Jeff Traylor, Mike Elko fit bill","Texas A&M search next R.C. Slocum ? Jeff Traylor , Mike Elko fit bill",other,Others
Power 5 owes $146M in buyouts to fired football coaches since '22 - ESPN,Power 5 owes $146M in buyouts to fired football coaches since '22 - ESPN,power 5 owe $ 146 M buyout fire football coach since ' 22 - ESPN,other,Others
Mandel’s Mailbag: Is Texas A&M an elite college football job? What’s next for Boise State?,Mandel’s Mailbag: Is Texas A&M an elite college football job? What’s next for Boise State?,Mandel ’s Mailbag : Texas A&M elite college football job ? ’ next Boise State ?,other,Others
"Texas A&M fires Jimbo Fisher: Ill-advised extension, notable losses among moments that led to coach downfall","Texas A&M fires Jimbo Fisher: Ill-advised extension, notable losses among moments that led to coach downfall","Texas A&M fire Jimbo Fisher : Ill - advise extension , notable loss among moment lead coach downfall",other,Others
'Primetime' to Texas A&M? That what Deion Sanders was asked about at a news conference Tuesday,'Primetime' to Texas A&M? That what Deion Sanders was asked about at a news conference Tuesday,' Primetime ' Texas A&M ? Deion Sanders ask news conference Tuesday,other,Others
3 Best and 3 Worst Ideas for Next Texas A&M Football Coach,3 Best and 3 Worst Ideas for Next Texas A&M Football Coach,3 good 3 bad Ideas Next Texas A&M Football Coach,other,Others
What Else Could Texas A&M Afford With Jimbo Fisher Buyout Money?,What Else Could Texas A&M Afford With Jimbo Fisher Buyout Money?,Else could Texas A&M Afford Jimbo Fisher Buyout Money ?,other,Others
Cessna column: Texas A&M makes the right move in firing Fisher,Cessna column: Texas A&M makes the right move in firing Fisher,cessna column : Texas A&M make right move fire Fisher,other,Others
Jimbo Fisher $77 million golden parachute is just absurd.,Jimbo Fisher $77 million golden parachute is just absurd.,Jimbo Fisher $ 77 million golden parachute absurd .,other,Others
Here why Ole Miss' Lane Kiffin is the coach Texas A&M needs,Here why Ole Miss' Lane Kiffin is the coach Texas A&M needs,Ole Miss ' Lane Kiffin coach Texas A&M need,other,Others
Johnny Manziel Offers to Help Texas A&M In 'Any Capacity' After Jimbo Fisher Firing,Johnny Manziel Offers to Help Texas A&M In 'Any Capacity' After Jimbo Fisher Firing,Johnny Manziel Offers help Texas A&M ' capacity ' Jimbo Fisher fire,other,Others
Texas A&M firing Jimbo Fisher has college football carousel spinning,Texas A&M firing Jimbo Fisher has college football carousel spinning,Texas A&M fire Jimbo Fisher college football carousel spinning,other,Others
Texas A&M coaching search: Paul Finebaum names 'best choice' for Aggies after Jimbo Fisher,Texas A&M coaching search: Paul Finebaum names 'best choice' for Aggies after Jimbo Fisher,Texas A&M coach search : Paul Finebaum name ' good choice ' aggie Jimbo Fisher,other,Others
Louisville Recruiting Could Benefit From Jimbo Fisher Firing,Louisville Recruiting Could Benefit From Jimbo Fisher Firing,Louisville Recruiting could benefit Jimbo Fisher firing,other,Others
Steve Sarkisian explains why he didn’t like the timing of Jimbo Fisher’s termination,Steve Sarkisian explains why he didn’t like the timing of Jimbo Fisher’s termination,Steve Sarkisian explain like timing Jimbo Fisher ’s termination,other,Others
Time won’t heal the self-inflicted wounds to Jimbo Fisher’s legacy the same way it did for Bobby Bowden,Time won’t heal the self-inflicted wounds to Jimbo Fisher’s legacy the same way it did for Bobby Bowden,time heal self - inflict wound Jimbo Fisher ’s legacy way Bobby Bowden,nfl,Football
Texas A&M just showed us that schools have the money to pay student-athletes,Texas A&M just showed us that schools have the money to pay student-athletes,Texas A&M show school money pay student - athlete,other,Others
Texas A&M top coaching candidates: Who will replace Jimbo Fisher?,Texas A&M top coaching candidates: Who will replace Jimbo Fisher?,Texas A&M top coach candidate : replace Jimbo Fisher ?,epl,Soccer
Three Names 'Crossed Off The List' For Texas A&M Head Coach Vacancy,Three Names 'Crossed Off The List' For Texas A&M Head Coach Vacancy,three Names ' cross list ' Texas A&M Head Coach vacancy,other,Others
A look at one wild stat regarding Jimbo Fisher obscene buyout,A look at one wild stat regarding Jimbo Fisher obscene buyout,look one wild stat regard Jimbo Fisher obscene buyout,other,Others
Top 10 biggest coach buyouts in college football history,Top 10 biggest coach buyouts in college football history,top 10 big coach buyout college football history,other,Others
College football coaching vacancies: The carousel is heating up,College football coaching vacancies: The carousel is heating up,college football coaching vacancy : carousel heat,other,Others
This SEC school is a reason why Texas A&M & Baylor are in a coaching contract crisis,This SEC school is a reason why Texas A&M & Baylor are in a coaching contract crisis,SEC school reason Texas A&M & Baylor coach contract crisis,other,Others
SEC Shorts: 2018 Texas A&M discovers what the future holds,SEC Shorts: 2018 Texas A&M discovers what the future holds,SEC short : 2018 Texas A&M discover future hold,other,Others
Alabama’s Nick Saban reacts to firings of Jimbo Fisher and Zach Arnett,Alabama’s Nick Saban reacts to firings of Jimbo Fisher and Zach Arnett,Alabama ’s Nick Saban react firing Jimbo Fisher Zach Arnett,other,Others
"With a good sense of timing, Texas A&M WR Raymond Cottrell is drawing big interest in transfer portal","With a good sense of timing, Texas A&M WR Raymond Cottrell is drawing big interest in transfer portal","good sense timing , Texas A&M WR Raymond Cottrell draw big interest transfer portal",other,Others
"When it comes to football coaches, the SEC just means more impatience. 2 coaches fired already","When it comes to football coaches, the SEC just means more impatience. 2 coaches fired already","come football coach , SEC mean impatience . 2 coach fire already",other,Others
"Next Texas A&M coach odds: Jeff Traylor, Mike Elko, Kalen DeBoer favored; Deion Sanders, Urban Meyer longshots to ...","Next Texas A&M coach odds: Jeff Traylor, Mike Elko, Kalen DeBoer favored; Deion Sanders, Urban Meyer longshots to ...","Next Texas A&M coach odd : Jeff Traylor , Mike Elko , Kalen DeBoer favor ; Deion Sanders , Urban Meyer longshot ...",other,Others
Why Texas A&M football should pursue Dan Lanning or Jim Harbaugh instead of Lane Kiffin,Why Texas A&M football should pursue Dan Lanning or Jim Harbaugh instead of Lane Kiffin,Texas A&M football pursue Dan Lanning Jim Harbaugh instead Lane Kiffin,other,Others
A college football coach gets $77m not to work as US education suffers,A college football coach gets $77m not to work as US education suffers,college football coach get $ 77 work US education suffer,other,Others
"Crazy season already insane, witness Texas A&M, Miss. State","Crazy season already insane, witness Texas A&M, Miss. State","crazy season already insane , witness Texas A&M , Miss. State",other,Others
Top Texas A&M coaching candidates as search begins to replace Jimbo Fisher,Top Texas A&M coaching candidates as search begins to replace Jimbo Fisher,Top Texas A&M coach candidate search begin replace Jimbo Fisher,epl,Soccer
5 college football programs desperate enough to hire Jimbo Fisher,5 college football programs desperate enough to hire Jimbo Fisher,5 college football program desperate enough hire Jimbo Fisher,other,Others
Jimbo Fisher Firing Comes at the Perfect Time for Florida State,Jimbo Fisher Firing Comes at the Perfect Time for Florida State,Jimbo Fisher firing come Perfect Time Florida State,other,Others
Report: Texas A&M set to part ways with Jimbo Fisher 'as early as today',Report: Texas A&M set to part ways with Jimbo Fisher 'as early as today',report : Texas A&M set part way Jimbo Fisher ' early today ',other,Others
Lane Kiffin addresses Texas A&M opening - Footballscoop,Lane Kiffin addresses Texas A&M opening - Footballscoop,Lane Kiffin address Texas A&M opening - footballscoop,other,Others
Tuesdays with Gorney: It time for Texas A&M to tap into its potential,Tuesdays with Gorney: It time for Texas A&M to tap into its potential,tuesday Gorney : time Texas A&M tap potential,other,Others
Could Tennessee football benefit from Texas A&M firing Jimbo Fisher in transfer portal?,Could Tennessee football benefit from Texas A&M firing Jimbo Fisher in transfer portal?,could Tennessee football benefit Texas A&M fire Jimbo Fisher transfer portal ?,other,Others
Spitballing potential Texas A&M Aggies head coaching candidates,Spitballing potential Texas A&M Aggies head coaching candidates,spitballe potential Texas A&M Aggies head coach candidate,other,Others
"Brice Cherry: Ruminating on Jimbo big buyout, runs through bluebonnets, and old guy athletes","Brice Cherry: Ruminating on Jimbo big buyout, runs through bluebonnets, and old guy athletes","Brice Cherry : ruminate jimbo big buyout , run bluebonnet , old guy athlete",other,Others
Eight Coaching Candidates Poised to Be Texas A&M Next Head Coach,Eight Coaching Candidates Poised to Be Texas A&M Next Head Coach,eight coaching Candidates poise Texas A&M Next Head Coach,other,Others
What Texas A&M firing Jimbo Fisher means for Georgia football,What Texas A&M firing Jimbo Fisher means for Georgia football,Texas A&M fire Jimbo Fisher mean Georgia football,other,Others
"4 thoughts on Jimbo Fisher firing, including Mike Norvell FSU future","4 thoughts on Jimbo Fisher firing, including Mike Norvell FSU future","4 thought Jimbo Fisher firing , include Mike Norvell FSU future",other,Others
"Texas A&M head coach Jimbo Fisher expected to be fired and owed $76 million, ESPN sources confirm","Texas A&M head coach Jimbo Fisher expected to be fired and owed $76 million, ESPN sources confirm","Texas A&M head coach Jimbo Fisher expect fire owe $ 76 million , ESPN source confirm",other,Others
Texas A&M to spend more than $75 million to fire football coach Jimbo Fisher,Texas A&M to spend more than $75 million to fire football coach Jimbo Fisher,Texas A&M spend $ 75 million fire football coach Jimbo Fisher,other,Others
"Big buyouts for college coaches are the norm. If athletes start getting revenue, that could change","Big buyouts for college coaches are the norm. If athletes start getting revenue, that could change","big buyout college coach norm . athlete start get revenue , could change",other,Others
Jimbo Fisher to reportedly receive record $77 million buyout after being relieved of head football coach duties,Jimbo Fisher to reportedly receive record $77 million buyout after being relieved of head football coach duties,Jimbo Fisher reportedly receive record $ 77 million buyout relieve head football coach duty,other,Others
$76 million buyout is reportedly coming for Jimbo Fisher,$76 million buyout is reportedly coming for Jimbo Fisher,$ 76 million buyout reportedly come Jimbo Fisher,other,Others
"Texas A&M fires coach Jimbo Fisher, a move that will cost the school $75M","Texas A&M fires coach Jimbo Fisher, a move that will cost the school $75M","Texas A&M fire coach Jimbo Fisher , move cost school $ 75",other,Others
CFB Coaching Buyouts Reach New Level With Jimbo Fisher Firing,CFB Coaching Buyouts Reach New Level With Jimbo Fisher Firing,CFB Coaching buyout reach New Level Jimbo Fisher firing,other,Others
Reacting to Jimbo Fisher Firing by Texas A&M Football,Reacting to Jimbo Fisher Firing by Texas A&M Football,react Jimbo Fisher firing Texas A&M Football,other,Others
Texas A&M has wild dream candidate for head coach job,Texas A&M has wild dream candidate for head coach job,Texas A&M wild dream candidate head coach job,other,Others
Burns: Texas A&M could be a contender in year one with the right hire,Burns: Texas A&M could be a contender in year one with the right hire,burn : Texas A&M could contender year one right hire,other,Others
Lane Kiffin in consideration for Texas A&M HC opening,Lane Kiffin in consideration for Texas A&M HC opening,Lane Kiffin consideration Texas A&M HC opening,other,Others
College football: Should No. 4 Washington be an underdog to host No. 13 Oregon State?,College football: Should No. 4 Washington be an underdog to host No. 13 Oregon State?,college football : No . 4 Washington underdog host No . 13 Oregon State ?,other,Others
Pac-12 championship game race winds down to 4 remaining contenders,Pac-12 championship game race winds down to 4 remaining contenders,Pac-12 championship game race wind 4 remain contender,other,Others
It won’t just be Oregon State’s defense looking to defend Washington quarterback Michael Penix Jr.,It won’t just be Oregon State’s defense looking to defend Washington quarterback Michael Penix Jr.,Oregon State ’s defense look defend Washington quarterback Michael Penix Jr.,other,Others
"Oregon State, Washington meet in monumental Pac-12 football game: Preview, predictions as Beavers eye chaos","Oregon State, Washington meet in monumental Pac-12 football game: Preview, predictions as Beavers eye chaos","Oregon State , Washington meet monumental Pac-12 football game : Preview , prediction Beavers eye chaos",other,Others
Everything DeBoer Said Ahead of Washington Matchup versus Oregon State in Corvallis.,Everything DeBoer Said Ahead of Washington Matchup versus Oregon State in Corvallis.,everything DeBoer say ahead Washington Matchup versus Oregon State Corvallis .,other,Others
Will Oregon State derail Washington CFP hopes?,Will Oregon State derail Washington CFP hopes?,Oregon State derail Washington CFP hope ?,other,Others
Kalen DeBoer on Oregon State motivation for Washington game: 'They're going to bring everything they've got',Kalen DeBoer on Oregon State motivation for Washington game: 'They're going to bring everything they've got',Kalen DeBoer Oregon State motivation Washington game : ' go bring everything 've get ',other,Others
"Washington Huskies vs Oregon State Beavers Prediction, 11/18/2023 College Football Picks, Best Bets & Odds","Washington Huskies vs Oregon State Beavers Prediction, 11/18/2023 College Football Picks, Best Bets & Odds","Washington Huskies vs Oregon State Beavers Prediction , 11/18/2023 College Football Picks , Best Bets & odd",other,Others
"College football Week 12 odds, schedule: Undefeated Washington an underdog at Oregon State","College football Week 12 odds, schedule: Undefeated Washington an underdog at Oregon State","college football Week 12 odd , schedule : Undefeated Washington underdog Oregon State",other,Others
Beavers Set For Top-10 Matchup Saturday At Reser - Oregon State University Athletics,Beavers Set For Top-10 Matchup Saturday At Reser - Oregon State University Athletics,beaver set Top-10 Matchup Saturday At Reser - Oregon State University Athletics,other,Others
CFB Betting Preview: No. 5 Washington at No. 11 Oregon State,CFB Betting Preview: No. 5 Washington at No. 11 Oregon State,CFB Betting Preview : . 5 Washington No . 11 Oregon State,other,Others
Pac-12 Football Notes: Is Oregon State a Title Contender?,Pac-12 Football Notes: Is Oregon State a Title Contender?,Pac-12 Football note : Oregon State Title Contender ?,other,Others
Pac-12 After Dark crew looks ahead to No. 5 Washington at No. 12 Oregon State,Pac-12 After Dark crew looks ahead to No. 5 Washington at No. 12 Oregon State,Pac-12 Dark crew look ahead No . 5 Washington No . 12 Oregon State,other,Others
College Football: Week 12 betting odds and early thoughts,College Football: Week 12 betting odds and early thoughts,College Football : week 12 bet odd early thought,other,Others
WATCH: Oregon State Defense Previews Washington & MORE,WATCH: Oregon State Defense Previews Washington & MORE,WATCH : Oregon State Defense Previews Washington & MORE,other,Others
Browns' Andrew Berry Shares Latest on Deshaun Watson Season-Ending Shoulder Surgery,Browns' Andrew Berry Shares Latest on Deshaun Watson Season-Ending Shoulder Surgery,brown ' Andrew Berry share Latest Deshaun Watson Season - Ending Shoulder Surgery,other,Others
