title,title_english,processed_title,League Name,category
NFL Week 10 grades: Broncos earn 'A-' for shocking Monday win over Bills; Browns get an 'A' for beating Ravens,NFL Week 10 grades: Broncos earn 'A-' for shocking Monday win over Bills; Browns get an 'A' for beating Ravens,NFL Week 10 grade : Broncos earn ' a- ' shocking Monday win Bills ; Browns get ' ' beat Ravens,nfl,Football
"Broncos win third straight, beat miscue-laden Bills on Monday night - ESPN","Broncos win third straight, beat miscue-laden Bills on Monday night - ESPN","Broncos win third straight , beat miscue - laden Bills Monday night - ESPN",other,Others
Angry fans in Buffalo turn on each other as fists fly in the stands of Highmark Stadium... as the Bills lose t,Angry fans in Buffalo turn on each other as fists fly in the stands of Highmark Stadium... as the Bills lose t,angry fan Buffalo turn fist fly stand Highmark Stadium ... Bills lose,other,Others
Monday Night Football: Broncos top Bills with walk-off FG to cap mistake-filled game,Monday Night Football: Broncos top Bills with walk-off FG to cap mistake-filled game,Monday Night Football : Broncos top Bills walk - FG cap mistake - fill game,other,Others
Why are we still doing pregame predictions in 2023?,Why are we still doing pregame predictions in 2023?,still pregame prediction 2023 ?,other,Others
Denver Broncos at Buffalo Bills: Five Bold Predictions,Denver Broncos at Buffalo Bills: Five Bold Predictions,Denver Broncos Buffalo Bills : five Bold prediction,other,Others
NFL Week 10 Best Bets: Denver Broncos vs Buffalo Bills Picks for Monday Night Football,NFL Week 10 Best Bets: Denver Broncos vs Buffalo Bills Picks for Monday Night Football,NFL Week 10 Best bet : Denver Broncos vs Buffalo Bills pick Monday Night Football,nfl,Football
"2023 NFL season, Week 10: What We Learned from Broncos' win over Bills on Monday night","2023 NFL season, Week 10: What We Learned from Broncos' win over Bills on Monday night","2023 NFL season , Week 10 : learn Broncos ' win Bills Monday night",nfl,Football
"Bills vs. Broncos line, odds, start time: Spread pick, best bets for NFL Week 10 Monday Night Football game","Bills vs. Broncos line, odds, start time: Spread pick, best bets for NFL Week 10 Monday Night Football game","Bills vs. Broncos line , odd , start time : spread pick , good bet NFL Week 10 Monday Night Football game",nfl,Football
"Bills vs. Broncos | How to watch, stream & listen | Monday Night Football Week 10","Bills vs. Broncos | How to watch, stream & listen | Monday Night Football Week 10","Bills vs. Broncos | watch , stream & listen | Monday Night Football Week 10",other,Others
Monday Night Football: Broncos beat Bills 24-22 on last-play field goal,Monday Night Football: Broncos beat Bills 24-22 on last-play field goal,Monday Night Football : Broncos beat Bills 24 - 22 last - play field goal,other,Others
K Wil Lutz captures Broncos' third-straight win with 36-yard field goal | Broncos at Bills,K Wil Lutz captures Broncos' third-straight win with 36-yard field goal | Broncos at Bills,K Wil Lutz capture Broncos ' third - straight win 36 - yard field goal | Broncos bill,other,Others
"Denver Broncos 24, Buffalo Bills 22: Final score, recap, highlights after game-winning FG","Denver Broncos 24, Buffalo Bills 22: Final score, recap, highlights after game-winning FG","Denver Broncos 24 , Buffalo Bills 22 : final score , recap , highlight game - win FG",other,Others
Evan Silva’s Matchups: Broncos at Bills,,Evan Silva ’s Matchups : Broncos bill,other,Others
Bills' Costly Penalty Baffles MNF Viewers After Broncos Capitalize on Mistake to Win Game,Bills' Costly Penalty Baffles MNF Viewers After Broncos Capitalize on Mistake to Win Game,bill ' Costly Penalty Baffles MNF Viewers Broncos Capitalize Mistake win game,other,Others
"Broncos four downs: Russell Wilson just cooked Josh Allen, Bills in their own dang kitchen","Broncos four downs: Russell Wilson just cooked Josh Allen, Bills in their own dang kitchen","Broncos four : Russell Wilson cook Josh Allen , Bills dang kitchen",other,Others
"Broncos-Bills score: Monday Night Football highlights, top plays","Broncos-Bills score: Monday Night Football highlights, top plays","Broncos - Bills score : Monday Night Football highlight , top play",other,Others
Is Bills’ season over in November? Buffalo loses in final seconds to Broncos (Observations),Is Bills’ season over in November? Buffalo loses in final seconds to Broncos (Observations),Bills ' season November ? Buffalo lose final second Broncos ( Observations ),other,Others
NFL Week 10: Broncos-Bills predictions for Monday Night Football,NFL Week 10: Broncos-Bills predictions for Monday Night Football,NFL Week 10 : Broncos - Bills prediction Monday Night Football,nfl,Football
"Von Miller injured knee showing improvement with Buffalo ready to host Broncos, his former team","Von Miller injured knee showing improvement with Buffalo ready to host Broncos, his former team","Von Miller injure knee show improvement Buffalo ready host Broncos , former team",other,Others
Buffalo Bills trail Denver Broncos 15-8 at halftime,Buffalo Bills trail Denver Broncos 15-8 at halftime,Buffalo Bills trail Denver Broncos 15 - 8 halftime,other,Others
NFL Week 10 Recap: Immediate fantasy football takeaways from Broncos-Bills Thursday Night Football | Fantasy ...,NFL Week 10 Recap: Immediate fantasy football takeaways from Broncos-Bills Thursday Night Football | Fantasy ...,NFL Week 10 recap : immediate fantasy football takeaway Broncos - Bills Thursday Night Football | Fantasy ...,nfl,Football
Watch: Russell Wilson pulls off most improbable touchdown in Next Gen Stats history,Watch: Russell Wilson pulls off most improbable touchdown in Next Gen Stats history,watch : Russell Wilson pull improbable touchdown Next Gen Stats history,other,Others
"3 NFL Player Prop Bets for Monday Night Football: Week 10, Broncos at Bills","3 NFL Player Prop Bets for Monday Night Football: Week 10, Broncos at Bills","3 NFL Player Prop Bets Monday Night Football : Week 10 , Broncos bill",nfl,Football
‘A lot of bad football’: Sloppy Bills gift Broncos win with 12 men on field penalty,‘A lot of bad football’: Sloppy Bills gift Broncos win with 12 men on field penalty,' lot bad football ' : Sloppy Bills gift Broncos win 12 man field penalty,other,Others
Who plays Monday Night Football tonight? How to watch NFL Week 10 game,Who plays Monday Night Football tonight? How to watch NFL Week 10 game,play Monday Night Football tonight ? watch NFL Week 10 game,nfl,Football
"Broncos face desperate Bills, Highmark Stadium 'buzzsaw' in MNF clash","Broncos face desperate Bills, Highmark Stadium 'buzzsaw' in MNF clash","bronco face desperate Bills , Highmark Stadium ' buzzsaw ' MNF clash",other,Others
‘Monday Night Football’ Week 10 expert picks: Broncos at Bills,‘Monday Night Football’ Week 10 expert picks: Broncos at Bills,' Monday Night Football ' week 10 expert pick : bronco bill,other,Others
"Broncos vs. Bills line, odds and predictions: Our experts like Buffalo to beat Denver","Broncos vs. Bills line, odds and predictions: Our experts like Buffalo to beat Denver","Broncos vs. Bills line , odd prediction : expert like Buffalo beat Denver",other,Others
MNF: Denver Broncos @ Buffalo Bills Live Thread & Game Information,MNF: Denver Broncos @ Buffalo Bills Live Thread & Game Information,MNF : Denver Broncos @ Buffalo Bills Live Thread & Game Information,other,Others
Wilson and Payton can prove their worth in monster game,Wilson and Payton can prove their worth in monster game,Wilson Payton prove worth monster game,other,Others
Monday Night Football highlights: Broncos stun Bills on game-winning field goal,Monday Night Football highlights: Broncos stun Bills on game-winning field goal,Monday Night Football highlight : Broncos stun Bills game - win field goal,other,Others
Horse Tracks: Gameday in Broncos Country,Horse Tracks: Gameday in Broncos Country,Horse track : Gameday Broncos Country,other,Others
Cincy Jungle staff picks for Monday Night Football and open thread,Cincy Jungle staff picks for Monday Night Football and open thread,Cincy Jungle staff pick Monday Night Football open thread,other,Others
Fantasy Football Picks: Broncos vs. Bills DraftKings NFL DFS MNF Showdown Strategy,Fantasy Football Picks: Broncos vs. Bills DraftKings NFL DFS MNF Showdown Strategy,Fantasy Football Picks : Broncos vs. Bills DraftKings NFL DFS MNF Showdown Strategy,nfl,Football
"MNF Anytime Touchdown Picks: Courtland Sutton, Gabe Davis Bets for Broncos vs Bills","MNF Anytime Touchdown Picks: Courtland Sutton, Gabe Davis Bets for Broncos vs Bills","MNF Anytime Touchdown Picks : Courtland Sutton , Gabe Davis Bets Broncos vs Bills",other,Others
NFL Fantasy Pick'ems for Broncos-Bills on Monday Night Football,NFL Fantasy Pick'ems for Broncos-Bills on Monday Night Football,NFL Fantasy pick'em Broncos - Bills Monday Night Football,nfl,Football
Broncos' Russell Wilson Excites NFL Fans with 'Vintage' Game in Upset Win vs. Bills,Broncos' Russell Wilson Excites NFL Fans with 'Vintage' Game in Upset Win vs. Bills,Broncos ' Russell Wilson Excites NFL Fans ' vintage ' Game Upset Win vs. bill,nfl,Football
Buffalo Bills prepare for the Denver Broncos on Monday Night Football,Buffalo Bills prepare for the Denver Broncos on Monday Night Football,Buffalo Bills prepare Denver Broncos Monday Night Football,other,Others
Week 10 Monday Night Football Single-Game NFL DFS: Top FanDuel & DraftKings Plays,Week 10 Monday Night Football Single-Game NFL DFS: Top FanDuel & DraftKings Plays,week 10 Monday Night Football Single - Game NFL DFS : Top FanDuel & DraftKings Plays,nfl,Football
Broncos vs. Bills Monday Night thread: Another Russell Wilson primetime game,Broncos vs. Bills Monday Night thread: Another Russell Wilson primetime game,Broncos vs. Bills Monday Night thread : another Russell Wilson primetime game,other,Others
Broncos vs Bills player props: Three MNF picks,Broncos vs Bills player props: Three MNF picks,Broncos vs Bills player prop : three MNF pick,other,Others
"Broncos vs. Bills final score, results: Denver earns road upset as late penalties cost Buffalo","Broncos vs. Bills final score, results: Denver earns road upset as late penalties cost Buffalo","Broncos vs. Bills final score , result : Denver earn road upset late penalty cost Buffalo",other,Others
Best Bets: Broncos at Bills (MNF Open Thread),Best Bets: Broncos at Bills (MNF Open Thread),good Bets : bronco Bills ( MNF Open Thread ),other,Others
Erik Brady: Remembering the rare white buffalo Bills helmet as Broncos return for MNF,Erik Brady: Remembering the rare white buffalo Bills helmet as Broncos return for MNF,Erik Brady : remember rare white buffalo Bills helmet Broncos return MNF,other,Others
Monday Night Football Anytime TD Scorer Picks: Top Anytime TD Scorer Bets for Broncos vs. Bills,Monday Night Football Anytime TD Scorer Picks: Top Anytime TD Scorer Bets for Broncos vs. Bills,Monday Night Football Anytime TD Scorer pick : Top Anytime TD Scorer Bets Broncos vs. Bills,other,Others
Bills' penalty disaster gives Broncos lifeline for game-winning kick after miss,Bills' penalty disaster gives Broncos lifeline for game-winning kick after miss,bill ' penalty disaster give Broncos lifeline game - win kick miss,other,Others
Should You Start Javonte Williams or Jaleel McLaughlin in Fantasy Football Week 10?,Should You Start Javonte Williams or Jaleel McLaughlin in Fantasy Football Week 10?,start Javonte Williams Jaleel McLaughlin Fantasy Football Week 10 ?,other,Others
4 days and 3 nights in Buffalo? Broncos coach Sean Payton wants his players to get their sleep,4 days and 3 nights in Buffalo? Broncos coach Sean Payton wants his players to get their sleep,4 day 3 night Buffalo ? Broncos coach Sean Payton want player get sleep,other,Others
Buffalo Bills: Stefon Diggs' injury and what it means for Week 10,Buffalo Bills: Stefon Diggs' injury and what it means for Week 10,Buffalo bill : Stefon Diggs ' injury mean Week 10,other,Others
"MNF Broncos at Bills Week 10, odds, picks & live discussion","MNF Broncos at Bills Week 10, odds, picks & live discussion","MNF Broncos Bills Week 10 , odd , pick & live discussion",other,Others
Week 10 Fantasy Football Booms and Busts: C.J. Stroud does it again,Week 10 Fantasy Football Booms and Busts: C.J. Stroud does it again,week 10 Fantasy Football Booms bust : C.J. Stroud,other,Others
"Steeled by lessons off the field, C.J. Stroud is taking the NFL by storm","Steeled by lessons off the field, C.J. Stroud is taking the NFL by storm","steel lesson field , C.J. Stroud take NFL storm",nfl,Football
Houston Texans rookie QB C.J. Stroud NFL star is born - ESPN,Houston Texans rookie QB C.J. Stroud NFL star is born - ESPN,Houston Texans rookie QB C.J. Stroud NFL star bear - ESPN,nfl,Football
C.J. Stroud Is Already One of the Best Rookie Quarterbacks Ever,C.J. Stroud Is Already One of the Best Rookie Quarterbacks Ever,C.J. Stroud already one Best Rookie Quarterbacks ever,other,Others
"Forget Rookie Of The Year, We Should Be Talking About CJ Stroud As The MVP","Forget Rookie Of The Year, We Should Be Talking About CJ Stroud As The MVP","forget Rookie Year , talk CJ Stroud MVP",other,Others
C.J. Stroud shows why Steelers should not be content with Kenny Pickett,C.J. Stroud shows why Steelers should not be content with Kenny Pickett,C.J. Stroud show steeler content Kenny Pickett,other,Others
Rookie quarterback C.J. Stroud creates a flash of hope,Rookie quarterback C.J. Stroud creates a flash of hope,Rookie quarterback C.J. Stroud create flash hope,other,Others
"FMIA Week 10: C.J. Stroud taking off, while it time to ground Zach Wilson","FMIA Week 10: C.J. Stroud taking off, while it time to ground Zach Wilson","fmia Week 10 : C.J. Stroud take , time ground Zach Wilson",other,Others
"Fantasy football winners, losers: Texans' Noah Brown lights up Week 10","Fantasy football winners, losers: Texans' Noah Brown lights up Week 10","fantasy football winner , loser : Texans ' Noah Brown light Week 10",other,Others
Houston’s Stroud and Ryans have transformed a post-Deshaun Watson wasteland,Houston’s Stroud and Ryans have transformed a post-Deshaun Watson wasteland,Houston ’s Stroud Ryans transform post - deshaun Watson wasteland,other,Others
"Texans' CJ Stroud talks relationship with God, how it helps him lead in intense moments","Texans' CJ Stroud talks relationship with God, how it helps him lead in intense moments","Texans ' CJ Stroud talk relationship God , help lead intense moment",other,Others
C.J. Stroud Is Making a Serious Push for League MVP,C.J. Stroud Is Making a Serious Push for League MVP,C.J. Stroud make serious Push League MVP,other,Others
C.J. Stroud makes NFL history… again!,C.J. Stroud makes NFL history… again!,C.J. Stroud make NFL history … !,nfl,Football
C.J. Stroud quickly detonating Ohio State football’s NFL quarterback rap: Buckeye Breakfast,C.J. Stroud quickly detonating Ohio State football’s NFL quarterback rap: Buckeye Breakfast,C.J. Stroud quickly detonate Ohio State football ’s NFL quarterback rap : Buckeye Breakfast,nfl,Football
Jahmyr Gibbs' best plays from 2-TD game vs. Chargers Week 10,Jahmyr Gibbs' best plays from 2-TD game vs. Chargers Week 10,Jahmyr Gibbs ' good play 2 - TD game vs. Chargers Week 10,other,Others
'Calm in the chaos': How Texans QB C.J. Stroud beat the Bengals,'Calm in the chaos': How Texans QB C.J. Stroud beat the Bengals,' calm chaos ' : Texans QB C.J. Stroud beat bengal,other,Others
C.J. Stroud is the NFL best rookie and a lesson for other franchises,C.J. Stroud is the NFL best rookie and a lesson for other franchises,C.J. Stroud NFL good rookie lesson franchise,nfl,Football
"Texans' C.J. Stroud says he praying for his incarcerated father to see him play, calls out prison conditions","Texans' C.J. Stroud says he praying for his incarcerated father to see him play, calls out prison conditions","Texans ' C.J. Stroud say pray incarcerate father see play , call prison condition",other,Others
NFL MVP race: C.J. Stroud builds case leading frisky Texans,NFL MVP race: C.J. Stroud builds case leading frisky Texans,NFL MVP race : C.J. Stroud build case lead frisky Texans,nfl,Football
Stroud on Texans' Win vs. Bengals: 'I Made This Game a Little Harder Than It Needed',Stroud on Texans' Win vs. Bengals: 'I Made This Game a Little Harder Than It Needed',Stroud Texans ' Win vs. bengal : ' I make Game little hard need ',other,Others
Texans beat Bengals 30-27 after driving for game-winning field goal,Texans beat Bengals 30-27 after driving for game-winning field goal,Texans beat Bengals 30 - 27 drive game - win field goal,other,Others
Archdeacon: Stroud on late-game heroics — 'I was gonna go prove myself again',Archdeacon: Stroud on late-game heroics — 'I was gonna go prove myself again',archdeacon : Stroud late - game heroic — ' I go go prove ',other,Others
C.J. Stroud deserves to be in the MVP conversation,C.J. Stroud deserves to be in the MVP conversation,C.J. Stroud deserve MVP conversation,other,Others
The Texans' offseason work set rookie QB CJ Stroud up for success,The Texans' offseason work set rookie QB CJ Stroud up for success,Texans ' offseason work set rookie QB CJ Stroud success,other,Others
Joe Burrow best plays from 367-yard game Week 10,Joe Burrow best plays from 367-yard game Week 10,Joe Burrow well play 367 - yard game Week 10,other,Others
Justin Herbert Best Plays From 4-TD Game vs. Lions Week 10,Justin Herbert Best Plays From 4-TD Game vs. Lions Week 10,Justin Herbert Best play 4 - TD Game vs. Lions Week 10,other,Others
Raiders 2023 Week 9 Highlights vs. Giants | Jakobi Meyers scores rushing touchdown on opening drive,Raiders 2023 Week 9 Highlights vs. Giants | Jakobi Meyers scores rushing touchdown on opening drive,raider 2023 week 9 Highlights vs. Giants | Jakobi Meyers score rush touchdown open drive,other,Others
Broncos Bills Football | Subscriber Content | gazette.com,Broncos Bills Football | Subscriber Content | gazette.com,Broncos Bills Football | Subscriber Content | gazette.com,other,Others
Jakobi Meyers shows off his speed on 17-yard end-around TD,Jakobi Meyers shows off his speed on 17-yard end-around TD,Jakobi Meyers show speed 17 - yard end - around TD,other,Others
Highlights: C.J. Stroud best plays from 364-yard game | Week 10,Highlights: C.J. Stroud best plays from 364-yard game | Week 10,highlight : C.J. Stroud good play 364 - yard game | Week 10,other,Others
Keenan Allen Best Catches from 175-Yard Game vs. Lions Week 10,Keenan Allen Best Catches from 175-Yard Game vs. Lions Week 10,Keenan Allen Best Catches 175 - Yard Game vs. Lions Week 10,other,Others
Sixers visit Kelly Oubre Jr. as he recovers from broken rib suffered when he was hit by a car,Sixers visit Kelly Oubre Jr. as he recovers from broken rib suffered when he was hit by a car,sixer visit Kelly Oubre Jr. recover broken rib suffer hit car,other,Others
"Michigan vs. St. John score, takeaways: Wolverines spoil Rick Pitino return to Madison Square Garden","Michigan vs. St. John score, takeaways: Wolverines spoil Rick Pitino return to Madison Square Garden","Michigan vs. St. John score , takeaway : wolverine spoil Rick Pitino return Madison Square Garden",other,Others
"How statement upset win over Bengals pushes Stroud, Texans expectations to new heights","How statement upset win over Bengals pushes Stroud, Texans expectations to new heights","statement upset win Bengals push Stroud , Texans expectation new height",other,Others
C.J. Stroud MVP odds: Can Texans QB become rare rookie to win NFL top on-field award?,C.J. Stroud MVP odds: Can Texans QB become rare rookie to win NFL top on-field award?,C.J. Stroud MVP odd : Texans QB become rare rookie win NFL top - field award ?,nfl,Football
Why is Houston Texans quarterback C.J. Stroud father in jail?,Why is Houston Texans quarterback C.J. Stroud father in jail?,Houston Texans quarterback C.J. Stroud father jail ?,other,Others
NFL Week 10 Takeaways: C.J. Stroud playing his way into MVP conversation,NFL Week 10 Takeaways: C.J. Stroud playing his way into MVP conversation,NFL Week 10 takeaway : C.J. Stroud play way MVP conversation,nfl,Football
Houston Texans earn a statement win over Bengals,Houston Texans earn a statement win over Bengals,Houston Texans earn statement win bengal,other,Others
Houston Texans: C.J Stroud Breaks Rookie Single Game Passing Yards Record in Week 9 win,Houston Texans: C.J Stroud Breaks Rookie Single Game Passing Yards Record in Week 9 win,Houston Texans : C.J Stroud Breaks Rookie Single Game Passing Yards Record Week 9 win,other,Others
"Sunday 7: C.J. Stroud Does It Again, Browns Stun Ravens, 49ers Roll, Walk-Offs, More","Sunday 7: C.J. Stroud Does It Again, Browns Stun Ravens, 49ers Roll, Walk-Offs, More","Sunday 7 : C.J. Stroud , Browns Stun Ravens , 49er Roll , Walk - Offs , More",other,Others
C.J. Stroud leaves NFL fans speechless as Texans quarterback drops ‘iconic’ celebration during Bengals win...,C.J. Stroud leaves NFL fans speechless as Texans quarterback drops ‘iconic’ celebration during Bengals win...,C.J. Stroud leave NFL fan speechless Texans quarterback drop ' iconic ' celebration Bengals win ...,nfl,Football
HIGHLIGHTS: Buccaneers Defeated by Houston Texans 39-37 Week 9,HIGHLIGHTS: Buccaneers Defeated by Houston Texans 39-37 Week 9,HIGHLIGHTS : buccaneer defeat Houston Texans 39 - 37 week 9,other,Others
"Texans quarterback CJ Stroud pleads for prison reform, calls US criminal justice system 'corrupt'","Texans quarterback CJ Stroud pleads for prison reform, calls US criminal justice system 'corrupt'","Texans quarterback CJ Stroud plead prison reform , call US criminal justice system ' corrupt '",other,Others
Dare Ogunbowale remains Texans' emergency kicker after rare FG,Dare Ogunbowale remains Texans' emergency kicker after rare FG,dare Ogunbowale remain Texans ' emergency kicker rare FG,other,Others
NFL Week 10 Quarterback Power Rankings: C.J. Stroud Enters Top 10,,NFL Week 10 Quarterback Power ranking : C.J. Stroud Enters Top 10,nfl,Football
Notes and stats from the Bucs 39-37 loss to the Texans,Notes and stats from the Bucs 39-37 loss to the Texans,note stat Bucs 39 - 37 loss Texans,other,Others
Texans QB C.J. Stroud sets single-game rookie passing record with 470 yards in comeback win over Buccaneers,Texans QB C.J. Stroud sets single-game rookie passing record with 470 yards in comeback win over Buccaneers,Texans QB C.J. Stroud set single - game rookie pass record 470 yard comeback win buccaneer,other,Others
"NFL Week 9 Best Bets: Matchup angles to bet, including Texans QB C.J. Stroud against the Tampa Bay Buccaneers ...","NFL Week 9 Best Bets: Matchup angles to bet, including Texans QB C.J. Stroud against the Tampa Bay Buccaneers ...","NFL Week 9 Best bet : Matchup angle bet , include Texans QB C.J. Stroud Tampa Bay buccaneer ...",nfl,Football
Sixers' Kelly Oubre has fractured rib after being hit by car - ESPN,Sixers' Kelly Oubre has fractured rib after being hit by car - ESPN,sixer ' Kelly Oubre fracture rib hit car - ESPN,other,Others
Philadelphia 76ers guard Kelly Oubre Jr. struck by vehicle on Spruce and Hicks streets,Philadelphia 76ers guard Kelly Oubre Jr. struck by vehicle on Spruce and Hicks streets,Philadelphia 76er guard Kelly Oubre Jr. strike vehicle Spruce Hicks street,other,Others
"76ers guard Kelly Oubre Jr. struck by vehicle, hospitalized with injuries","76ers guard Kelly Oubre Jr. struck by vehicle, hospitalized with injuries","76er guard Kelly Oubre Jr. strike vehicle , hospitalize injury",other,Others
"76ers' Kelly Oubre Jr. hurt, rib broken, after being hit by vehicle while walking in Center City","76ers' Kelly Oubre Jr. hurt, rib broken, after being hit by vehicle while walking in Center City","76er ' Kelly Oubre Jr. hurt , rib break , hit vehicle walk Center City",other,Others
Search for driver after 76ers' Kelly Oubre Jr. suffers fractured rib in hit-and-run,Search for driver after 76ers' Kelly Oubre Jr. suffers fractured rib in hit-and-run,search driver 76er ' Kelly Oubre Jr. suffer fractured rib hit - - run,other,Others
Steph Curry reveals the Warriors prayed for Kelly Oubre Jr.,Steph Curry reveals the Warriors prayed for Kelly Oubre Jr.,Steph Curry reveal warrior pray Kelly Oubre Jr.,other,Others
"NBA Star Kelly Oubre Jr. Struck by Vehicle, Hospitalized in Philadelphia","NBA Star Kelly Oubre Jr. Struck by Vehicle, Hospitalized in Philadelphia","NBA Star Kelly Oubre Jr. Struck Vehicle , hospitalize Philadelphia",nba,Basketball
"Ex-Suns F Kelly Oubre Jr. hit by vehicle, in stable condition","Ex-Suns F Kelly Oubre Jr. hit by vehicle, in stable condition","Ex - Suns F Kelly Oubre Jr. hit vehicle , stable condition",other,Others
"Michigan 89-73 St. John (Nov 13, 2023) Game Recap",,"Michigan 89 - 73 St. John ( Nov 13 , 2023 ) Game recap",other,Others
Rick Pitino Blames Adding So Many Transfers for St. John Blowout Loss to Michigan,Rick Pitino Blames Adding So Many Transfers for St. John Blowout Loss to Michigan,Rick Pitino blame add many transfer St. John Blowout Loss Michigan,other,Others
St. John suffers ugly loss to Michigan in Rick Pitino MSG debut as coach,St. John suffers ugly loss to Michigan in Rick Pitino MSG debut as coach,St. John suffer ugly loss Michigan Rick Pitino MSG debut coach,other,Others
Michigan passes first road test with 89-73 win over Pitino Red Storm in New York,Michigan passes first road test with 89-73 win over Pitino Red Storm in New York,Michigan pass first road test 89 - 73 win Pitino Red Storm New York,other,Others
No Garden Party: St. John’s blown out by Michigan in Rick Pitino’s MSG opener,No Garden Party: St. John’s blown out by Michigan in Rick Pitino’s MSG opener,Garden Party : St. John ’s blow Michigan Rick Pitino ’s MSG opener,other,Others
